author,author_flair_text,clicked,created_utc,distinguished,edited,id,is_original_content,is_self,link_flair_text,locked,name,num_comments,over_18,permalink,saved,score,selftext,spoiler,stickied,subreddit_name,title,upvote_ratio,url
Maxesse,None,None,1548329006,None,None,ajbhjw,None,TRUE,None,None,t3_ajbhjw,15,None,/r/ElectricCarUK/comments/ajbhjw/ive_made_an_app_for_octopus_energy_customers/,None,9,"Hi there, as a Tesla owner who uses Octopus Energy for the agile tariffs, I was a bit frustrated having to open the mobile website, authenticate, and click everywhere just to see whether the tariffs were good or not at a particular moment.

So I made a native iOS app that does exactly that, and also shows your electricity consumption per day and per hour for the past 30 days without having to wait for the bill to be issued. By checking the rolling 30 days costs you can tell whether you're spending more or less.

I thought I'd share the link here in case any other Octopus customers fancy giving it a spin. It's free for now, but I was thinking to put it at £0.99 in a month or two.

Also - in regards to the credentials, the app doesn't store or send your octopus credentials anywhere, it logs in in the background, gathers your API key (you need to generate it before using the app), your MPAN and serial number, and then stores those values instead.

[https://itunes.apple.com/gb/app/octopus-energy-watchdog/id1439618267?mt=8](https://itunes.apple.com/gb/app/octopus-energy-watchdog/id1439618267?mt=8)

I've already planned to add a few more things in future, namely a home widget, gas consumption, Siri shortcuts ('hey Siri how much is the electricity now?' etc.).",None,None,ElectricCarUK,I've made an app for Octopus Energy customers,1,https://www.reddit.com/r/ElectricCarUK/comments/ajbhjw/ive_made_an_app_for_octopus_energy_customers/
FillingUpTheDatabase,None,None,1622556299,None,None,npusqp,None,None,News,None,t3_npusqp,6,None,/r/ElectricCarUK/comments/npusqp/bp_pulse_pricing_update/,None,6,None,None,None,ElectricCarUK,BP Pulse Pricing Update,0.88,https://i.imgur.com/t3axcIf.jpg
r08shaw,None,None,1547732573,None,None,agxvl7,None,None,None,None,t3_agxvl7,2,None,/r/ElectricCarUK/comments/agxvl7/used_a_contactless_payment_rapid_charger_for_the/,None,8,None,None,None,ElectricCarUK,Used a contactless payment rapid charger for the first time - What a revelation! ALL chargers should be like this!,0.9,https://youtu.be/83BRL_0V-GE
r08shaw,None,None,1558425772,None,None,br7n7x,None,None,None,None,t3_br7n7x,2,None,/r/ElectricCarUK/comments/br7n7x/1_in_10_drivers_think_you_cant_take_an_ev_through/,None,4,None,None,None,ElectricCarUK,1 in 10 drivers think you can't take an EV through a car wash...,0.84,https://www.driving.co.uk/news/one-in-10-drivers-think-electric-cars-cant-be-used-in-rain/
Adorable_Row3166,None,None,1641647769,None,None,ryzmzz,None,TRUE,None,None,t3_ryzmzz,4,None,/r/ElectricCarUK/comments/ryzmzz/survey_for_my_investigation_into_impacts_of/,None,4,"HI, i am doing an investigation into the impacts of electric cars for my school work, if you own and electric vehicle or even a hybrid filling out this survey would be a massive help. all information will be kept private and used more my investigation only

thanks

[https://forms.gle/Ufod5p6XiEe4Qkhm8](https://forms.gle/Ufod5p6XiEe4Qkhm8)",None,None,ElectricCarUK,Survey for my investigation into impacts of electric cars. I am doing a school piece on electric cars and it would really help if you could fill out this form.,1,https://www.reddit.com/r/ElectricCarUK/comments/ryzmzz/survey_for_my_investigation_into_impacts_of/
Musicology91,None,None,1566389207,None,None,ctfwrf,None,TRUE,None,None,t3_ctfwrf,1,None,/r/ElectricCarUK/comments/ctfwrf/dont_visit_canterbury_in_an_electric_car/,None,4,"So Canterbury has 12 public chargers and all of them are for resident permit holders only. You can park for free as a non resident in every other space on the road. It doesn’t tell you this on the Zap-Map. Drive there, have a few miles left, pull up, can’t charge. Check other spaces, can’t charge there either. No wonder people are not choosing to have electric cars. It’s nothing to do with range of the vehicle. It’s idiot councils not allowing us access/maintaining the infrastructure!",None,None,ElectricCarUK,Don’t visit Canterbury in an electric car!,0.84,https://www.reddit.com/r/ElectricCarUK/comments/ctfwrf/dont_visit_canterbury_in_an_electric_car/
jayfell,None,None,1562059265,None,None,c87334,None,None,None,None,t3_c87334,1,None,/r/ElectricCarUK/comments/c87334/the_honda_e_on_fullychargedshow_httpstcoceesesevza/,None,5,None,None,None,ElectricCarUK,The Honda e on #FullyChargedShow https://t.co/cEeSesEvZa,1,https://twitter.com/bobbyllew/status/1145981982117191681?s=09
backstreetatnight,None,None,1555091910,None,None,bcgn64,None,None,None,None,t3_bcgn64,2,None,/r/ElectricCarUK/comments/bcgn64/etron_suv/,None,4,None,None,None,ElectricCarUK,E-Tron SUV,0.75,https://i.redd.it/19zcfa05hvr21.jpg
Feeling-Snow-1104,None,None,1694490941,None,None,16ggziz,None,None,News,None,t3_16ggziz,8,None,/r/ElectricCarUK/comments/16ggziz/onto_car_subscription_gone_bust/,None,3,Such a shame honestly. They also took down the community forum page they had.,None,None,ElectricCarUK,Onto car subscription gone bust,1,https://news.sky.com/story/electric-vehicle-leasing-group-onto-collapses-after-l-g-pulls-plug-12959126
EVRider81,None,None,1631299513,None,None,plr1su,None,TRUE,None,None,t3_plr1su,None,None,/r/ElectricCarUK/comments/plr1su/ev_day_in_ni/,None,3,"FASTER is a project launched to improve EV fast charging in Scotland,NI,and ROI,a presentation/webcast about the initiative was held on EV Day.Stats show rapid chargers in NI (21 at last count) are at a 1.1 to 100k population ratio,about a sixth of the UK average. Adding an anticipated 24 units by 2023 should double the present day ratio,while 3-4 of the current units are unavailable at last report..Meanwhile,A Speaker from Dundee flying in for the event was unable to hire an EV at the airport to attend.. #EVANI Faster Project",None,None,ElectricCarUK,EV Day in NI..,1,https://www.reddit.com/r/ElectricCarUK/comments/plr1su/ev_day_in_ni/
r08shaw,None,None,1622121574,None,None,nm7aat,None,TRUE,None,None,t3_nm7aat,1,None,/r/ElectricCarUK/comments/nm7aat/picking_up_an_audi_etron_sportback_soon_for/,None,3,"Anyone got anything they want me to cover? Full range test won't be possible but should be able to cover most other things.

Hopefully testing charge curve and will try to match/beat the efficiency figures.",None,None,ElectricCarUK,Picking up an Audi e-tron Sportback soon for review. Anything specific you want to see?,1,https://www.reddit.com/r/ElectricCarUK/comments/nm7aat/picking_up_an_audi_etron_sportback_soon_for/
clearlybritish,None,None,1620988412,None,1687774807,nc5hjy,None,TRUE,None,None,t3_nc5hjy,14,None,/r/ElectricCarUK/comments/nc5hjy/what_next/,None,3,"Fuck /u/spez , Long Live Apollo",None,None,ElectricCarUK,What Next?,1,https://www.reddit.com/r/ElectricCarUK/comments/nc5hjy/what_next/
coffeefuelledtechie,None,None,1613761616,None,None,lnnr29,None,TRUE,None,None,t3_lnnr29,7,None,/r/ElectricCarUK/comments/lnnr29/would_like_a_pod_point_but_no_wifi_or_mobile/,None,3,"I'm looking at getting an EV this year, and I've emailed a couple of installers to ask about feasibility as our apartment building (we own part of it so installing is okay to do) might be a little tricky to install with. I noticed that you can control the Pod Point through an app and it's WiFi enabled, but the main problem I'll have with that is I have virtually no mobile signal outside and where we park is the other side of the building, so no WiFi connection. Would this be too much of an issue?",None,None,ElectricCarUK,Would like a Pod Point but no WiFi or mobile signal outdoors,1,https://www.reddit.com/r/ElectricCarUK/comments/lnnr29/would_like_a_pod_point_but_no_wifi_or_mobile/
AJohnsonOrange,None,None,1601561416,None,None,j399uo,None,TRUE,None,None,t3_j399uo,17,None,/r/ElectricCarUK/comments/j399uo/just_passed_driving_test_could_do_with_a_bit_of/,None,3,"Hi peeps.

&#x200B;

Passed my driving test yesterday and am trying to work out the best thing to do but...lack of experience, y'know?  


My initial thought was plug in hybrid, but considering the government's stance on phasing out petrol/diesel new purchases I didn't know if it was prudent to just go all in on Electric. I've been eyeing up the Nissan Leaf (2017 model, not E+). There's a couple of things holding me back though:  


1) No personal charging point - Live in a block of flats without a personal charging point, though the supermarket next door and my work place both have charging points so I guess it isn't a massive issue? Have any of you been in this situation?  


2) Friends in distant lands - I have close friends up in Newcastle (I'm in the south so roughly 300 miles) so would be using that car to visit them. I'm assuming this would be a charge at the half way mark for an hour or two. It wouldn't be every weekend but I wouldn't want it to hamper me if I did want to visit them over the quick-fill of a plug in hybrid. Does anyone make long distance journeys on the regular?   


3) Journeys abroad - I have a big grand plan to drive over to Bled in Slovenia, but the fear that I won't be able to charge the car is worrying. I understand that it's not built for those kinds of journeys so it would need to be a ""Drive 200 miles, charge, relax in some town somewhere, drive another hundred, sleep for the night, drive another hundred in the AM, charge and relax for lunch, etc"" scenario, but if anyone has experience on major road trips and foreign charging that'd be good just so that I know what to expect.  


4) mains charging - am I right in assuming most electrics can charge off generic three pin plugs? So if I, say, visited family 100 miles away I could sling a cable inside and charge up while I visit them and then drive home end of day okay without having to hit up a specific charging points?   


5) With public EV charging points (as in on [https://www.zap-map.com/live/](https://www.zap-map.com/live/)) does the network matter? Is it just the connection you have to worry about? How panicky do you have to get when you hit 25% power when it comes to looking at the map and trying to marry up your car's connection to nearby points?

&#x200B;

I'm sorry if a lot of this has been answered elsewhere, I'm just not in the know about cars in general and don't want to mess this up. I'm spending time looking for answers, but anecdotal information allows me to also go and look up specific things as well and increase my base knowledge of electric cars. Sorry if it's a lot of Qs, please feel free to avoid answering things if you don't want to!",None,None,ElectricCarUK,"Just passed driving test, could do with a bit of advice",1,https://www.reddit.com/r/ElectricCarUK/comments/j399uo/just_passed_driving_test_could_do_with_a_bit_of/
evvehicle,None,None,1589696392,None,None,glajjj,None,None,None,None,t3_glajjj,None,None,/r/ElectricCarUK/comments/glajjj/impact_of_coronavirus_on_oil_petrol_and_diesel/,None,3,None,None,None,ElectricCarUK,Impact of coronavirus on oil petrol and diesel price,1,http://electricvehicleprice.com/impact-of-coronavirus-on-oil-price/
r08shaw,None,None,1558133992,None,None,bpy0fd,None,None,None,None,t3_bpy0fd,1,None,/r/ElectricCarUK/comments/bpy0fd/uk_debut_of_the_new_44kwh_mg_zs_ev_at_the_london/,None,3,None,None,None,ElectricCarUK,UK Debut of the New 44kWh MG ZS EV at the London Motorshow,1,https://youtu.be/p8LwdkAd7MM
backstreetatnight,None,None,1555156609,None,None,bcpr9c,None,None,None,None,t3_bcpr9c,None,None,/r/ElectricCarUK/comments/bcpr9c/model_s_75d/,None,4,None,None,None,ElectricCarUK,Model S 75D,0.75,https://i.redd.it/fm3ojmwit0s21.jpg
javierhurtadomontoya,None,None,1553101167,None,None,b3egl2,None,None,None,None,t3_b3egl2,None,None,/r/ElectricCarUK/comments/b3egl2/porsche_taycan_the_electric_revolution_now_on_a/,None,3,None,None,None,ElectricCarUK,Porsche Taycan. The electric revolution now on a sportscar.,1,https://carsandgo.home.blog/2019/02/20/porsche-taycan-deportividad-y-electrificacion-no-estan-renidas/
r08shaw,None,None,1548252506,None,None,aj01g6,None,None,None,None,t3_aj01g6,4,None,/r/ElectricCarUK/comments/aj01g6/nissan_to_offer_software_update_to_leaf_to_fix/,None,3,None,None,None,ElectricCarUK,Nissan to offer software update to Leaf to 'fix' RAPIDGATE,1,https://www.electrive.com/2019/01/22/nissan-updates-leaf-software-after-rapidgate/
Daily-Revs,None,None,1694243799,None,None,16dz907,None,None,None,None,t3_16dz907,None,None,/r/ElectricCarUK/comments/16dz907/2024_polestar_2_driving_performance/,None,2,None,None,None,ElectricCarUK,2024 Polestar 2 | Driving Performance !,1,https://youtube.com/watch?v=dc5ss4XoDtI&si=Q7ZZ52Z0Vowcfftu
rugbycyclist,None,None,1689666576,None,None,152ruhr,None,TRUE,None,None,t3_152ruhr,2,None,/r/ElectricCarUK/comments/152ruhr/thinking_of_getting_a_polestar_2_what_do_we_think/,None,2,Basically the title  trying to make sure I don't end up buying legacy tech.,None,None,ElectricCarUK,Thinking of getting a Polestar 2. What do we think of the car?,1,https://www.reddit.com/r/ElectricCarUK/comments/152ruhr/thinking_of_getting_a_polestar_2_what_do_we_think/
rob3342421,None,None,1689252997,None,None,14yk5gt,None,TRUE,None,None,t3_14yk5gt,4,None,/r/ElectricCarUK/comments/14yk5gt/newbie_apps/,None,2,"Hi there,

We’re having our Cupra Born delivered next week. We’re super excited but a little wary of charging out on the road. 

I want to get the necessary apps and memberships set up to make it as painless as possible, I was hoping someone could let me know the most prolific EV chargers/companies so that we can get the apps and profiles ready to go?

Thanks in advance!",None,None,ElectricCarUK,Newbie apps,1,https://www.reddit.com/r/ElectricCarUK/comments/14yk5gt/newbie_apps/
matt1234w,None,None,1688049782,None,None,14m6t85,None,None,None,None,t3_14m6t85,3,None,/r/ElectricCarUK/comments/14m6t85/ev_charger_at_home/,None,2,"My house is in red and has a block garage with drive that doesn’t have electric. The house next door owns the land behind our back garden and the front garden has a footpath in front of it. 

What are my options for charging an electric car from my own electricity supply?",None,None,ElectricCarUK,EV charger at home,1,https://i.redd.it/bbk21i6oyy8b1.jpg
aa599,None,None,1640640961,None,None,rpxzlb,None,TRUE,None,None,t3_rpxzlb,None,None,/r/ElectricCarUK/comments/rpxzlb/can_my_company_buy_me_an_ev_is_it_worth_it/,None,2,"I'm an IT contractor through my limited company, and do maybe 200 business miles a year.

I'm dangerously ignorant of company-car-for-private-use tax rules, but all I've seen is the ""1% benefit in kind"" headline.

So if my company bought (or leased?) an EV for my (almost entirely private) use, the cost comes entirely from the company, and it only costs me tax on 1% of the value each year?

That sounds much cheaper than buying it personally ... where's the catch?",None,None,ElectricCarUK,Can my company buy me an EV? Is it worth it?,1,https://www.reddit.com/r/ElectricCarUK/comments/rpxzlb/can_my_company_buy_me_an_ev_is_it_worth_it/
esuom47,None,None,1640638998,None,None,rpx9jq,None,TRUE,None,None,t3_rpx9jq,7,None,/r/ElectricCarUK/comments/rpx9jq/ev_without_a_driveway_for_charging/,None,2,"Are there any current work arounds for aspiring EV owners who don’t have a driveway in regards to charging? 

My partner and I would love an EV for our next car (still some time before we need to trade up yet) but we don’t want to have to install a driveway. 

Our city council is considering more EV charging points in our area but I don’t like the idea of relying on them 100% of the time to charge our car. 

I read somewhere a while back about possible removable batteries so you could charge them in the home but it doesn’t look like they’ll be a thing anytime soon?",None,None,ElectricCarUK,EV without a driveway for charging,1,https://www.reddit.com/r/ElectricCarUK/comments/rpx9jq/ev_without_a_driveway_for_charging/
SvenHjerson,None,None,1640152900,None,None,rlyjp5,None,TRUE,None,None,t3_rlyjp5,3,None,/r/ElectricCarUK/comments/rlyjp5/charger_at_home_in_wales_when_renting_getting_a/,None,2,None,None,None,ElectricCarUK,Charger at home in Wales when renting? Getting a charger installed for a EV seems to be very expensive and the owner does not want to pay anything. What are good options for someone who’s renting? Can a lease contract legally prevent changing energy supplier?,1,https://www.reddit.com/r/ElectricCarUK/comments/rlyjp5/charger_at_home_in_wales_when_renting_getting_a/
Smithy20202,None,None,1620912212,None,None,nbgjml,None,TRUE,None,None,t3_nbgjml,6,None,/r/ElectricCarUK/comments/nbgjml/longer_journeys_in_an_electric_car/,None,2,"Hi All

I am hoping to benefit from your experience.  My last 2 cars have been plug in hybrids but now I am looking to go fully electric.

90% of my driving is short journeys - max 50 miles each way at weekends.

However, occasionally we travel London to Edinburgh or down to France.  

The question mark I have right now is how feasible is it?  I am sure I can plan sensible stops etc but what are people's experiences of finding charging points etc?

I am looking at cars with claimed ranges of over 200 miles - just for info.

Many thanks",None,None,ElectricCarUK,Longer journeys in an electric car,1,https://www.reddit.com/r/ElectricCarUK/comments/nbgjml/longer_journeys_in_an_electric_car/
dannylenwinn,None,None,1599749731,None,None,iq4v64,None,None,News,None,t3_iq4v64,2,None,/r/ElectricCarUK/comments/iq4v64/great_britain_reveals_opel_vivaroe_life/,None,2,None,None,None,ElectricCarUK,"Great Britain reveals Opel Vivaro-e Life, all-electric minibus model, first light commercial vehicle which may set a trend for zero emission goods and services vehicles and vans in the urban market - can go on for around 230 km (143 miles) once fully charged.",1,https://www.formacar.com/en/news/view/29290.html
green-biz,None,None,1564746909,None,None,cl347x,None,TRUE,None,None,t3_cl347x,3,None,/r/ElectricCarUK/comments/cl347x/range_hopes_for_evs/,None,2,"What range do you think would make the uptake of EVs a no-brainer?

I personally think 270ish is plenty but I get that range anxiety stops people. I think if we can get EVs reaching 400mile range that would be the tipping point for most drivers.",None,None,ElectricCarUK,Range hopes for EVs,1,https://www.reddit.com/r/ElectricCarUK/comments/cl347x/range_hopes_for_evs/
r08shaw,None,None,1561652093,None,None,c67glh,None,TRUE,News,None,t3_c67glh,None,None,/r/ElectricCarUK/comments/c67glh/new_hertfordshire_ev_group/,None,2,"If you are interested in [**electric vehicles**](https://twitter.com/hashtag/electricvehicles?src=hash) and live in  [**Hertfordshire**](https://twitter.com/hashtag/Hertfordshire?src=hash), then there is a new Facebook group, [http://facebook.com/groups/HertsEVs ](https://t.co/AzJ3UP4RIT) and Twitter channel, [~~@~~**HertsEVs**](https://twitter.com/HertsEVs). If you are thinking about making the switch to an EV, then this is the place to meet existing owners in Hertfordshire and maybe even attend a meet-up to talk to one of us.",None,None,ElectricCarUK,New Hertfordshire EV Group,1,https://www.reddit.com/r/ElectricCarUK/comments/c67glh/new_hertfordshire_ev_group/
r08shaw,None,None,1557243270,None,None,bls4qt,None,None,None,None,t3_bls4qt,2,None,/r/ElectricCarUK/comments/bls4qt/tried_to_use_a_tesla_destination_charger_with_my/,None,2,None,None,None,ElectricCarUK,Tried to use a Tesla Destination Charger with my 2018 Leaf... NOPE!,0.75,https://youtu.be/DKk0mOChQ9M
jeccy1123,None,None,1703056311,None,None,18mool9,None,None,None,None,t3_18mool9,None,None,/r/ElectricCarUK/comments/18mool9/welwyn_garden_city_taxi_service_airport_transfer/,None,1,None,None,None,ElectricCarUK,Welwyn Garden City Taxi Service | Airport Transfer | Welwyn Taxi,1,https://www.welwyntaxis.com/
0---------------0,None,None,1701453478,None,None,188i3x5,None,TRUE,None,None,t3_188i3x5,3,None,/r/ElectricCarUK/comments/188i3x5/what_ev_would_you_recommend_for_these_specs/,None,1,"Budget to buy of around £16K. Looking for mid-size 5 door, with a range of around 200 miles. 2021 or 2022 model.",None,None,ElectricCarUK,What EV would you recommend for these specs?,1,https://www.reddit.com/r/ElectricCarUK/comments/188i3x5/what_ev_would_you_recommend_for_these_specs/
Apprehensive-Bad2298,None,None,1701451687,None,None,188heqw,None,None,None,None,t3_188heqw,None,None,/r/ElectricCarUK/comments/188heqw/red_cam_uk/,None,1,Is this a red light cam??,None,None,ElectricCarUK,Red cam? UK,1,https://i.redd.it/5qglfm7fxp3c1.jpg
DragonfruitGreen4363,None,None,1700590352,None,None,180ndhj,None,TRUE,None,None,t3_180ndhj,1,None,/r/ElectricCarUK/comments/180ndhj/good_websites_for_electric_vans_in_the_uk/,None,1,"Good websites for Electric vans in the Uk

Hi there,

What are some sites which have a huge selection of Electric as well as petrol Vans in the whole of United Kingdom.

Used some but on Electric didn’t have much selection.

Cheers!",None,None,ElectricCarUK,Good websites for Electric vans in the Uk,1,https://www.reddit.com/r/ElectricCarUK/comments/180ndhj/good_websites_for_electric_vans_in_the_uk/
mike_302R,None,None,1696892032,None,None,1745l6h,None,TRUE,None,None,t3_1745l6h,None,None,/r/ElectricCarUK/comments/1745l6h/ev_subscription_advice/,None,1,"I'm looking at an EV subscription for 3 months, roughly November-January. We don't have any NEED for a car. We live in Cambridge and have got by fine on foot and bike for many years. The purpose would primarily be to explore further afield (within ~90 mile radius, to places where we can't easily/affordably get by train).

Budget is £550/mth, plus charge cost.

Can't charge at home because no off-street parking and can't always be monitoring the cable on the footpath. However, there appear to be numerous chargers nearby us, within 15 minute walk (ranging from 5-15minute walk, maybe a dozen devices with 2 or more chargers).

Our usage pattern will likely be longer weekend journeys, up to 90 miles, 180 return, and let's say 1-2 additional journeys of 5 miles or less per week.

Had been looking at Onto a few mths ago, but now I see they've failed. Elmo and Ezoo stick out as alternatives, but the lack of the charge card on these services (whereas onto provided a card that worked with a nearby charging device) means more cost risk to me. I'm only slightly concerned about the charging cost; more concerned about the uncertainty of that cost.

The other uncertainty for me is damage fees. I have third party excess insurance. I had learned that Onto worked by 28 day contracts meaning it sat within the third party excess policy limits of max 28 day hires. I don't know about how other subscription companies work. I am hugely concerned about the uncertainty brought by any damage claims, and want to be confident that any insurance claims will be covered. I acknowledge this concern might be outside the interests of this sub, but putting it out there anyways, in case there's experience and insight to share.

Any advice for me on this plan of mine?",None,None,ElectricCarUK,"EV Subscription, Advice",1,https://www.reddit.com/r/ElectricCarUK/comments/1745l6h/ev_subscription_advice/
pietroSV,None,None,1696507624,None,None,170g9vm,None,None,None,None,t3_170g9vm,None,None,/r/ElectricCarUK/comments/170g9vm/ev_cars_charger_wall_mount/,None,1,None,None,None,ElectricCarUK,EV cars charger wall mount,1,https://aliaf.site/g/1e8d114494d503279d3116525dc3e8/?ulp=https%3A%2F%2Fwww.aliexpress.com%2Fitem%2F1005005256902542.html&subid=evcharger
swamiredbush,None,None,1695754033,None,None,16swa6p,None,TRUE,None,None,t3_16swa6p,1,None,/r/ElectricCarUK/comments/16swa6p/how_to_get_started_at_shows_and_car_meets/,None,1,"I've been modding my Tesla Model Y for a while and I've been told by numerous car enthusiasts that I should get involved at shows or car meets. However, I've no idea how to get started - I'm based in the South East of the UK and whether they're EV focussed or not I don't mind. 

https://preview.redd.it/pj3f8bzuanqb1.jpg?width=1600&format=pjpg&auto=webp&s=d1285c31a592a97c01eeac6537dfd483b8afa5ed

https://preview.redd.it/4nrwebzuanqb1.jpg?width=1600&format=pjpg&auto=webp&s=8310ac5a6a1f10b5379e6c54e32fc2364d737355",None,None,ElectricCarUK,How to get started at shows and car meets?,1,https://www.reddit.com/r/ElectricCarUK/comments/16swa6p/how_to_get_started_at_shows_and_car_meets/
MobilityInsights,None,None,1695711439,None,None,16sgjdt,None,TRUE,None,None,t3_16sgjdt,None,None,/r/ElectricCarUK/comments/16sgjdt/unleashing_the_power_of_electric_cars_the_crucial/,None,1," Electric vehicles (EVs) are undoubtedly the future of transportation. With their environmental benefits, reduced operating costs, and impressive performance, it's no wonder that EVs are gaining traction worldwide. Yet, at the heart of every electric car's capabilities lies a silent hero – the Battery Management System (BMS).

 EVs are only as good as their batteries, and the BMS is responsible for ensuring that these batteries have long and healthy lives. It continuously monitors and manages the state of charge, temperature, and voltage of individual cells within the battery pack. By preventing overcharging, over-discharging, and keeping the battery within an optimal temperature range, the BMS extends the battery's lifespan, reducing the need for premature replacements. 

[To Know More click Here](https://mobilityforesights.com/product/ev-battery-management-system-market/)",None,None,ElectricCarUK,Unleashing the Power of Electric Cars: The Crucial Role of Battery Management Systems,1,https://www.reddit.com/r/ElectricCarUK/comments/16sgjdt/unleashing_the_power_of_electric_cars_the_crucial/
