author,author_flair_text,clicked,created_utc,distinguished,edited,id,is_original_content,is_self,link_flair_text,locked,name,num_comments,over_18,permalink,saved,score,selftext,spoiler,stickied,subreddit_name,title,upvote_ratio,url
EditLaters,None,None,1695466396,None,None,16q1gpb,None,TRUE,None,None,t3_16q1gpb,None,None,/r/ElectricCarUK/comments/16q1gpb/best_ev_for_winter_deicing/,None,1,"I've enjoyed using fords for years because of the front glass deicing function....makes morning use in winter so easy.

Question.... looking for new to 3yr old ev, say between 12 (leaf) and 25k (mg4?) But which of them will allow some sort of preheating to warm the cab and defrost it all....or of course maybe had front glass like fords.

Tia!",None,None,ElectricCarUK,Best ev for winter de-icing.,1,https://www.reddit.com/r/ElectricCarUK/comments/16q1gpb/best_ev_for_winter_deicing/
Chris_Blue_72,None,None,1694788064,None,None,16jew7x,None,TRUE,None,None,t3_16jew7x,1,None,/r/ElectricCarUK/comments/16jew7x/hyundai_ioniq5_ohme_epod_intelligent_octopus/,None,1,"It's a long shot, but anybody got this combination?  My Ohme ePod keeps losing connection with Hyundai Bluelink, assumes 0% EV charge and immediately starts charging at peak rate. I note that logging into my car app account is a 'labs' feature and cannot guaranteed, but it currently is not working for most of the time and therefore unusable.",None,None,ElectricCarUK,Hyundai Ioniq5 / Ohme ePod / Intelligent Octopus,1,https://www.reddit.com/r/ElectricCarUK/comments/16jew7x/hyundai_ioniq5_ohme_epod_intelligent_octopus/
dontevenaddme,None,None,1694068120,None,None,16c8f2y,None,TRUE,None,None,t3_16c8f2y,2,None,/r/ElectricCarUK/comments/16c8f2y/full_electric_to_hybrid_uk/,None,1,"Hi All

Has any changed or concerned the change from a full EV to a Hybrid.

I’m having these thoughts as I have had an ev (e-208) for 3 years and over the passed 6-8 months I have found it increasingly difficult to change at chargers on the motorways as there tends to be long ques.

My thinking is that since is not often I do more than 30 miles in a day and I have a charger at home I could get something like the Peugeot 408 hybrid and be filling electric most of the time but when ever I choose to make a long drive I would have the back up of an IC engine.

I guess the other option is to look at long range vehicles since my current ev is advertised at 200 and I’m not seeing cars such as the facelift model 3 with up to 425mils but I’m not sure the extra prices if worth it if I’m only doing long drives every couple of months.

Next year I’m also planning to drive around main land Europe so this is also a consideration.",None,None,ElectricCarUK,Full electric to Hybrid (UK),1,https://www.reddit.com/r/ElectricCarUK/comments/16c8f2y/full_electric_to_hybrid_uk/
bedz84,None,None,1693525957,None,None,166r9lo,None,TRUE,None,None,t3_166r9lo,6,None,/r/ElectricCarUK/comments/166r9lo/eon_drive_tarriff/,None,1,"Getting a BMW i3 42kw (2021)  in a few days.   We have a private drive and can charge easily at home.  Couple of questions.

Do you need to have a wall charger to get this tarrif? 

Only really doing 20 ish mile a day, do you think I will get away with the standard 3pin 2.5kwh charger? (eon tarrif is 9.5p kwh between 12-7am) 

I can relativley easily self install a 7.5kwh wall box (father is a qualified electrician), is it worth thr hassle? 

Thanks",None,None,ElectricCarUK,Eon Drive Tarriff,1,https://www.reddit.com/r/ElectricCarUK/comments/166r9lo/eon_drive_tarriff/
RecentSuspect7,None,None,1692989757,None,None,1617u36,None,TRUE,None,None,t3_1617u36,6,None,/r/ElectricCarUK/comments/1617u36/taking_the_step_into_electric/,None,1,"Good afternoon all.
I'm looking into taking the step into electric cars, more specifically the Vauxhall Corsa e. Now we don't have a drive way or garage and the car is going to be parked on the road a little ways from my home so a home charge point is pretty much not viable.

My work however does have an electric charge point, free to use for staff. Would any recommend this as a good start or should I wait until we have a property that lets us charge from home?",None,None,ElectricCarUK,Taking the step into electric,1,https://www.reddit.com/r/ElectricCarUK/comments/1617u36/taking_the_step_into_electric/
r08shaw,None,None,1688406175,None,None,14ppoh9,None,None,None,None,t3_14ppoh9,None,None,/r/ElectricCarUK/comments/14ppoh9/id_software_32_enables_plug_and_charge_heres_what/,None,1,None,None,None,ElectricCarUK,ID Software 3.2 enables plug and charge - here's what you need to know (UK specific),1,https://youtu.be/kPTPygleYW8
Sure_Tie_3896,None,None,1685955614,None,None,14181wm,None,TRUE,None,None,t3_14181wm,2,None,/r/ElectricCarUK/comments/14181wm/advice_needed_for_family_of_5/,None,1,"Hi, I am having to buy a new car due to ULEZ. I  would love to buy a fully electric car but it would definitely need to be second hand due to cost. I would also like it to be long lasting, changing cars regularly is not an option for us. We are a family of 5 and currently drive an SUV 7 seater. We generally use the car for local journeys, occ longer journeys at weekends. 
I am really undecided if a plug in hybrid or electric is the way to go. Or if second hand for electric cars is wise. What will be useful for the longest period of time  (will only electric be allowed in London over the next 10 years for example?). Should I go fully electric with young kids (slightly worried I might need to stop and charge, with young kids, this would be a pain)? 
It's not long to go until the new ULEZ rules come into place and would really appreciate any advice or opinion on the best way to go.",None,None,ElectricCarUK,Advice needed for family of 5.,1,https://www.reddit.com/r/ElectricCarUK/comments/14181wm/advice_needed_for_family_of_5/
Captain_Of_Trouble,None,None,1684852912,None,None,13pqiog,None,TRUE,None,None,t3_13pqiog,None,None,/r/ElectricCarUK/comments/13pqiog/updates_to_kia_enero_first_edition/,None,1,"TLDR: How to update the software on my eNero First Edition?

I've just bought a Nero First Edition, it's lovely and drives really well, I'm so happy with the driving. I'm not so happy with the satnav and 'infotainment' system. I have run into a couple of places where the road layout has changed and the car doesn't know. A big roundabout in Bristol that has been removed and an annoying but funny incident where it directed me into the Westfield car park thinking I could get to the A40.

I wonder if I can update the maps and while I'm at it, can I install the Kia Connect app? Is this something I can do myself or do I need to visit a Kia dealership?

Thanks!",None,None,ElectricCarUK,Updates to Kia e-Nero First Edition?,1,https://www.reddit.com/r/ElectricCarUK/comments/13pqiog/updates_to_kia_enero_first_edition/
r08shaw,None,None,1681939105,None,None,12saitp,None,None,None,None,t3_12saitp,1,None,/r/ElectricCarUK/comments/12saitp/vw_idbuzz_first_drive_and_review_yorkshire_dales/,None,1,None,None,None,ElectricCarUK,"VW ID.Buzz first drive and review, Yorkshire Dales - UK",1,https://youtu.be/ZjrAJvYi0Hs
stoichomladenov,None,None,1680971663,None,None,12fr01q,None,TRUE,None,None,t3_12fr01q,None,None,/r/ElectricCarUK/comments/12fr01q/future_of_auto_industry_survey/,None,1,"EV enthusiasts, I need your help! I'm conducting a study on what car brands can do to succeed in the future of the auto industry. Please click the link to take the survey and share your insights (should take 2 minutes). Thank you for your time and contribution!

https://forms.gle/9FyQ5oWkpvAkGiYf9",None,None,ElectricCarUK,Future of auto industry survey,1,https://www.reddit.com/r/ElectricCarUK/comments/12fr01q/future_of_auto_industry_survey/
rnords,None,None,1641302382,None,None,rvu80s,None,TRUE,None,None,t3_rvu80s,7,None,/r/ElectricCarUK/comments/rvu80s/future_proof_for_battery_upgrade_is_this_a_thing/,None,1,"I am looking to make the move to an EV (used 2018 Kia eSoul with 11k miles). The battery still has a few years warranty, but the real world miles are probably only about 100-120 (unless someone can tell me different). 

I’m wondering how “future proof” electric cars are? In 5-7 years when the batter needs upgrading, can I do so, and can I put in a much better battery at that point?",None,None,ElectricCarUK,Future proof for battery upgrade? Is this a thing?,1,https://www.reddit.com/r/ElectricCarUK/comments/rvu80s/future_proof_for_battery_upgrade_is_this_a_thing/
stig316,None,None,1634407512,None,None,q9h7fe,None,TRUE,None,None,t3_q9h7fe,5,None,/r/ElectricCarUK/comments/q9h7fe/charging_troubles/,None,1,"Hi everyone I have a Nissan Leaf that I have mostly been charging at home..
Now i have just moved I cant charge at the new house but I am finding charging very difficult now. Chargers (West London) my area seem to be not working or constantly in use.

Any ideas or tips on what I can do to save driving around slowly with 8% battery in the middle of the night looking for car juice?",None,None,ElectricCarUK,Charging Troubles,0.67,https://www.reddit.com/r/ElectricCarUK/comments/q9h7fe/charging_troubles/
Domc9988,None,None,1614383418,None,None,ltb7od,None,TRUE,None,None,t3_ltb7od,3,None,/r/ElectricCarUK/comments/ltb7od/ev_charging_infrastructure/,None,1,"Hi everyone, currently doing a dissertation topic on electric vehicles and the supporting infrastructure. Does anyone know how a council determines the amount of charging ports they’re going to implement? Through surveys etc. 

Any info would be massively appreciated, thanks.",None,None,ElectricCarUK,EV charging infrastructure,1,https://www.reddit.com/r/ElectricCarUK/comments/ltb7od/ev_charging_infrastructure/
speedhounds,None,None,1612174456,None,None,l9zzou,None,None,News,None,t3_l9zzou,None,None,/r/ElectricCarUK/comments/l9zzou/volkswagen_id4_electric_suv_launched/,None,1,None,None,None,ElectricCarUK,Volkswagen ID.4 Electric SUV Launched,1,http://www.speedhounds.com/2021/02/volkswagen-id-4-electric-suv-launched/
Ben28282,None,None,1583446750,None,None,fe38d6,None,None,None,None,t3_fe38d6,None,None,/r/ElectricCarUK/comments/fe38d6/new_mg_zs_ev_subreddit/,None,1,None,None,None,ElectricCarUK,New MG ZS EV subreddit,0.67,https://www.reddit.com/r/mgzsev?utm_medium=android_app&utm_source=share
girishmargam,None,None,1562856494,None,None,cbwfde,None,None,None,None,t3_cbwfde,2,None,/r/ElectricCarUK/comments/cbwfde/eu_rules_carmakers_must_add_fake_engine_noises_to/,None,1,None,None,None,ElectricCarUK,EU Rules Carmakers Must Add Fake Engine Noises to New Electric Cars,1,https://thereviewstories.com/eu-rules-carmakers-must-add-fake-engine-noises-to-new-electric-cars/
