author,author_flair_text,clicked,created_utc,distinguished,edited,id,is_original_content,is_self,link_flair_text,locked,name,num_comments,over_18,permalink,saved,score,selftext,spoiler,stickied,subreddit_name,title,upvote_ratio,url
KORGUY123,None,None,1695866619.0,None,None,16u3e2m,None,None,None,None,t3_16u3e2m,9,None,/r/KiaEV6/comments/16u3e2m/got_it_a_month_ago_i_love_it/,None,70,"Got GT-LINE AWD last month and I love it!

I am a college student from Korea and plan to stay here in states for 9 months.

My dad has been running a Hyundai/Kia supplier in Korea over 25 years! (we make injection molds and exterior parts; of course bunch of things for EV6!)

The company is now working on EV6 PE exterior parts and I can’t tell you about them in detail due to privacy, but I am sure it is going to be as cool as the current model for sure!",None,None,KiaEV6,Got it a month ago… I love it,1.0,https://i.redd.it/j9aw2z15mwqb1.jpg
generictestusername,EV6 GT-Line RWD,None,1676299702.0,None,None,111atjt,None,None,None,None,t3_111atjt,25,None,/r/KiaEV6/comments/111atjt/joined_the_league_1_week_and_900_miles_later_need/,None,70,None,None,None,KiaEV6,Joined the league! 1 week and 900 miles later! ( need to get a better pic),0.99,https://i.redd.it/dkad2yenf0ia1.jpg
[deleted],None,None,1669119650.0,None,None,z1s6vu,None,None,None,None,t3_z1s6vu,2,None,/r/KiaEV6/comments/z1s6vu/found_a_buddy_at_best_buy/,None,69,None,None,None,KiaEV6,Found a buddy at best buy,0.99,https://i.imgur.com/XFB9Xq3.jpg
Patient_Meat1980,EV6 GT-Line RWD,None,1662768883.0,None,None,xaau7u,None,None,None,None,t3_xaau7u,11,None,/r/KiaEV6/comments/xaau7u/ladies_and_gents_im_in_the_gt_line_club_had_to/,None,69,None,None,None,KiaEV6,Ladies and Gents... I'm in the GT line club. Had to catch the train to Deleware to get it!!!,0.99,https://i.redd.it/8swt9972cxm91.jpg
ema1989,None,None,1650130308.0,None,None,u52r9a,None,None,None,None,t3_u52r9a,9,None,/r/KiaEV6/comments/u52r9a/got_our_fe_in_urban_yellow_yesterday_1444/,None,69,None,None,None,KiaEV6,got our FE in urban yellow yesterday! #1444,1.0,https://www.reddit.com/gallery/u52r9a
CAJ395,None,None,1679353100.0,None,None,11wz2t3,None,None,None,None,t3_11wz2t3,29,None,/r/KiaEV6/comments/11wz2t3/joined_the_ev6_club_this_weekend/,None,68,"I purchased my first EV this weekend. I fell in love with it on the test drive. I feel like I did well in my negotiation. I actually walked out and left they called me back I purchased it for 2,000 below MSRP.  Still got dealer perks nothing to special. I'd like to hear from anyone about home chargers what is best what do you recommend ?",None,None,KiaEV6,Joined the EV6 Club this weekend,0.94,https://i.redd.it/8i04y1vym0pa1.jpg
grumpy_bob,None,None,1677820076.0,None,None,11grztw,None,None,None,None,t3_11grztw,22,None,/r/KiaEV6/comments/11grztw/im_a_happy_new_owner_hi/,None,68,None,None,None,KiaEV6,I'm a Happy New Owner. Hi!,0.99,https://i.redd.it/nv1f5zrtigla1.png
Priuxls,None,None,1654547832.0,None,None,v6d0dr,None,None,None,None,t3_v6d0dr,13,None,/r/KiaEV6/comments/v6d0dr/took_this_image_the_other_day_really_love_this/,None,68,None,None,None,KiaEV6,"Took this image the other day, really love this car and its color",0.99,https://i.redd.it/hdga7wy8a2491.jpg
JeffTechnically,EV6 Wind,None,1653674466.0,None,None,uz3zo1,None,None,None,None,t3_uz3zo1,13,None,/r/KiaEV6/comments/uz3zo1/love_this_shot/,None,67,None,None,None,KiaEV6,Love this shot 😎,0.98,https://i.redd.it/d7hbniwo52291.jpg
simplethingsoflife,None,None,1707591784.0,None,1707592027.0,1annma6,None,True,None,None,t3_1annma6,50,None,/r/KiaEV6/comments/1annma6/mark_cuban_is_one_of_us/,None,68,"Cuban says he prefers his EV6 over his Tesla X Plaid…

[https://www.businessinsider.com/mark-cuban-elon-musk-feud-tesla-plaid-kia-ev6-2024-2](https://www.businessinsider.com/mark-cuban-elon-musk-feud-tesla-plaid-kia-ev6-2024-2)",None,None,KiaEV6,Mark Cuban is one of us!,0.93,https://www.reddit.com/r/KiaEV6/comments/1annma6/mark_cuban_is_one_of_us/
ZCT808,None,None,1700612505.0,None,None,180w07m,None,None,None,None,t3_180w07m,17,None,/r/KiaEV6/comments/180w07m/joined_the_gang/,None,68,2024 EV6 AWD GT Line,None,None,KiaEV6,Joined the gang!,1.0,https://i.redd.it/l8szkli3ms1c1.jpg
pleasecallmejay,EV6 GT-Line RWD,None,1677003405.0,None,None,118c2it,None,None,None,None,t3_118c2it,24,None,/r/KiaEV6/comments/118c2it/my_2023_gtline_rwd_with_a_full_stealth_ppf/,None,68,None,None,None,KiaEV6,My 2023 GTLine RWD with a full stealth PPF,0.99,https://www.reddit.com/gallery/118c2it
Oopsypoopsy2222,None,None,1656713890.0,None,None,vpcly7,None,None,None,None,t3_vpcly7,9,None,/r/KiaEV6/comments/vpcly7/eve_has_joined_the_carport_i_think_this_means_im/,None,67,None,None,None,KiaEV6,"Eve has joined the carport! I think this means I’m a member of the cool-kid’s club now, right?",0.99,https://i.imgur.com/nAGgisU.jpg
halxp01,None,None,1650986372.0,None,None,uceyvu,None,None,None,None,t3_uceyvu,24,None,/r/KiaEV6/comments/uceyvu/joined_the_ev_6_revolution_yesterday/,None,67,None,None,None,KiaEV6,Joined the EV 6 revolution yesterday,0.98,https://www.reddit.com/gallery/uceyvu
AkiraSieghart,EV6 GT (The Fast One),None,1709927692.0,None,None,1b9xhp8,None,None,None,None,t3_1b9xhp8,35,None,/r/KiaEV6/comments/1b9xhp8/finally_got_my_michelin_ps4s_and_20_wheels_on/,None,66,None,None,None,KiaEV6,"Finally got my Michelin PS4S and 20"" wheels on!",0.96,https://i.imgur.com/oEHyVXi.jpeg
ChickenTensity,EV6 GT (The Fast One),None,1705272225.0,None,None,196sm0c,None,None,None,None,t3_196sm0c,14,None,/r/KiaEV6/comments/196sm0c/yacht_blue_club_reporting_in/,None,66,Christmas gift I took delivery of in December. First EV and I'm loving every minute. Southeast Wisconsin and being able to preheat is a godsend,None,None,KiaEV6,Yacht Blue Club reporting in!,1.0,https://i.redd.it/117asgzshhcc1.jpeg
gandhi0175,None,None,1680134113.0,None,None,12654ep,None,None,None,None,t3_12654ep,24,None,/r/KiaEV6/comments/12654ep/brand_new_to_the_club/,None,64,"Picked it up today, and couldn’t be happier!",None,None,KiaEV6,Brand new to the club!,0.96,https://i.redd.it/ag11r4qb5tqa1.jpg
unsure_about_life2,None,None,1672534081.0,None,None,10080ke,None,None,None,None,t3_10080ke,4,None,/r/KiaEV6/comments/10080ke/happy_new_year_two_of_my_obsessions_captured_in_a/,None,66,None,None,None,KiaEV6,Happy New Year! Two of my obsessions captured in a single shot ❤️ #ChicagoSkyline #MyEV6,1.0,https://i.redd.it/d1nizaqied9a1.jpg
theatomiclizard,EV6 GT-Line AWD,None,1651421896.0,None,None,ug3bul,None,True,None,None,t3_ug3bul,75,None,/r/KiaEV6/comments/ug3bul/5000_miles_driven_and_heres_what_annoys_me/,None,64,"Black Onyx GT-Line AWD in northern Massachusetts. Previously owned a 2017 Chevy Bolt and will never own an ICE ever again, even my outdoor tools are all electric. Took delivery on March 10th and have done all sorts of driving with it. From everyday around town ECO, to hard Sport mode, an 800 mile road trip to Philadelphia, regular trips up into NH and down to Cape Cod. It's been pretty cold the past 7 weeks, so I've averaged around 2.7 mi/kWh, I expect those numbers to climb as it gets warmer. 

This post isn't about the usual love for the car, to keep it short, for those who have not pulled the trigger on one, it is an amazing car, and you will not be disappointed. I have never driven in a Tesla, but it looks way meaner than a Model Y/3 and doesn't have build quality issues, and that was enough for me. My favorite moments are pulling up first to a red light and just launching the thing a mile down the road before the soccer mom next to me even gets rolling. Special shout out to all the slow left lane pick up trucks I roast on the highway too, keep rolling coal buddy, I'll stick to paying $5 to charge up my car at home. 

I've been keeping a list of things about the car that annoy me so far, be interested to hear everyone's thoughts. This won't be the usual reviewer crying about the volume knob (which takes 10 minutes to get used to), these are little things that could be fixed to make the car perfect. I'd actually love to hear other suggestions from this subreddit - I'm sure we could come up with a solid list - I might make it into a youtube video.

I'll start with things I've heard rumors about fixes incoming in the near future but weren't in the spring software update:

1. **Car color in the 3D camera display** \- it's white, my car is black, fix that up. Heard this a fair amount on here.
2. **Wireless Carplay** \- apparently the hardware is there for it, they're just going to turn it on in an update? I wouldn't mind that, but I did buy the Carlinkit Adaptor and that thing has worked flawlessly but having it built in natively would be cooler and cleaner.
3. **DC Fast Charging pre-conditioning** \- I've heard that they were supposed to add this feature so when you pull up to a 350kW charger the car could actually get you the advertised 18 minutes 10-80% charge rate. I've used a handful of Electrify America 350kW chargers so far in all sorts of conditions and it'll start at 75 then creep to 125-150 and if I'm lucky I'll see a 175. I don't think I've seen over 200 which I've heard it's more than capable of 250kW. I can give the car 10-20 minute warning that I'm about to dump a serious amount of charge into the car on a roadtrip, something that I believe Teslas are capable of. I've done an exact 10%-80% fast charge a few times and it took \~27 minutes because it was lolligagging around at 75kW preheating itself for about 7 minutes first. Give me that advertised speed!
4. **Apple CarKey** \- I've heard that the hardware is there for it, would absolutely LOVE this feature. Especially if it means I can just get in the car and drive like Tesla that'd be amazing.
5. **Kia App Support in Massachusetts** \- for those that don't know, because of a right to repair law, Kia has hard coded disabled the Kia Connect app from doing anything with the car based on my VIN where I purchased the car. *This is my single greatest gripe with the car*. For a $65k car in 2022 to not have a remote start/lock/unlock/charge app with the car is disgusting. Figure it out with the state or have a workaround in place. Let's say I lock my keys in the trunk, or want to preheat my car on a cold day from out of key range, with phone in hand, you're saying I'm SOL? In 2022? Madness. I want to confirm with someone at Kia that if I sold the car to someone in another state that this restriction would be removed. If this is the case I will sell the car to my friend in NH for $1 literally to get the app to work. If ANYONE knows a workaround or backdoor for this please let me know.
6. **Sentry Dashcam mode -** The hardware is there for it, and I even heard the Korean version of the car has a USB port to plug a hard drive into for this. I want this so bad! It should be a standard feature in all cars. I hate that I'm going to have to hardwire an ugly aftermarket camera on my windshield when the cameras and technology is right there for it. I don't need side cameras, but to be able to record the front and back views in case of any riff raff would be amazing to have.
7. **Over The Air Updates** \- Heard this one more than anything - I'm sure it's coming - Hook the car to my garage wifi and throw it in while I'm sleeping. Also is there an email list I can be notified when updates come out? Even if I have to bring it to a dealer I love me some new features, also when they implement all my changes below. :)

Here are some changes they could easily make in programming in a future update but I haven't heard too much about around this subreddit:

1. **Different Sound Profiles per drive mode** \- I'd love it if when in Sport mode I could have a different sound profile from when I'm in Eco mode. When I have passengers, I'm usually in Eco mode, a low Cyber mode would be preferred, and when I'm alone and a let's go brandon Dodge Ram pulls up next to me and I put it in Sport mode, a loud Dynamic sound profile would be sick when I absolutely roast him without even trying.
2. **Exit Number Displayed in HUD -** Above the distance to turn amount lower right hand corner on the heads up display, if they could put the exit number that would be amazing. That way I don't even have to glance at the GPS map screen to know which exact exit number/letter to take. Would make highway driving so much easier.
3. **Turn Rear Camera on when in Drive -** A few times I've had stuff piled up in the trunk so I couldn't use the rearview mirror, but I can't turn on the camera system when not a low speed. I'd love to be able to put that view on the screen for safety and awareness' sake.
4. **Chime when Autosteer disengages** \- This is a pretty important safety thing I've noticed on the highway a fair amount of times. When in HDA2 autopilot mode, sometimes you'll get to a part of the highway where the lines are damaged or faded enough where the autosteer disengages and goes from green to white. If just a little chime could alert me of this happening that'd be awesome. A few times I was cruising along and all the sudden I'm drifting more than is normal and I'll notice the car just unceremoniously stopped steering itself and the icon changing colors isn't noticeable enough an alert on its own. Doesn't have to be like the big lane keep alert sound, but just a quick small chime to tell me it's disengaged would be sweet.
5. **Autopilot prefers wrong side of the lane -** I love autopilot on the highway, it works well enough where I trust it a lot at this point and can't imagine a car without it. I do a lot of driving in the left lane and would love it if it hugged the yellow line a bit more, sometimes, especially on left corners, it will drift to the right side of the lane a bittt too close to other cars in the next lane. Obviously it never hits them, but I would feel better if it just hugged the inside line a bit better, even on straight aways too.
6. **Automatic Lane Change too hard to use** \- I've tried to use this a fair amount of times and it's just too clunky. You need to be holding the steering wheel, but somehow not put any input into the wheel or it will cancel the change? If I'm in HDA2 and it knows it's clear - just go for it, don't check the wheel and have it cancel itself by me telling it I'm holding the wheel. Sometimes I have the right touch, but it's annoying.
7. **Seat Memory not available while not in Park -** Lots of time I'll be already rolling down the driveway when I notice my seat's not perfect but it won't let me hit seat memory while in drive. I can understand if you're going highway speeds but stopped at a red light or rolling down the driveway I can't just hit the button? 
8. **NAV Keyboard not available while not in Park -** Kind of the same as previous, I can understand if you're going 20mph+, but if I'm at a red light I need to put the car fully in park to plug something into the GPS? Come on. 
9. **Both ETA and Trip Duration on Map screen** \- I know there's an option to toggle whether it shows the ETA or the time until arrival, but I wish I had both shown at the same time? Maybe just on longer drives, or maybe even show the duration until you need to take an exit on a long drive? ""In 35 minutes take exit 12"" or something, it's a little niche request but sometimes time math is hard to do.
10. **Clearer way to discern if the car is remotely started** \- Since I don't have the app to precondition, I have to go to my front window and hit the key button to start it. I find it difficult to know if I actually hit the button combo-hold correctly. Do flashing lights mean it's on? Should the parking lights stay on like the Chevy Bolt? Hell even have the lady charging voice say that the car is started, I'd be able to hear it. While you're at it, maybe a default temperature setting in the menu so I know when I hit that button what temperature and settings it will start working towards.
11. **Assign key to driving profile** \- Can I assign a specific key to a driving profile? One key for my profile, and the other for my wife? I get in and the car knows it's me because it's my key... That'd be cool.
12. **Lock when walk away** \- I've seen this parroted here, but lock the car when I walk away with the key, pretty standard stuff.
13. **Unlock when trunk opening** \- Maybe this is a safety thing, and if it is, fine, but  when I open the trunk with the trunk button or the auto-opening, I need the option to just unlock the rest of the doors. I'm holding something heavy and I use the ""stand there"" method to auto-open it, my wife is just waiting for the car to unlock because my key is buried in my pocket with my hands full. Also the day I lock the key in the trunk because the doors didn't unlock, I'm gonna be pissed.
14. **Preserve GPS Saved Locations** \- All of my saved locations in the GPS got wiped when I updated the NAV software - can there be a way to preserve those on update or offload them - I had a great saved list going until it all go wiped this week when i updated the software - super lame. Not sure I want to spend the time putting them all back in if every 6 months update will set me back to 0. 
15. **Trailer hitch shouldn't need you to cut a hole in the faring -** Kia should make a faring with the hole already in it for a cleaner look. I'm not going with the OEM hitch, waiting for the stealth hitch in a few months, but the Kia hitch shouldn't require a tech with a mitre saw to notch a hole in the underside of the car for the hitch, has to be a better way.
16. **Black emblem badges** \- I want blacked out emblem badges, let's hurry up production on those.

These two I think are 2023 model suggestions, not much I can do with my 2022:

1. **LEDs look pink not red** \- kind of takes the edge off of Sport mode. If they can fix this in software that'd be great, but it seems like they just used the wrong kind of LEDs with no good red value.
2. **Sueded seats holes debris** \- Build quality of the seats is good - but the perforations take too much attention with the vacuum to get right - I'd have to vacuum daily to keep them looking good - they just eat dirt and debris to easily and look clogged.
3. **Interior trim too glossy** \- fingerprints and dust show up instantly, and the sun's reflection of the center pieces is blinding, going to have to wrap mine to get something with a matte finish.

**Random EV thoughts:**

1. **Chargepoint only allows one home charger per account** \- I have two Chargepoint EV chargers running at 48A at my house and my cape house (bougie) and had to make a separate account for each charger? super lame. They make great chargers and the EV6 taking a huge 11kW at a time is sick.
2. **Quirk Kia in Braintree, MA is run by clowns**. Buying cars from dealerships to begin with is a joke. I will do everything in my power to quicken their demise. I could do a whole another post about their incompetence from sales to service to even their parts department. 
3. **Can't wait to have solar panels** \- Powering this beast with the sun even though my power company gives me a nighttime 9 cents/kWh rate would be the ultimate. I have a south facing hill - ground mount 16-24kw array here I come.
4. **Plans:**
   1. New Rims - the stock ones just look a bit too dopey, will keep them for winter tires though.
   2. Paint calipers - I'm thinking a deep red would go best with black?
   3. Summer tires - I bet I can get even more acceleration with the Pirelli PZ4 tires I bought.
   4. Ceramic coat - Pricey but the black car butt picks up too much dirt and the air current doesn't get it clean when it rains.
   5. Window tint - I think I did 10% everywhere but the windshield - sprang for the kind that really cuts the sun's power so the car will have to work less hard to keep it cool in the summer.
   6. Integrated Radar detector - Pricey too, but with all the nighttime highway driving I do, I want to be able to cruise without worry.
   7. Wrap shiny interior black trim - it's just too glossy - fingerprints, dust, sunlight reflections, i need something with a matte finish so it looks clean longer.
   8. Plastiip emblems - if Kia won't make em - I'll have to do it. I'm leaving the front logo and taking off the rear logo - keeping the EV6 and the GTLine badge though.
   9. Hardwired Dashcam - sad I even have to do this with 5 other cameras on the car in 2022.

**Accessories I've bought and recommend:**

**Cup holder Nalgene/Large Bottle holder:**

[https://www.amazon.com/gp/product/B01M028L5E](https://www.amazon.com/gp/product/B01M028L5E)

**Center console tray** \- this should come with the car, it's so much better than just having a hole:

[https://www.amazon.com/gp/product/B09T2D914Z](https://www.amazon.com/gp/product/B09T2D914Z)

**License Plate Tints** \- These are the best I've found - build quaility was better than the other ones that shattered when i put them on:

[https://www.amazon.com/gp/product/B08M3L3KVF](https://www.amazon.com/gp/product/B08M3L3KVF)

**Carlinkit Wireless Airplay** \- Works flawlessly even with my phone and my wife's phone in the car at the same time:

[https://carlinkitcarplay.com/products/carlinkit-wireless-adapter-for-factory-carplay](https://carlinkitcarplay.com/products/carlinkit-wireless-adapter-for-factory-carplay)

&#x200B;

Thanks for reading! Please let me know your thoughts!",None,None,KiaEV6,"5,000 miles driven and here's what annoys me...",0.96,https://www.reddit.com/r/KiaEV6/comments/ug3bul/5000_miles_driven_and_heres_what_annoys_me/
andylau07,EV6 GT-Line AWD,None,1692965706.0,None,None,160xkzc,None,None,None,None,t3_160xkzc,6,None,/r/KiaEV6/comments/160xkzc/my_gf_and_i_joined_the_club/,None,67,Kia Ev6 GT-Line 2 (Snow White Pearl)- Canada,None,None,KiaEV6,My gf and I joined the club!,0.99,https://i.redd.it/suulc48809kb1.png
maryantioco,None,None,1692037276.0,None,None,15r2jxj,None,None,None,None,t3_15r2jxj,75,None,/r/KiaEV6/comments/15r2jxj/just_picked_up_my_beauty_now_the_fun_begins/,None,65,.. huge learning curve ahead .. any advice is sooooo  welcome,None,None,KiaEV6,Just picked up my beauty .. now the fun begins,0.96,https://www.reddit.com/gallery/15r2jxj
pgcwdrg,None,None,1681224780.0,None,None,12imb50,None,None,None,None,t3_12imb50,40,None,/r/KiaEV6/comments/12imb50/pre_conditioning_for_ev6/,None,64,Found on the EV6 Facebook group. Credit to Andrew Gunk for posting the original message.,None,None,KiaEV6,Pre conditioning for EV6,0.98,https://i.redd.it/jztdotuf8bta1.jpg
drpapadeltavictor,EV6 Wind,None,1681075519.0,None,None,12gwaxr,None,None,None,None,t3_12gwaxr,15,None,/r/KiaEV6/comments/12gwaxr/got_this_a_week_ago/,None,64,"Got the Yatch Blue, Wind RWD delivered a week ago in Auckland, NZ. Other than the Android Auto dropping out frequently (so annoying!!) haven't had any issues. Long range means despite some long city based drives, haven't had to recharge yet.  Really enjoying the ride!",None,None,KiaEV6,Got this a week ago!,0.98,https://i.redd.it/8dw6ouxkwysa1.jpg
