author,author_flair_text,clicked,created_utc,distinguished,edited,id,is_original_content,is_self,link_flair_text,locked,name,num_comments,over_18,permalink,saved,score,selftext,spoiler,stickied,subreddit_name,title,upvote_ratio,url
[deleted],None,None,1663365250.0,None,None,xg45sb,None,True,None,None,t3_xg45sb,39,None,/r/KiaEV6/comments/xg45sb/comparison_between_kia_ev6_and_tesla_model_y/,None,94,"In early July of 2021, I test drove and then put in an order for a Tesla Model Y Long Range. At the time I thought I’d get my car in November or maybe December. Instead, I took delivery of it in mid September of 2022. During that fourteen month wait, I had a chance to buy a Kia EV6 from my local dealer. Given that at the time I had no idea when Tesla might build my car, I test drove the Kia, liked it, and bought it. Now with two EVs in my garage, I have a chance to do my own back to back comparison between an Austin built Tesla Model Y Long Range and a Kia EV6 Wind with the Tech Package and AWD — the winner stays and the other car gets sold.

When I put in my order for the Tesla, there were very few options for electric cars in Illinois with anything close to enough range for me. The Ford Mustang Mach E, Chevy Bolt, and the four Tesla models. Several EV cars from legacy car manufacturers were on the way in coming years and there might have been a few others available, just not in my state at that time. The Bolt didn’t have all wheel drive or very good DC fast charging — later they got recalled for battery fires. The Mustang Mach E has never been particularly appealing to me and dealers were demanding extra charges for them even back then. I considered the Model 3 and Y ruling out the S and X due to price, going with the Y for the hatchback and claimed smoother ride quality.

Through the end of 2021 and first half of 2022, several additional EV options hit the US market, even in Illinois. I immediately liked the Hyundai Ioniq 5, Kia EV6, and Volkswagen ID.4 once they were officially announced. So I made inquiries at local dealerships. It came as a total shock to me when my local Kia dealer called in early February to say that they had a Kia EV6 on the lot with no reservation attached to it. This was at least five months earlier than I expected the Korean EVs to arrive in the midwestern US. I ended up buying it and at the time of this writing I have 13,000 miles on it. I think I have a pretty good sense of what the car is like to own and drive over short and longer distances in all kinds of weather.

My EV6 was my first electric car. Like most EVs, it has remarkable acceleration, a quiet drivetrain, and lots of the common electronic gizmos of modern cars. I think it is an attractive car, sporty looking and contemporary. Mine is a mid level spec for the range, a Wind with the Tech Package and AWD. So it doesn’t have a heads up display, the more advanced semi autonomous driver aids, or sunroof of the top trim model. It also has taller sidewall tires which I genuinely prefer for smoother ride quality. It has a touch screen but also has physical buttons to control various things in the car. From day one I was struck by how quiet and comfortable the car is. It is easily the quietest car I’ve ever owned and among the smoothest in ride quality. Its EV driving characteristics are adjustable and I’ve found a degree regenerative braking that I like. It is well built, designed, and put together. There were no flaws in the paint, bodywork, or trim. There were no squeaks or rattles when new and very few have developed in the past 13,000 miles. At the time it was eligible for the $7500 federal tax incentive making its actual cost to me less than $50,000 total.

I really like my EV6. The ventilated and heated front seats are great. I find that I use the ventilation feature often and on long drives I think it really helps maintain comfort. The layout of the controls is pretty good. I especially like that there is a little shelf below the touchscreen giving my hand a place to brace so that finger touches are more accurate even on a bumpy road. My passengers appreciate that the climate vents front and back are physical things that they can adjust at will. The rear seats are roomy and comfortable with tilting backs. There is plenty of headroom and legroom throughout the car. There are USB-C charging ports in the front and back, an interior 110 volt AC outlet, and a vehicle to load attachment to use the car’s to power port to run appliances, like for camping or in a power outage. 

Speaking of power, the car’s 77.4 kWh battery is enough to give it well over 200 miles of interstate highway range or close to 300 miles of lower speed mixed driving. It uses the CCS DC fast charging standard and mine came with 1000 kWh of free charging at Electrify America stations. If you can find the right charger and the battery is at the right temperature, the car can recharge really, really fast. But even at only 150 kWh, my charging stops on road trips are short. However, CCS is a liability at this time where I live and occasionally travel. There just aren’t enough charging stations and most of those that exist can only charge four cars at a time. I’ve also found that Electrify America stations are often not fully operational, with 350 kWh equipment only putting out 125 kWh and some equipment completely non functional. I’m sure this will improve over time, but in 2022 road trips in the midwest can be extra stressful.

On September 13 of 2022 I finally had my appointment to take delivery of my Tesla Model Y. When I got to my nearest service center, I was the only customer there and my car was brought around right away. My inspection of the car found four issues, a chip in the paint, a misaligned front fender, a misaligned door, and taillights that had different gaps on the right and left. The service manager took the car in back to sort these out and I finished my paperwork. It took quite some time to fix the car but it was eventually brought back around for me to finish the set up, phone pairing, etc. But I still couldn’t leave because something went wrong with the servers and my car stayed in service mode which required another long wait while that got sorted. Lest it sound like I’m super unhappy about all of that, this was still a good buying experience and still shorter than any I’d done at a conventional dealership.

Eventually I was able to start my hour and a half trip home. The car was paired to my phone as its key. All the controls were adjusted for me. I had created a driver profile for me and a guest profile too. I’d selected some apps to go in the “dock” area at the bottom of the screen. Saved a couple of radio presets, so time to hit the road. I’d already test driven a Model Y the previous summer, so I knew what to expect with one pedal driving. As soon as I was under way I couldn’t help but notice all the squeaks and rattles coming from the interior of the car. I made my way via surface streets and towards the interstate as the car worked on calibrating its cameras so the various systems like cruise control would start working. 

I stopped for lunch and the doors locked on their own when I walked away. That’s a nice touch and I wish my Kia had that feature. Instead I have to either fish out the key fob or firmly press the door handle in just the right way for the doors to lock — which sometimes takes a couple of tries. Unlocking was the same easy matter on the Tesla and again better than my Kia which requires the same routine as locking it. I prefer the Tesla door handles, but both cars are ridiculous. I wish they had something more conventional. Starting the Tesla is really just getting in. My Kia has a start button and start up screen on the dash, which is fine. I’m just pointing out a difference. 

Parking and backing up my Model Y for the first time produced some more comparisons. The Tesla has better views looking out the side or front, but the Kia has better views out the back and through the mirrors. That giant Tesla screen only devotes half an inch more to its rear view camera display than the Kia EV6. The Tesla camera resolutions are no better than the various cameras on my Kia and some are worse. For example, the EV6 blind spot side cameras are much better than the Tesla. My Kia has a 360 degree surround view and multiple camera angles to aid parking. Despite its many cameras, Tesla offers less for the driver. A few years ago, Tesla may have had a huge advantage in the market, but they are being overtaken.

Finally on the interstate and pointed home, I tried the cruise control. OK, it makes needless “boing” sounds. The computer simulation display of what’s going on around me is a neat gimmick, though I question it’s usefulness. Later, I engaged the auto steering. Yep, it keeps the car centered in the lane, just like my Kia, but it nags the driver way more. The Kia needs slight steering input less often, especially on the interstate. The Tesla seems to need something every 12 seconds but not too much or it will shut off — it is touchy. The Tesla auto steering doesn’t like construction any more than the Kia and the visualization of the construction cones is amusing.

My drive home was around 60 miles of surface streets in two different cities, interstate between them, and a two lane rural highway for the last leg. On all of these surfaces the Tesla was noticeably louder than my Kia. Bumps hit harder and harsher which set off the various squeaks and rattles coming from all over the interior. Wind, road, and tire noise were louder and of a different character than the EV6, sharper and more echo-like probably because of the glass roof. The decibel measuring app on my phone confirms the Tesla is louder than my EV6. I set up a test later, driving the cars back to back at 60 MPH. The Tesla made 68.8 dB into the wind and 68.7 dB on the return with a tailwind. The Kia made 65.9 into the wind and 65.3 with a tailwind. 

I had six incidents on my trip home and several more since then of the cruise control or auto steering on the Tesla misbehaving. The Tesla sometimes insists the speed limit is much lower than actually is. I suspect it is reading road signs and mistaking route markers for speed limits, but no matter the cause it is irritating. The auto steering cancels sometimes for reasons I don’t understand, though I will accept that user error might be playing a role. Then there is the phantom braking… in the first sixty miles it phantom braked three times for no perceptible reason and it has continued to do so nearly every time I drive it. It does this in auto steering and regular cruise control both. It actually seems worse in the day time than at night. Cresting a hill seems to be an aggravating factor. The Kia cruise control and lane centering are better. In 13,000 miles I’ve had one instance of minor misbehavior in my EV6.

A thing about the Tesla cruise control that I like better than the Kia is in stop and go traffic. If the Kia comes to a stop, the driver must push a button or press the accelerator briefly to get the car moving again at which point the cruise takes over. The Tesla just goes when the car in front moves. That’s neat. Another Tesla advantage is that the auto steering and cruise control cancel together. On my EV6, they are separate systems, either one can run alone, and cancelling one does not cancel the other. I prefer the way Tesla does that because there is no circumstance where I want the auto steering without the cruise control.

The automatic high beam headlight control on the Tesla is garbage. It doesn’t want to switch to low beams, even when the oncoming traffic is really close. I had to take manual control every time to avoid blinding people on a two lane rural highway. Then it will switch to low beams for yard lights in houses I pass. I’ve had or driven several cars with automatic high beam controls and all of them work much better than Tesla.

Side by side the Model Y is definitely larger than the Kia EV6. It is taller, longer, and wider. The Kia looks like a car to the Tesla’s SUV proportions. Both have comfortable seats with nice material. The Tesla heats all the seats, even the middle seat in the back. The Kia only heats the front but also ventilates them which is really nice. There is more head room in the Tesla and more room altogether in the back seat. Not that the EV6 is tight, but the Model Y does have more foot and head room in the back and more storage too. There is really no comparison in storage capacity, the Tesla has a big frunk, a big trunk, and a big area under the trunk. 

In the Model Y, so many things are in the touch screen. Climate controls including aiming the vents are in the touch screen, so are the windshield wipers, and most everything else. It is a nice screen, clear and responsive. The layout of menus is pretty good, like what one might expect from a good smartphone or tablet computer. The Tesla is very much a computer that you can drive. The Kia EV6 touch screen is much more automotive, functional but not as snazzy. Tesla’s dog mode is such a nice touch. I haven’t used it yet because I’m not letting my puppy in the Tesla unless I sell the Kia.

The smartphone app for Tesla is far better than what the Kia has. It does more. It shows more. It is better designed and most importantly it works. The Kia app has largely not worked for me three of the six months I’ve owned the car. I have a service appointment to replace the modem in the hopes that improves things, but it might be a software issue instead or some kind of issue with the local cellular network. Based on my interactions with Kia over this, I can say they just aren’t a tech company in the way Tesla are.

I think the Tesla Model Y Long Range is faster than the Kia EV6 Wind. I don’t have a good means of testing that to the faction of a second, but by the seat of the pants the Tesla feels quicker. Its steering is quicker and sharper. Overall it has more of a sports car feel. My Model Y also came with the trailer hitch and modes in the software to easily turn off sensors and alarms if there is a bike rack mounted on the hitch. My Kia required an aftermarket hitch and every time it is parked each of the relevant safety systems have to be changed from the touchscreen. It is a pain, but I don’t haul my bike around all that often. 

The Tesla seems to be more efficient and over a short test of both cars back to back the Tesla got 3.64 miles/kWh or 275 Wh/mile and the Kia got 3.5 miles/kWh or 286 Wh/mile which is not a huge difference, but enough to give the Model Y more range. I’ve seen averages of 4.1 or more miles/kWh (better than 250 Wh/mile) on the EV6 this summer, but I wanted to quote numbers from identical test drives. Good efficiency coupled with access to the Super Charger network and interior roominess makes the Tesla a better road trip car. There are far more Tesla fast charger stalls in the midwest than everything else combined and Tesla fixes their chargers if they break. There is a stall at an Electrify America station on a route I have used that has been broken down for months.

So which car am I going to keep and which one gets sold? I’m still evaluating, but I’ll probably keep the Kia and sell the Tesla. To be sure the Model Y is a good EV and if I hadn’t had the EV6 first, I’d be satisfied with the Tesla. However, I value a quiet, comfortable ride quality and the Kia is far superior to the Tesla with its sports car ride and noisy interior. I also use cruise control a lot, most every mile I drive. The Tesla cruise control and lane keeping systems are frankly not very good. The Kia systems are good, do what I want them to do, and are trustworthy. I understand that people love the computer-that-you-drive experience of Tesla, but I prefer having real buttons and controls that I can use by feel without looking. Importantly, I can sell the Tesla for more than I paid for it and probably do so easily. 

I’ve set the Model Y up with a tempered glass screen protector, all weather floor mats, a removable front plate bracket, under seat rear vent covers, and a mobile charger. Things I had researched long ago and should help keep the car in excellent condition. I’ll drive it a bit but mostly it will remain parked in my garage with the battery at 50-80% until I get around to selling it once I have the title from the state, assuming I sell the Model Y and not the EV6.

&#x200B;

https://preview.redd.it/q94x3supkao91.jpg?width=4032&format=pjpg&auto=webp&s=99d7f74081e7d223d7438d8de6215d58d8d61588

https://preview.redd.it/vnr6dwupkao91.jpg?width=2294&format=pjpg&auto=webp&s=73a1534e2193de6bb1c845372802498461bf6185

https://preview.redd.it/svzo2vupkao91.jpg?width=4032&format=pjpg&auto=webp&s=c2639cbba5b3f18c3f71d71e6581a791959be0d4

https://preview.redd.it/pfli3vupkao91.jpg?width=2100&format=pjpg&auto=webp&s=0876514e48c69b7b36d14208b2a176f2dd27d2ff",None,None,KiaEV6,Comparison between Kia EV6 and Tesla Model Y,0.99,https://www.reddit.com/r/KiaEV6/comments/xg45sb/comparison_between_kia_ev6_and_tesla_model_y/
SeaworthinessFun3772,None,None,1683427647.0,None,None,13aah5e,None,None,None,None,t3_13aah5e,25,None,/r/KiaEV6/comments/13aah5e/new_ev6gtline_makes_us_a_2ev_household/,None,93,Looks so good in black!,None,None,KiaEV6,New EV6-GT-Line makes us a 2-EV household!,0.96,https://i.redd.it/d4yr190p6dya1.jpg
Ancient_Ad5270,EV6 Wind AWD,None,1658757548.0,None,None,w7pomr,None,None,None,None,t3_w7pomr,35,None,/r/KiaEV6/comments/w7pomr/traded_my_2022_tesla_model_3_performance_in_for_a/,None,94,None,None,None,KiaEV6,Traded my 2022 Tesla Model 3 Performance in for a new Snow White Pearl Wind-Line (e-AWD) EV6,0.99,https://i.imgur.com/hldO8MA.jpg
billrand,EV6 GT (The Fast One),None,1703464722.0,None,None,18q7r5q,None,None,None,None,t3_18q7r5q,23,None,/r/KiaEV6/comments/18q7r5q/long_time_lurker_first_time_purchaser/,None,93,Almost 1000 miles in and lovin' it.,None,None,KiaEV6,"Long time lurker, first time purchaser.",1.0,https://i.redd.it/w766k6e77c8c1.png
JeffTechnically,EV6 Wind,None,1661803781.0,None,None,x0yhn4,None,None,None,None,t3_x0yhn4,12,None,/r/KiaEV6/comments/x0yhn4/love_these_tail_lights/,None,92,None,None,None,KiaEV6,LOVE these tail lights 😎,0.96,https://i.redd.it/e5xtl63bmpk91.jpg
badwolfjb,EV6 GT-Line AWD Limited Edition,None,1695825413.0,None,None,16tmb05,None,None,None,None,t3_16tmb05,31,None,/r/KiaEV6/comments/16tmb05/just_picked_up_my_first_kia_and_my_first_ev_and/,None,90,"Coming from a Rav4 Prime, which I was sad about replacing until I drove the EV6 home. This car is incredible! And it’s the same color scheme as my 2008 Miata 😆",None,None,KiaEV6,Just picked up my first Kia and my first EV and couldn’t be happier!,0.99,https://www.reddit.com/gallery/16tmb05
craigmac923,EV6 Wind,None,1680741560.0,None,None,12d3m74,None,None,None,None,t3_12d3m74,25,None,/r/KiaEV6/comments/12d3m74/joined_the_family_today/,None,90,2022 Wind RWD tech package,None,None,KiaEV6,Joined the family today,1.0,https://i.redd.it/5zircyfkb7sa1.png
FJKiller,None,None,1650734700.0,None,None,uaac05,None,None,None,None,t3_uaac05,33,None,/r/KiaEV6/comments/uaac05/just_picked_up_at_msrp/,None,88,None,None,None,KiaEV6,Just picked up at MSRP,0.98,https://i.redd.it/cz6ayd39cbv81.jpg
PartyEntrance2656,None,None,1629291987.0,None,None,p6qs2i,None,None,None,None,t3_p6qs2i,14,None,/r/KiaEV6/comments/p6qs2i/ev6_online_manual_in_english/,None,89,None,None,True,KiaEV6,EV6 ONLINE MANUAL IN ENGLISH,0.98,http://ev6.synology.me/en/index.html
pakot22,None,None,1679255106.0,None,None,11vvgci,None,None,None,None,t3_11vvgci,55,None,/r/KiaEV6/comments/11vvgci/annihilated_by_ca_weather/,None,86,None,None,None,KiaEV6,Annihilated by CA weather :(,0.99,https://www.reddit.com/gallery/11vvgci
UpdownRec,EV6 GT (The Fast One),None,1675373838.0,None,None,10s1nu7,None,None,None,None,t3_10s1nu7,31,None,/r/KiaEV6/comments/10s1nu7/meet_blackbird_check_out_the_kia_badge/,None,88,None,None,None,KiaEV6,Meet “Blackbird” (check out the KIA badge),0.99,https://i.redd.it/37t5m35lyvfa1.jpg
[deleted],None,None,1644447866.0,None,None,soqo3p,None,None,None,None,t3_soqo3p,32,None,/r/KiaEV6/comments/soqo3p/i_got_one/,None,84,None,None,None,KiaEV6,I got one,1.0,https://www.reddit.com/gallery/soqo3p
RideTheGradient,EV6 GT-Line AWD,None,1702664643.0,None,None,18j6mz1,None,None,None,None,t3_18j6mz1,27,None,/r/KiaEV6/comments/18j6mz1/drove_in_the_snow_for_the_first_time_car_handled/,None,85,None,None,None,KiaEV6,Drove in the snow for the first time. Car handled it like a champ and came out looking mean!,0.98,https://i.redd.it/kthg9rq54i6c1.jpeg
Former_Ad_5271,EV6 GT-Line AWD Limited Edition,None,1694955136.0,None,None,16kzwre,None,None,None,None,t3_16kzwre,20,None,/r/KiaEV6/comments/16kzwre/forest_green/,None,84,Picked it up last week 🙌,None,None,KiaEV6,Forest Green!,1.0,https://www.reddit.com/gallery/16kzwre
sewardpark2,None,None,1655948661.0,None,None,vilaui,None,None,None,None,t3_vilaui,15,None,/r/KiaEV6/comments/vilaui/it_just_makes_me_happy/,None,83,None,None,None,KiaEV6,It just makes me happy!,1.0,https://i.redd.it/uhgg5mb10a791.jpg
AZGoofballs,None,None,1682121300.0,None,None,12unfb5,None,None,None,None,t3_12unfb5,16,None,/r/KiaEV6/comments/12unfb5/im_part_of_the_cool_kids_club_now/,None,84,Picked up my 2023 EV6 Wind RWD yesterday! Damn I'm happy with it!,None,None,KiaEV6,I'm part of the Cool Kids Club now!,1.0,https://www.reddit.com/gallery/12unfb5
FunEnvironmental4840,None,None,1699836427.0,None,None,17tylyz,None,None,None,None,t3_17tylyz,18,None,/r/KiaEV6/comments/17tylyz/my_first_ev/,None,83,"2022 EV6 FE, 18k miles,  295/1500

Hi All,

My very plush, well-cared for 2012 F150 Platinum decided to check out and I needed a quick solution. I was caught unprepared and had not done any vehicle research (EV's or otherwise). The EV9 immediately caught my eye, but visits and calls to local dealerships were unproductive, as they currently have zero info on purchase/lease options (probably not in my budget anyway).

Long story short, I bought a 2022 EV6 FE on very short notice with minimal research. So far - WOW. Such a beautiful design and overall build quality is better than I expected from a KIA (just learning how far KIA has come in recent years). Not that I'll drive it this way much, but mashing the pedal in Sport mode is unreal. Oh yeah it also tows 2200 lbs? So cool.

J",None,None,KiaEV6,My first EV,0.98,https://i.redd.it/yfxcub4fi00c1.jpg
ThaiJohnnyDepp,EV6 GT-Line AWD,None,1674060203.0,None,None,10fbzc1,None,None,None,None,t3_10fbzc1,25,None,/r/KiaEV6/comments/10fbzc1/standing_out_in_irvine_ca/,None,80,None,None,None,KiaEV6,"Standing Out in Irvine, CA",1.0,https://i.imgur.com/UVAxkFF.jpg
prevailz1,EV6 GT (The Fast One),None,1710269492.0,None,None,1bd55pb,None,None,None,None,t3_1bd55pb,35,None,/r/KiaEV6/comments/1bd55pb/got_my_brother_to_buy_a_gt/,None,80,Now I won't feel so lonely showing up to EV car events.,None,None,KiaEV6,Got my brother to buy a GT.,0.98,https://www.reddit.com/gallery/1bd55pb
CosmicAvenger23,EV6 Wind AWD,None,1695987564.0,None,None,16v99at,None,None,None,None,t3_16v99at,17,None,/r/KiaEV6/comments/16v99at/my_first_ev/,None,77,None,None,None,KiaEV6,My first EV!,0.99,https://www.reddit.com/gallery/16v99at
AkiraSieghart,EV6 GT (The Fast One),None,1688990562.0,None,None,14vs3e8,None,None,None,None,t3_14vs3e8,40,None,/r/KiaEV6/comments/14vs3e8/walked_into_my_local_kia_dealer_on_saturday_to/,None,76,None,None,None,KiaEV6,Walked into my local Kia dealer on Saturday to test drive a GT as my first EV. Couldn't leave without it. Leased it on the spot!,0.96,https://i.redd.it/3dk81jiyn4bb1.jpg
JeffTechnically,EV6 Wind,None,1685980697.0,None,None,141j2m2,None,None,None,None,t3_141j2m2,72,None,/r/KiaEV6/comments/141j2m2/wireless_android_auto_and_carplay_coming/,None,80,Those is awesome news for anyone with a Hyundai or Kia with their widescreen radio! This is on the Hyundai Europe website. Wireless Android Auto and Carplay functionality has been noticeably absent up to this point.,None,None,KiaEV6,Wireless Android Auto and Carplay coming,0.93,https://i.redd.it/us79xw58284b1.jpg
FilmFan_67,None,None,1683138116.0,None,None,136v6gq,None,None,None,None,t3_136v6gq,29,None,/r/KiaEV6/comments/136v6gq/almost_1_year_with_my_2022_ev6_best_car_ive_ever/,None,76,None,None,None,KiaEV6,Almost 1 Year with my 2022 EV6. Best. Car. I've. Ever. Owned!!,0.96,https://i.redd.it/2xcoevl3snxa1.png
gbillsmith,EV6 Wind AWD,None,1676990740.0,None,None,11852sh,None,None,None,None,t3_11852sh,10,None,/r/KiaEV6/comments/11852sh/i_joined_the_ev6_family_over_the_weekend/,None,77,None,None,None,KiaEV6,I joined the EV6 family over the weekend!,0.98,https://i.redd.it/g78nrgrgilja1.jpg
Senthium,EV6 GT-Line RWD,None,1665497784.0,None,None,y1a744,None,None,None,None,t3_y1a744,28,None,/r/KiaEV6/comments/y1a744/charging_next_to_another_ev6/,None,78,I hadn't seen a red non gt up close.,None,None,KiaEV6,Charging next to another EV6,0.99,https://i.redd.it/kom2j69hq6t91.jpg
ralcantara79,EV6 GT-Line AWD,None,1685835474.0,None,None,13zttj7,None,None,None,None,t3_13zttj7,44,None,/r/KiaEV6/comments/13zttj7/i_was_just_supposed_to_do_a_test_drive/,None,75,Now I'm signing papers. I'm excited but nervous since this is my first EV.,None,None,KiaEV6,I was just supposed to do a test drive,0.95,https://i.redd.it/gl9jwy7e2w3b1.jpg
