author,author_flair_text,clicked,created_utc,distinguished,edited,id,is_original_content,is_self,link_flair_text,locked,name,num_comments,over_18,permalink,saved,score,selftext,spoiler,stickied,subreddit_name,title,upvote_ratio,url
Confident_Dot9834,None,None,1708642749.0,None,None,1axkk2s,None,None,None,None,t3_1axkk2s,714,None,/r/KiaEV6/comments/1axkk2s/is_there_any_way_i_could_report_this_guy/,None,696,"How come he didn't notice that this is the spot for the electric vehicle - specifically for charging! 
I waited him to come back and told him that he shouldn't have parked his car on the spot. It's a grocery store and there were numerous empty spaces. He didn't seem to understand or want to understand. He took his fulfilling time to load all the stuff to his trunk, and waited another passenger to come back to the car after returning the cart, and took some more time to get ready for driving, and left while i waited for him.
The sign is right in front of his windshield, on the bottom and the charging station is standing right next to him physically. I saw that the charging cable was obviously bothering him to load stuff and his kids in. 
Feel free to share your rage here. ",None,None,KiaEV6,Is there any way i could report this guy?,0.83,https://i.redd.it/hgqc6ex3w7kc1.jpeg
LavaSquid,EV6 Wind AWD,None,1699126432.0,None,None,17ntdu2,None,None,None,None,t3_17ntdu2,475,None,/r/KiaEV6/comments/17ntdu2/i_hate_tesla_but_i_gotta_thank_them_for_opening/,None,378,None,None,None,KiaEV6,"I hate Tesla, but I gotta thank them for opening up their charges in an otherwise charging desert.",0.83,https://i.redd.it/gwtvq308vdyb1.jpg
RichCop68,Air LR RWD,None,1684488111.0,None,None,13lqb1w,None,None,None,None,t3_13lqb1w,21,None,/r/KiaEV6/comments/13lqb1w/picked_up_today/,None,184,Beautiful British Racing Green - of course the ride had to get an outfit to match... Air LR rwd,None,None,KiaEV6,Picked up today!,0.98,https://i.redd.it/9qx2rztzrs0b1.jpg
Brikloss,None,None,1660934050.0,None,None,wslc93,None,None,None,None,t3_wslc93,66,None,/r/KiaEV6/comments/wslc93/good_news_the_ev6_is_an_incredibly_safe_car_bad/,None,177,None,None,None,KiaEV6,Good News: The EV6 is an incredibly safe car. Bad News: this is my EV6,1.0,https://i.imgur.com/A0l6s0p.jpg
Significant-Match568,EV6 GT-Line AWD,None,1692192768.0,None,None,15sq20f,None,None,None,None,t3_15sq20f,51,None,/r/KiaEV6/comments/15sq20f/just_joined_the_cool_kids/,None,173,"Just bought a brand new 2023 Kia Ev6 AWD GT-Line. 
And just in time for record high gas prices!!! I love my new baby ❤️",None,None,KiaEV6,Just joined the cool kids,0.99,https://www.reddit.com/gallery/15sq20f
sofa_king_nice,None,None,1677208995.0,None,None,11ah6nq,None,None,None,None,t3_11ah6nq,28,None,/r/KiaEV6/comments/11ah6nq/went_to_buy_a_rav4_ended_up_with_an_ev6/,None,150,None,None,None,KiaEV6,"Went to buy a RAV4, ended up with an EV6.",0.99,https://i.redd.it/yy6fe4agj3ka1.jpg
ReallyandWhybutHow,None,None,1665122283.0,None,None,xxr754,None,None,None,None,t3_xxr754,47,None,/r/KiaEV6/comments/xxr754/wrapped_the_roof_in_glossy_black_what_do_you_think/,None,148,None,None,None,KiaEV6,Wrapped the Roof in glossy Black. What do you think?,0.99,https://i.redd.it/tc4hzmexpbs91.jpg
saturdaycat,None,None,1669042670.0,None,None,z10zza,None,None,None,None,t3_z10zza,51,None,/r/KiaEV6/comments/z10zza/cancelled_my_model_y_reservation_and_picked_up/,None,145,None,None,None,KiaEV6,Cancelled my model Y reservation and picked up this beaut,0.99,https://i.imgur.com/6QdtXFX.jpg
SBR2TH,First Edition,None,1686882335.0,None,None,14aklp8,None,None,None,None,t3_14aklp8,11,None,/r/KiaEV6/comments/14aklp8/me_watching_the_new_season_of_black_mirror/,None,145,None,None,None,KiaEV6,Me watching the new season of Black Mirror,0.99,https://i.redd.it/kwk0f959ja6b1.jpg
Alex_py7,EV6 GT (The Fast One),None,1700414697.0,None,None,17z22ec,None,None,None,None,t3_17z22ec,53,None,/r/KiaEV6/comments/17z22ec/just_got_my_1st_electric_car_the_ev6_gt/,None,145,None,None,None,KiaEV6,"Just got my 1st electric car, the ev6 gt!!",0.94,https://www.reddit.com/gallery/17z22ec
soupskin_sammich,First Edition,None,1665012232.0,None,None,xwpps1,None,None,None,None,t3_xwpps1,46,None,/r/KiaEV6/comments/xwpps1/got_a_dog_for_my_ev6/,None,138,None,None,None,KiaEV6,Got a dog for my EV6,0.98,https://i.redd.it/3xlz3qrom2s91.jpg
eepluribus,EV6 Wind,None,1664445614.0,None,None,xr3qt0,None,None,None,None,t3_xr3qt0,41,None,/r/KiaEV6/comments/xr3qt0/using_ev6s_v2l_to_power_the_essentials_during/,None,137,None,None,None,KiaEV6,Using EV6's V2L to power the essentials during Hurricane Ian!,0.99,https://v.redd.it/564kacodtrq91
ravvvit,EV6 GT (The Fast One),None,1708581994.0,None,None,1awz82d,None,None,None,None,t3_1awz82d,62,None,/r/KiaEV6/comments/1awz82d/man_this_thing_is_beast/,None,139,I love this car. So glad I chose GT. ,None,None,KiaEV6,Man this thing is Beast,0.94,https://i.redd.it/07hko0fhv2kc1.jpeg
whatmodern,None,None,1683229392.0,None,None,137xoqd,None,None,None,None,t3_137xoqd,47,None,/r/KiaEV6/comments/137xoqd/not_sure_if_i_can_post_here_but_i_just_spotted/,None,136,None,None,None,KiaEV6,"Not sure if I can post here, but I just spotted the EV9 in Chino, California.",0.97,https://www.reddit.com/gallery/137xoqd
too_many_rules,None,None,1649265129.0,None,None,txr2t6,None,None,None,None,t3_txr2t6,3,None,/r/KiaEV6/comments/txr2t6/when_i_switch_to_sport_mode/,None,131,None,None,None,KiaEV6,When I switch to sport mode...,0.99,https://i.redd.it/phtpnq3dyxr81.jpg
YSU777,EV6 GT-Line AWD,None,1703960034.0,None,None,18ulrnm,None,None,None,None,t3_18ulrnm,43,None,/r/KiaEV6/comments/18ulrnm/got_our_first_ev_and_shes_a_beauty/,None,117,"Drove for around 35 miles on it so far, its amazing!",None,None,KiaEV6,Got our first EV and she’s a beauty!,0.98,https://i.redd.it/c54817w04h9c1.jpeg
SBR2TH,First Edition,None,1684151860.0,None,None,13i64v7,None,None,None,None,t3_13i64v7,48,None,/r/KiaEV6/comments/13i64v7/my_fe_urban_yellow_got_delivered_yesterday/,None,116,None,None,None,KiaEV6,My FE Urban Yellow got delivered yesterday ⚡️,0.99,https://i.redd.it/ju676le5010b1.jpg
unsure_about_life2,None,None,1663546227.0,None,None,xhwelv,None,None,None,None,t3_xhwelv,32,None,/r/KiaEV6/comments/xhwelv/got_my_awd_gtline_and_absolutely_love_it_i_want/,None,113,None,None,None,KiaEV6,Got my AWD GT-Line and absolutely love it! 🙂❤️ I want to thank this sub for being so helpful! Truly appreciate it! 🙏,0.99,https://i.redd.it/4trjhblhjpo91.jpg
exotic_craze,Long Range ,None,1707194984.0,None,None,1ak1o93,None,None,None,None,t3_1ak1o93,23,None,/r/KiaEV6/comments/1ak1o93/ev6_camper_conversion/,None,105,"So I may be a bit crazy but I decided to make a camper setup for my EV6 over the holidays...

It fits a full double bed and two, admittedly small, adults quite comfortably. The whole setup is completely toolless and can be installed or removed in about 2 minutes.

Pretty happy with it so far and absolutely love the versatility of the internal V2L port!",None,None,KiaEV6,EV6 Camper Conversion,0.98,https://www.reddit.com/gallery/1ak1o93
OhGriggsy,EV6 GT (The Fast One),None,1704674716.0,None,None,1917ufu,None,None,None,None,t3_1917ufu,49,None,/r/KiaEV6/comments/1917ufu/new_ev6_gt_owner/,None,102,"My 3rd day of ownership. First EV ever after I've honestly hated on them for years as me being a car and ICE enthusiast. 

Went in to a Kia dealership to help a friend out with getting them a car and after they pulled out one of the cars I test drove for him they pulled this into the showroom. Saw the body styling and matte grey paint, walked over and saw the interior and fell in love! 

It'll be nice to daily around town and maybe take when me and my girl go out on dates instead of taking the beamer. 

Any quirks or tips/tricks I should be made aware of? Things to look out for, maintenance, convenience options to turn on?",None,None,KiaEV6,New EV6 GT Owner!,0.98,https://i.redd.it/73ugat1454bc1.jpeg
Bubbly_Ball4883,None,None,1710844688.0,None,None,1bih6km,None,None,None,None,t3_1bih6km,19,None,/r/KiaEV6/comments/1bih6km/first_time_ev_owner/,None,101,"I finally made the move and purchased and 2023 EV6 RWD long range with 15,000 miles. WOW I’m in love with car. I was somewhat hesitant to buy a EV let alone a Kia but I’m impressed!!",None,None,KiaEV6,First time EV owner,0.99,https://www.reddit.com/gallery/1bih6km
NoSmellNoTell,None,None,1703347851.0,None,None,18p8vxr,None,None,None,None,t3_18p8vxr,17,None,/r/KiaEV6/comments/18p8vxr/thanks_for_everyones_advice_the_other_day_made/,None,98,The other day I came on here asking for perspective on owning the EV6 and got a ton of great feedback. The next day was about to negotiate a good deal on a RWD Wind and went for it. Love it so far! Thanks to everyone here for bringing some positive perspective!,None,None,KiaEV6,Thanks for everyone’s advice the other day - Made the purchase!,0.98,https://i.redd.it/ezq84eqoj28c1.jpeg
EVIE-2023,None,None,1676402550.0,None,None,112dpu4,None,None,None,None,t3_112dpu4,12,None,/r/KiaEV6/comments/112dpu4/new_ev6_for_valentines/,None,101,None,None,None,KiaEV6,New EV6 for Valentine’s,0.98,https://i.redd.it/fjdzh7ivf7ia1.jpg
Kowabummer88,None,None,1700682855.0,None,None,181i1l9,None,None,None,None,t3_181i1l9,19,None,/r/KiaEV6/comments/181i1l9/yacht_blue_crew/,None,99,First EV! AWD GT-Line 2 I’m in love! 😍,None,None,KiaEV6,Yacht Blue Crew!,0.98,https://i.redd.it/8w516zdafy1c1.jpeg
