author,author_flair_text,clicked,created_utc,distinguished,edited,id,is_original_content,is_self,link_flair_text,locked,name,num_comments,over_18,permalink,saved,score,selftext,spoiler,stickied,subreddit_name,title,upvote_ratio,url
KiwiEV,None,None,1709066077,None,None,1b1m8f5,None,None,None,None,t3_1b1m8f5,53,None,/r/nzev/comments/1b1m8f5/this_is_neat_an_electric_vehicle_towing_an/,None,296,None,None,None,nzev,"This is neat: an electric vehicle towing an electric excavator, both grabbing a rapid charge.",0.88,https://i.redd.it/aj8afngcu6lc1.jpeg
exotic_craze,None,None,1707196797,None,None,1ak27c6,None,None,None,None,t3_1ak27c6,56,None,/r/nzev/comments/1ak27c6/enough_about_rucs_wheres_my_ev_camping_crew_at/,None,202,"So I may be a bit crazy but I decided to make a camper setup for my EV6 over the holidays... 

It fits a full double bed and two, admittedly small, adults quite comfortably. The whole setup is completely toolless and can be installed or removed in about 2 minutes. 

Pretty happy with it so far and absolutely love the versatility of the internal V2L port.",None,None,nzev,"Enough about RUCs, where's my EV camping crew at?",0.91,https://www.reddit.com/gallery/1ak27c6
Bikerbass,None,None,1707327088,None,None,1al8gv0,None,TRUE,None,TRUE,t3_1al8gv0,184,None,/r/nzev/comments/1al8gv0/enough_is_enough/,None,163,"To all those bitching about RUC grow the fuck up. It’s not expensive at all, deal with it like everyone else who already has to deal with it. Which they do by paying and shutting up about it.

Rant over.",None,None,nzev,Enough is enough,0.68,https://www.reddit.com/r/nzev/comments/1al8gv0/enough_is_enough/
Sniperizer,None,None,1701841195,None,None,18bx2tq,None,None,None,TRUE,t3_18bx2tq,39,None,/r/nzev/comments/18bx2tq/nz_bloke_post_a_tiktok_vid_bashing_ev_cars/,None,147,So much misinformation right there.,None,None,nzev,NZ Bloke post a TikTok vid bashing EV cars.,0.72,https://v.redd.it/ks2rlo7m3m4c1
sleemanj,None,None,1710474942,None,None,1bf4za2,None,None,None,None,t3_1bf4za2,34,None,/r/nzev/comments/1bf4za2/government_mps_accidentally_cut_proposed_taxes/,None,135,None,None,None,nzev,Government MPs accidentally cut proposed taxes for hybrid cars in vote for wrong amendment,0.96,https://www.nzherald.co.nz/nz/politics/government-mps-accidentally-cut-proposed-taxes-for-hybrid-cars-in-vote-for-wrong-amendment/VHZRPYNLARHLDER6624PX33TAU/
mananuku,None,None,1706079313,None,None,19eb37j,None,None,None,None,t3_19eb37j,196,None,/r/nzev/comments/19eb37j/admin_fees_are_worse_than_ticketek/,None,137,$13 admin fee for RUC’s is just taking the piss.,None,None,nzev,Admin fees are worse than ticketek,0.88,https://i.redd.it/di3oqv5q5cec1.jpeg
TwistedCarBuyer,None,None,1705068874,None,None,194w1vl,None,TRUE,None,None,t3_194w1vl,191,None,/r/nzev/comments/194w1vl/seems_ute_owners_pretty_excited_about_having_new/,None,134,"On way back from Auckland,  charged at Bombay.  When I arrived one ute was parked at a charger. After  5 minutes, another ute owner parked up so she and her passenger could eat their food. They left after about 10 minutes . Shortly afterwards another ute parked next to me. I had looked over at the driver who said something I couldn’t hear. This driver popped his bonnet and put the charger cable in his engine bay and lowered the bonnet back down. He headed off to the chicken place, ordered his food then sat outside admiring his handiwork.
I assume these ute owners are so excited about the charging facility they are practicing parking in the charging spots while they wait for their EVs to be delivered /s.",None,None,nzev,Seems ute owners pretty excited about having new chargers at Bombay /s,0.85,https://www.reddit.com/r/nzev/comments/194w1vl/seems_ute_owners_pretty_excited_about_having_new/
OSiRiS-NZ,None,None,1707950705,None,None,1ar044v,None,None,None,None,t3_1ar044v,25,None,/r/nzev/comments/1ar044v/what_will_they_do_when_they_are_no_longer_free/,None,133,"I for one can't wait, it'll free up chargers for people who really need them in a pinch",None,None,nzev,What will they do when they are no longer free 😬,0.94,https://i.redd.it/t82j9r4cqmic1.png
KiwiEV,None,None,1702850419,None,None,18ksgru,None,None,None,None,t3_18ksgru,17,None,/r/nzev/comments/18ksgru/just_stopped_at_the_bombay_hills_chargers_to_find/,None,130,None,None,None,nzev,"Just stopped at the Bombay Hills chargers to find the new ones are already installed and active, meaning there is now charging for 12 electric cars here. Also, Z Energy across the road have installed two new chargers as well !",0.96,https://i.redd.it/o2vpmkddgx6c1.jpeg
OutInTheBay,None,None,1683679522,None,None,13dbjg8,None,None,None,TRUE,t3_13dbjg8,102,None,/r/nzev/comments/13dbjg8/kind_of_sums_up_stuff_comments_section_on_any_evs/,None,131,None,None,None,nzev,Kind of sums up Stuff comments section on any ev's....,0.85,https://i.redd.it/nccxx4omzxya1.jpg
Local_Yoghurt9320,None,None,1710824658,None,None,1bicfpb,None,None,None,None,t3_1bicfpb,112,None,/r/nzev/comments/1bicfpb/admin_fees_are_worse_than_ticketek/,None,124,None,None,None,nzev,Admin fees are worse than ticketek,0.92,https://i.redd.it/se96alh148pc1.jpeg
Former_child_star,None,None,1697409777,None,None,178r7zq,None,TRUE,NZ EV News,None,t3_178r7zq,273,None,/r/nzev/comments/178r7zq/ute_tax_lie_worked/,None,115,"And so it begins.

The first backwards step based on marketing lies and urban v rural dividing tactics. A big middle finger to reducing vehicle emmisions and a stop to helpIng feeding new EV'S into the 2nd hand market

https://www.stuff.co.nz/motoring/133125500/electric-vehicle-rebate-and-ute-tax-set-to-be-killed-off-in-december?fbclid=IwAR1KbAgRI0RdrHLZxODaRcPNrxYQIditum015jYLWRjj2ctwxdJxxHHWoWI",None,None,nzev,"""Ute tax"" lie worked",0.74,https://www.reddit.com/r/nzev/comments/178r7zq/ute_tax_lie_worked/
OutInTheBay,None,None,1683920291,None,None,13fuubg,None,None,None,None,t3_13fuubg,30,None,/r/nzev/comments/13fuubg/nicked_off_facebook_cummon_f_ess_up_its_you/,None,115,None,None,None,nzev,Nicked off Facebook- cummon- f ess up.... it's you!,0.99,https://i.redd.it/8z31pydkvhza1.jpg
Jariiari7,None,None,1705646838,None,None,19acxh5,None,None,None,None,t3_19acxh5,159,None,/r/nzev/comments/19acxh5/scrapping_clean_car_discount_will_cost_twice_what/,None,112,None,None,None,nzev,Scrapping Clean Car Discount will cost twice what it saves - transport officials,0.87,https://www.rnz.co.nz/news/political/507115/scrapping-clean-car-discount-will-cost-twice-what-it-saves-transport-officials
KiwiEV,None,None,1684470108,None,None,13lksdr,None,None,None,None,t3_13lksdr,69,None,/r/nzev/comments/13lksdr/stumbled_upon_this_absolutely_brilliant_number/,None,105,None,None,None,nzev,"Stumbled upon this absolutely brilliant number plate this arvo and had to grab my camera. Got a chuckle out of my cold, dead heart.",0.79,https://i.redd.it/n29od0mtsp0b1.jpg
RoscoePSoultrain,None,None,1705990051,None,None,19dhpfz,None,TRUE,None,None,t3_19dhpfz,66,None,/r/nzev/comments/19dhpfz/anyone_else_just_get_their_ruc_awareness_letter/,None,102,"Wife's RUC letter came addressed to her middle name, which confused us at first as it's also her late mother's name. My mate just sent a photo of his, and his is middle name, last name as well. Wondering if someone made a small error or a big one.",None,None,nzev,Anyone else just get their RUC awareness letter posted to their middle name?,0.9,https://www.reddit.com/r/nzev/comments/19dhpfz/anyone_else_just_get_their_ruc_awareness_letter/
coffeecakeisland,Tesla Model Y,None,1705375011,None,None,197siqe,None,None,None,None,t3_197siqe,282,None,/r/nzev/comments/197siqe/beehive_electric_vehicles_to_pay_road_user_charges/,None,101,None,None,None,nzev,Beehive: Electric vehicles to pay road user charges,0.94,https://www.beehive.govt.nz/release/electric-vehicles-pay-road-user-charges
KiwiEV,None,None,1702675667,None,None,18jarj7,None,None,None,None,t3_18jarj7,32,None,/r/nzev/comments/18jarj7/despite_the_local_council_seemingly_fighting/,None,98,None,None,None,nzev,"Despite the local council seemingly fighting against it for years, New Plymouth now has two new 150 kW hyper-chargers installed. Thats now an extra CCS x 3 + Chademo x 1, plus the existing 50 kW charger will remain for some time.",0.95,https://i.redd.it/jkibzsur0j6c1.jpeg
autech91,None,None,1702433737,None,None,18h5vek,None,None,None,None,t3_18h5vek,67,None,/r/nzev/comments/18h5vek/alright_fess_up_no_one_in_here_i_hope/,None,97,None,None,None,nzev,"Alright, fess up. No one in here I hope?",0.83,https://i.redd.it/4gq2sfgj1z5c1.jpg
KiwiEV,None,None,1689648297,None,None,152m1a3,None,None,None,None,t3_152m1a3,16,None,/r/nzev/comments/152m1a3/the_good_got_to_jump_waves_in_this_kiwiengineered/,None,94,None,None,None,nzev,The Good: got to jump waves in this kiwi-engineered electric jet boat today. The Bad: my phone escaped my pocket and is now with the Lord.,0.94,https://v.redd.it/v0ojjlmszmcb1
OutInTheBay,None,None,1689407414,None,None,1505nao,None,None,None,None,t3_1505nao,67,None,/r/nzev/comments/1505nao/first_cybertruck_built/,None,95,What's the bet Steve at Drive EV imports a few...,None,None,nzev,First cybertruck built,0.86,https://i.redd.it/2dt36h3l33cb1.jpg
OutInTheBay,None,None,1683790024,None,None,13eg1ph,None,None,None,None,t3_13eg1ph,101,None,/r/nzev/comments/13eg1ph/some_facts_for_the_hydrogen_fellas_in_here/,None,91,None,None,None,nzev,Some facts for the hydrogen fellas in here....,0.89,https://i.redd.it/381ks84847za1.jpg
VeetzsNZ,None,None,1702453146,None,None,18hbl34,None,None,None,None,t3_18hbl34,54,None,/r/nzev/comments/18hbl34/new_seals_at_byd/,None,84,"Nice to see just down at the Newmarket show room, left to right is premium, performance, dynamic",None,None,nzev,New Seals at BYD,0.86,https://i.redd.it/8e2lvsf9n06c1.jpg
GuysImConfused,Tesla Model 3 SR,None,1706165150,None,None,19f38yp,None,TRUE,None,None,t3_19f38yp,206,None,/r/nzev/comments/19f38yp/ev_ruc_costs_compared_to_ice_vehicle_fuel_excise/,None,76,"I've taken a look at the RUC numbers; and have come up with a few conclusions I'd like to share.   Some background: The roads in NZ are maintained by using a portion of money from the ""National Land Transport Fund"". This Fund (NLTP) gets its money from a few different sources, including:  	

1. Fuel Excise Duty 	        (FET) 	
2. Road User Charges	(RUC) 	
3. Vehicle & Driver Registration & Licensing 	
4. Road Tolling   

FET is paid by people who drive petrol cars, it is a charge they add on to the petrol price: it costs 70.024c per litre. (As a side note, the government taxes you on this FET so it actually costs 80.5276c, but this extra does not go to the NLTP so I will not count it).  

RUC is paid by Diesel Vehicles (since they don't pay FET) and now also EVs.   

The cost of a RUC is based on distance travelled, so you will have to buy a 1000km pre-pay card/license to display on your windshield for $76. You can buy multiple of 1000km, so if you want you can get 10,000km in one go. There will be an additional charge of $12.44 per transaction.  

So, if you buy a RUC License for 10,000km, you will pay $772.44 (76\*10 + 12.44). With this RUC License, if you commute 50 km per day, this will cost you $3.86 in RUC fees.    

Let's compare this to a 2010 Toyota Corolla with a fuel efficiency of 7.4L/100km. This vehicle can cover 50km by using 3.7L of petrol, so by comparison the FET this vehicle will pay to travel the same distance will be only $2.59. The EV is paying \~1.5x more to the NLTP for driving the same distance.   

Now imagine you have a more modern petrol car, with even greater efficiency, you will pay even less to the NLTP.  Another way to look at it (if we stick to the 10,000km RUC License example) would be to think of the EV as an ICE Vehicle with an efficiency of 11.03L/100km. Because that is the efficiency of the engine you'd need to be paying the same $3.86 in FET fees.  

The average age of the NZ light vehicle fleet is roughly 15 years. This means the 2010 Toyota Corolla represents the average fuel consumption of NZ vehicles,    
Why then is the RUC for EVs set to equivalent to vehicles which consume 11L/100km? It makes no sense.   

&#x200B;

TLDR:  EV Road User Charges are overpriced, even when you buy in  bulk it's the equivalent of a petrol car with the fuel efficiency of a tank (11L/100km).    
They should be priced lower to match the NZ average fuel consumption. ",None,None,nzev,EV RUC Costs Compared to ICE Vehicle Fuel Excise Tax: Unfair.,0.82,https://www.reddit.com/r/nzev/comments/19f38yp/ev_ruc_costs_compared_to_ice_vehicle_fuel_excise/
duggawiz,None,None,1689708923,None,None,15380sm,None,None,None,None,t3_15380sm,74,None,/r/nzev/comments/15380sm/bought_a_2019_leaf_g_62kwh_yesterday_from_the/,None,73,Used import leafs are outstanding value about now. Bought this 62kwh G spec with everything - leather seats and the works - for 2m jpy yesterday in the Japanese auctions. That’s about $32-33k landed and on the road less the 3500 rebate. Pretty stoked. I’m coming from a 2014 24kwh so it’ll be a big step up!,None,None,nzev,Bought a 2019 Leaf G 62kWh yesterday from the Japanese auctions,0.94,https://i.redd.it/878nbf850scb1.jpg
OkPerspective2560,None,None,1695119953,None,None,16mnihc,None,None,None,None,t3_16mnihc,270,None,/r/nzev/comments/16mnihc/new_zealand_announces_roaduser_tax_for_electric/,None,73,None,None,None,nzev,New Zealand announces road-user tax for electric vehicles,0.92,https://www.drive.com.au/news/new-zealand-announces-ev-road-user-tax/
OutInTheBay,None,None,1700008348,None,None,17vgyh3,None,None,None,None,t3_17vgyh3,82,None,/r/nzev/comments/17vgyh3/i_cant_wait_to_see_this_in_my_street/,None,68,None,None,None,nzev,I can't wait to see this in my street....,0.76,https://www.reddit.com/gallery/17vgyh3
Nikminute,None,None,1707073647,None,None,1aivmkj,None,TRUE,None,None,t3_1aivmkj,224,None,/r/nzev/comments/1aivmkj/hybrid_owners_trying_to_remove_plugs_to_avoid/,None,69, https://www.rnz.co.nz/news/national/508403/hybrid-owners-trying-to-remove-plugs-to-avoid-road-user-charges,None,None,nzev,Hybrid owners trying to remove plugs to avoid road user charges,0.9,https://www.reddit.com/r/nzev/comments/1aivmkj/hybrid_owners_trying_to_remove_plugs_to_avoid/
KiwiEV,None,None,1702616774,None,None,18isf6x,None,None,None,None,t3_18isf6x,13,None,/r/nzev/comments/18isf6x/if_anyones_bored_i_took_a_byd_seal_for_a_decent/,None,63,None,None,None,nzev,"If anyone's bored, I took a BYD Seal for a decent drive and looked at its pros and cons. Short version: it's one of my favorite cars now. Even with that slow charging speed.",0.94,https://youtu.be/Tj_g7n_bqjU?si=0XByv1XNw11QdJxx
Rupyah,None,None,1682981331,None,None,1353vao,None,None,None,None,t3_1353vao,28,None,/r/nzev/comments/1353vao/free_charging_etiquette/,None,67,"Hi

This may have been posted before here, but i am new to this sub and to EVs, recently went for vector rapid chargers which are P30 and majority of people i have come across respect that. But recently i encountered two cars which were parked (with no occupants/ driver) there from how long idk as the charging was stopped. Another guy ( tesla model X)  was trying make the most of the situation by parking in the passage and charging. So i asked the lady when she arrived if she should have waited until her charging finished and move the car to other parking spot. She didn’t seem to believe that was right thing to do.


So i ask you should we start to post their pictures with rego or this is going too far.",None,None,nzev,Free charging etiquette!,0.89,https://www.reddit.com/gallery/1353vao
RobDickinson,None,None,1637198496,None,None,qwe54i,None,None,None,None,t3_qwe54i,10,None,/r/nzev/comments/qwe54i/this_is_councillor_murray_chong_hes_one_of_the/,None,62,None,None,None,nzev,"This is Councillor Murray Chong. He's one of the reasons New Plymouth won't get a tesla supercharger site, if you live locally you can vote him out.",0.99,https://i.redd.it/0vzgpvx5a9081.jpg
thestokesnz,None,None,1703895157,None,1704007684,18u1pif,None,TRUE,None,None,t3_18u1pif,57,None,/r/nzev/comments/18u1pif/charger_etiquette/,None,63,"So we just bought an MG 4 and rather than wait for it to be shipped from Auckland decided on a road trip down to Welly. First stop is at Cambridge just to top up and understand the ins and outs of charging. Downloaded the appropriate app plugged in set charging and decided to get some lunch with the rug rats and then I get an alert that charging is complete think wow that was quick as we were at 50% but ok. Go back to the car and some has unplugged us and plugged themselves in. We got back to just over 80% but should one of us been waiting with the car? Not super happy that someone did this and just want to clarify what we should be doing and if this is normal behaviour?

Edit for further details:

Just to clarify it was a BP charger, the car was at 82% when unplugged, we were keeping an eye on the app hence us going back out to see what was going on and no we didn’t see or confront the other driver as we had no idea if this was kosher or not. Thanks for all the feedback. EV drivers in our limited experience so far have been amazeballs hence this hitting us for 6. Thanks to all the trolls for making this interesting both here and on the road",None,None,nzev,Charger etiquette,0.88,https://www.reddit.com/r/nzev/comments/18u1pif/charger_etiquette/
OutInTheBay,None,None,1702837138,None,None,18knhdv,None,TRUE,None,None,t3_18knhdv,20,None,/r/nzev/comments/18knhdv/it_looks_like_gavin_is_going_to_break_50k_on_his/,None,61,https://youtu.be/Tj_g7n_bqjU?si=xdFBJnqNSPl5td0S,None,None,nzev,It looks like Gavin is going to break 50k on his video...,0.85,https://www.reddit.com/r/nzev/comments/18knhdv/it_looks_like_gavin_is_going_to_break_50k_on_his/
7C05j1,Tesla Model 3 LR,None,1624944345,None,1681510578,oa1spz,None,TRUE,None,None,t3_oa1spz,14,None,/r/nzev/comments/oa1spz/some_links_for_new_ev_owners/,None,60,"Here are some links that new EV owners may find useful:

* [EVDB](https://evdb.nz) statistics and specifications on EVs on NZ
* [ChargeNet](https://charge.net.nz) NZ's major charging network (get an account, an RFID fob and load the app on your phone)
* [Openloop](https://www.openloop.co.nz) charging stations, mostly around the Waikato region (get and account and preload with cash so you can use the chargers)
* [PlugShare](https://www.plugshare.com) cloud sourced list of charging stations
* [BetterNZTrust](https://www.leadingthecharge.org.nz) supporting and advocating EVs in NZ (check the info tab for FAQ, charging etiquette, where to buy and more)
* [Drive Electric](https://driveelectric.org.nz) EV policy and advocacy
* [EVs & Beyond](https://evsandbeyond.co.nz) NZ EV online magazine
* [NZTA](https://nzta.govt.nz/vehicles/vehicle-types/electric-vehicles/) page on electric vehicles, and [apply for the clean car rebate](https://transact.nzta.govt.nz/v2/apply-clean-car-rebate)
* [WorkSafe](https://www.worksafe.govt.nz/managing-health-and-safety/consumers/safe-living-with-electricity/safely-charging-your-electric-vehicle-at-home/) info on technical and safety details of EV charging
* [GenLess](https://genless.govt.nz/moving/lower-energy-transport/electric-vehicles/why-buy-an-ev/) page of EV info (choosing one, charging, range, etc)
* [PAS 6011](https://www.standards.govt.nz/shop/snz-pas-60112021/) standard for residential EV chargers
* Many car rental companies offer EVs, so you can try before you buy.

Edit: links updated",None,TRUE,nzev,Some links for new EV owners,0.97,https://www.reddit.com/r/nzev/comments/oa1spz/some_links_for_new_ev_owners/
Jariiari7,None,None,1705481409,None,None,198s4p4,None,None,None,None,t3_198s4p4,30,None,/r/nzev/comments/198s4p4/new_zealand_exceeds_50_electric_vehicle/,None,61,None,None,None,nzev,New Zealand Exceeds 50% Electric Vehicle Penetration In December 2023,0.88,https://cleantechnica.com/2024/01/07/new-zealand-exceeds-50-electric-vehicle-penetration-in-december-2023/
Dat756,None,None,1701997645,None,None,18datii,None,None,None,None,t3_18datii,60,None,/r/nzev/comments/18datii/nzs_cheapest_ev_recalled_over_concerns_it_can/,None,61,None,None,None,nzev,NZ's cheapest EV recalled over concerns it can electrocute people,0.93,https://www.stuff.co.nz/motoring/133411140/nzs-cheapest-ev-recalled-over-concerns-it-can-electrocute-people
Dat756,None,None,1706855685,None,None,1agxcms,None,TRUE,None,None,t3_1agxcms,122,None,/r/nzev/comments/1agxcms/dramatic_decrease_in_evs_in_january/,None,55,"From the [Waka Kotahi vehicle registration data](https://nzta.govt.nz/resources/new-zealand-motor-vehicle-register-statistics/new-zealand-vehicle-fleet-open-data-sets/) updated today, there were 288 EV cars registered in January, compared with 4338 in December 2023 and an average of over 2,100 per month in 2023.

This is the lowest monthly total of EV registrations since the Covid lockdown in early 2020.",None,None,nzev,Dramatic decrease in EVs in January,0.82,https://www.reddit.com/r/nzev/comments/1agxcms/dramatic_decrease_in_evs_in_january/
BonChance123,None,None,1695454572,None,1695551028,16py4wk,None,TRUE,None,None,t3_16py4wk,44,None,/r/nzev/comments/16py4wk/outsiders_opinion_nz_has_the_best_ev_charging/,None,56,"Hey all,

A tourist here who's been traveling around the South Island in an EV for the last week. I've driven over 1000 km including Aoraki National Park, Queenstown, Dunedin, and Christchurch. First off, wanted to say thank you to a few folks who pointed out some key tips for me as I planned my EV trip, especially getting a ChargeNet RFID FOB in advance.

So, this may run contrary to many opinions here, but in my experience, NZ has the best EV charging network. I essentially lost any sense of range anxiety after a day or two. It felt like every 30-50 km, there was a ChargeNet L3 station that I could generally depend on. I rarely saw a station down in the entire island on the ChargeNet app. There were two spots where I had to wait a few minutes for someone else's car to finish, but everyone was very diligent about moving their vehicles once finished.

In the future, the main limitation I can see are queues for the stations as more people transition to EVs. So increasing the number of stations in a location will probably be key. But in my admittedly limited experience, NZ has made it by far the easiest and more comfortable for EV travel. I've driven EVs extensively in a couple of other countries of differing degrees of modernization (U.S. and Sri Lanka), and I've unsuccessfully tried to plan EV trips in some (Australia and Japan). NZ takes the cake above all of those!

Edit: in case anyone is curious, I did this in a Polestar 2 single motor long range through Sixt NZ. I ended up driving over 1500 km start to finish.",None,None,nzev,Outsider's opinion: NZ has the best EV charging network,0.84,https://www.reddit.com/r/nzev/comments/16py4wk/outsiders_opinion_nz_has_the_best_ev_charging/
OutInTheBay,None,None,1682109792,None,None,12uho3v,None,None,None,TRUE,t3_12uho3v,89,None,/r/nzev/comments/12uho3v/keep_it_simple_silly/,None,56,None,None,None,nzev,Keep it simple silly...,0.65,https://i.redd.it/qymh2a41ccva1.jpg
HarmLessSolutions,Polestar 2,None,1684376188,None,None,13klm0w,None,TRUE,None,None,t3_13klm0w,52,None,/r/nzev/comments/13klm0w/government_boosting_ev_charge_network/,None,58,"From today's budget "" $120 million over four years to expand the network of EV chargers to up to 23 hubs, each with 20 chargers ""

Sounds like they're proposing installations along the lines of the Gridserve ones in the UK. We live in hope.

[https://www.gridserve.com/electric-vehicle-charging/electric-forecourt/braintree/](https://www.gridserve.com/electric-vehicle-charging/electric-forecourt/braintree/)",None,None,nzev,Government boosting EV charge network,0.94,https://www.reddit.com/r/nzev/comments/13klm0w/government_boosting_ev_charge_network/
7C05j1,Tesla Model 3 LR,None,1649984335,None,None,u3w3st,None,None,None,None,t3_u3w3st,34,None,/r/nzev/comments/u3w3st/nz_ev_new_price_vs_range/,None,56,None,None,None,nzev,NZ EV New Price vs Range,0.99,https://i.redd.it/ysgfyacyclt81.png
bo-tanit,None,None,1709618024,None,1709793940,1b6xzbg,None,TRUE,NZ EV News,None,t3_1b6xzbg,58,None,/r/nzev/comments/1b6xzbg/submissions_on_the_ruc_bill_are_open_for_2_days/,None,59,"The EVs on RUC Bill went through its first stage in Parliament today, and is being sent to select committee for what must be one of the shortest ever periods (Select Committee has till next Thursday to recommend changes to the legislation). Submissions are open for less than 48 hours - they appear to close midday Thursday 7 March.  


EDIT: Submissions are now closed. There is a public hearing at 9-11.35am on Friday 8 March, presumably to hear from submitters. Live stream available on the transport and infrastructure committee website:

[https://www.parliament.nz/en/pb/sc/scl/transport-and-infrastructure/news-archive/watch-public-meetings-of-the-transport-and-infrastructure-committee/](https://www.parliament.nz/en/pb/sc/scl/transport-and-infrastructure/news-archive/watch-public-meetings-of-the-transport-and-infrastructure-committee/)",None,None,nzev,Submissions on the RUC Bill are open for 2 days,0.87,https://www.reddit.com/r/nzev/comments/1b6xzbg/submissions_on_the_ruc_bill_are_open_for_2_days/
sleemanj,None,None,1694306234,None,None,16elxor,None,None,None,None,t3_16elxor,203,None,/r/nzev/comments/16elxor/all_vehicles_to_move_to_road_user_charges_under/,None,60,None,None,None,nzev,"All vehicles to move to road user charges under National, including EVs",0.87,https://www.stuff.co.nz/national/politics/132900566/all-vehicles-to-move-to-road-user-charges-under-national-including-evs
