author,author_flair_text,clicked,created_utc,distinguished,edited,id,is_original_content,is_self,link_flair_text,locked,name,num_comments,over_18,permalink,saved,score,selftext,spoiler,stickied,subreddit_name,title,upvote_ratio,url
kiwittnz,None,None,1708055739,None,None,1arz7xz,None,None,None,TRUE,t3_1arz7xz,31,None,/r/nzev/comments/1arz7xz/is_this_really_how_much_it_costs_to_charge_evs_is/,None,57,None,None,None,nzev,Is this really how much it costs to charge EVs? Is this why they are reducing the rate free-chargers charge EVs?,0.7,https://v.redd.it/asusz8hfevic1
Headcoach45,None,None,1707948468,None,None,1aqz9bi,None,None,None,None,t3_1aqz9bi,29,None,/r/nzev/comments/1aqz9bi/fleet_of_volvo_ex30s_spotted/,None,55,"Spotted in Wynyard Quarter, Auckland.. very smart looking little cars with great specs 👍",None,None,nzev,Fleet of Volvo EX30s spotted,0.97,https://i.redd.it/99kwtrznjmic1.jpeg
OSiRiS-NZ,None,None,1703358284,None,None,18pciy0,None,None,None,None,t3_18pciy0,113,None,/r/nzev/comments/18pciy0/blue_looks_great_in_the_sun/,None,56,"Brand new blue Tesla Model 3 Highland in the sun, looks great. Seems like build quality has come a long way",None,None,nzev,Blue looks great in the sun,0.61,https://www.reddit.com/gallery/18pciy0
lcmortensen,None,None,1695105824,None,None,16mjpk9,None,None,None,None,t3_16mjpk9,50,None,/r/nzev/comments/16mjpk9/ford_reveals_plugin_ranger_ute_coming_to_nz_in/,None,53,None,None,None,nzev,"Ford reveals plug-in Ranger ute, coming to NZ in 2025",0.93,https://www.stuff.co.nz/motoring/132967990/ford-reveals-plugin-ranger-ute-coming-to-nz-in-2025
aidanpalmer,Tesla Model 3 SR,None,1669009812,None,None,z0qy9t,None,None,None,None,t3_z0qy9t,31,None,/r/nzev/comments/z0qy9t/any_of_yall_waiting_on_a_tesla/,None,54,None,None,None,nzev,Any of y’all waiting on a Tesla?,0.96,https://www.reddit.com/gallery/z0qy9t
fetchit,None,None,1693119296,None,None,162j5wb,None,TRUE,None,None,t3_162j5wb,27,None,/r/nzev/comments/162j5wb/tesla_owners_if_people_are_flashing_lights_at_you/,None,53,"Go to car button > service > adjust headlights. Your car will suddenly calibrate the headlights itself. 

People kept flashing their lights at me. So I tried this. Mine moved down at least 6 inches.",None,None,nzev,"Tesla owners. If people are flashing lights at you, do this now.",0.96,https://www.reddit.com/r/nzev/comments/162j5wb/tesla_owners_if_people_are_flashing_lights_at_you/
KiwiEV,None,None,1671778605,None,None,zt8ug7,None,None,None,None,t3_zt8ug7,11,None,/r/nzev/comments/zt8ug7/in_this_crap_video_i_put_the_byd_atto_3_against/,None,50,None,None,None,nzev,In this crap video I put the BYD ATTO 3 against the MG ZS EV to find out which is better value. Ten days of filming and editing means this kiwi is gonna have a drink now. 😅,1,https://www.youtube.com/watch?v=i3KaKeh_ky0
llewellynnz,None,None,1710798638,None,None,1bi336m,None,None,None,None,t3_1bi336m,74,None,/r/nzev/comments/1bi336m/government_to_stick_with_38_phev_ruc_rate_bev/,None,49,None,None,None,nzev,Government to stick with $38 PHEV RUC rate; BEV still $76,0.93,https://evsandbeyond.co.nz/government-to-stick-with-38-phev-ruc-rate/?fbclid=IwAR0XYn9PQEHVjgPvjHmYQdJdGB0pP9ePFUaG0EXcf_xWqYRrknUU7oG6uYA
kiwittnz,None,None,1708408953,None,None,1avahcx,None,TRUE,None,None,t3_1avahcx,116,None,/r/nzev/comments/1avahcx/ive_had_a_rethink_of_the_prices_of_evs_and_feel_a/,None,50,"I've been in the tech industry for decades, and I have seen the costs of early adopter tech always been higher than regular prices.

For example, when I first saw a 40"" LCD TV (an NEC product), it was over NZ$20,000, and now you can get them for around NZ$500.

I doubt EVs will drop that much from their current highs, but I do expect them to drop to more sensible prices when EVs become mainstream.",None,None,nzev,I've had a re-think of the prices of EVs and feel a bit stupid why I did not think this in the first place.,0.82,https://www.reddit.com/r/nzev/comments/1avahcx/ive_had_a_rethink_of_the_prices_of_evs_and_feel_a/
FishSawc,None,None,1691906091,None,None,15pquik,None,None,None,None,t3_15pquik,19,None,/r/nzev/comments/15pquik/under_construction_at_the_glenfield_mall/,None,47,Interesting location.,None,None,nzev,Under Construction at the Glenfield Mall…,0.93,https://i.redd.it/lmarx19ghthb1.jpg
KiwiEV,None,None,1683273222,None,None,138ekxy,None,None,None,None,t3_138ekxy,1,None,/r/nzev/comments/138ekxy/had_fun_driving_this_120_year_old_electric_car/,None,49,None,None,None,nzev,Had fun driving this 120 year old electric car through the streets of Christchurch.,0.98,https://youtu.be/OK5Fa1hFwQE
WorldlyNotice,None,None,1694114942,None,None,16cnurk,None,None,None,None,t3_16cnurk,90,None,/r/nzev/comments/16cnurk/new_zealanders_share_regrets_over_buying_teslas/,None,45,None,None,None,nzev,New Zealanders share regrets over buying Teslas,0.73,https://www.newshub.co.nz/home/lifestyle/2023/09/new-zealanders-share-regrets-over-buying-teslas.html
RobDickinson,None,None,1658960885,None,None,w9s1dx,None,None,None,None,t3_w9s1dx,6,None,/r/nzev/comments/w9s1dx/petrol_app_gaspy_to_add_ev_charging_price/,None,47,None,None,None,nzev,Petrol app Gaspy to add EV charging price monitoring,0.98,https://evsandbeyond.co.nz/petrol-app-gaspy-to-add-ev-charging-price-monitoring/
OutInTheBay,None,None,1698946671,None,None,17m90eb,None,None,None,None,t3_17m90eb,31,None,/r/nzev/comments/17m90eb/now_that_would_be_a_great_park_n_ride/,None,47,250 cars can charge,None,None,nzev,Now that would be a great park n ride..,0.93,https://i.redd.it/my8jdisp0zxb1.jpg
KiwiEV,None,None,1692334893,None,None,15uasre,None,None,None,None,t3_15uasre,16,None,/r/nzev/comments/15uasre/a_cheeky_vid_for_your_weekend_i_took_the_mg4/,None,44,None,None,None,nzev,"A cheeky vid for your weekend: I took the MG4 'Essence 64' for a drive. To save you a click, range is 435km (realistic 381km), price is $48k after the rebate, PSC is 48. Got such a positive vibe from this car to the point I've been toying with the idea of buying the entry level one myself.",0.98,https://www.youtube.com/watch?v=cWjdf70errI
StartConstant,None,None,1643503872,None,None,sfwj6o,None,TRUE,None,None,t3_sfwj6o,23,None,/r/nzev/comments/sfwj6o/entitled_ev_drivers_at_chargers/,None,47,"The few times I’ve used public chargers, I often get people coming up and asking me what % I’m on, where am I going, and trying to tell me I don’t really need to charge. 

They can clearly see on the screen I’ve only been there for 5-10 minutes! I once had a lady try to tell me I could only charge for 30 minutes when she could clearly see I had only been there for 12 minutes! Today I had been at a charger for 5 minutes (said so on the screen) when another guy pulled up. I had already waited for the Tesla to finish charging before me. He tries to tell me I had plenty of charge to get to whangarei and I didn’t need to charge. Why do these people feel like they’re more entitled to the charger than me?! 

Rant over.",None,None,nzev,Entitled EV drivers at chargers,0.98,https://www.reddit.com/r/nzev/comments/sfwj6o/entitled_ev_drivers_at_chargers/
OkPerspective2560,None,None,1705436961,None,1705446204,198d02n,None,TRUE,None,None,t3_198d02n,253,None,/r/nzev/comments/198d02n/comparing_costs_of_ownership_of_a_brand_new_ev_vs/,None,47,"With RUCs looming I was interested to try figure out what the total costs for owning a brand new EV vs ICE were.

My plan is to expand this beyond the first year, include depreciation etc as well, but was quite surprised by how close the costs actually were when you did the sums.

I tried to pick vehicles around the same price point and specification on the NZ market, and you can see the difference between home charging and public charging, I'll add in some percentage home / percentage public at some stage too.

\*edit\* Now with second year stats.

&#x200B;

https://preview.redd.it/hbqxraq5vvcc1.png?width=1224&format=png&auto=webp&s=664bad2ef5aca060d59c960f59f9ee4970202735",None,None,nzev,Comparing costs of ownership of a brand new EV vs brand new ICE vehicle,0.88,https://www.reddit.com/r/nzev/comments/198d02n/comparing_costs_of_ownership_of_a_brand_new_ev_vs/
jozaar,None,None,1701327602,None,None,187cffd,None,TRUE,None,None,t3_187cffd,128,None,/r/nzev/comments/187cffd/does_anyone_else_think_chargers_at_petrol/,None,45,"Personally if I could pick where chargers go I would put them places like:

-scenic look outs

-besides short walks

-next to children's playgrounds 

-in small towns that I never pervious knew existed and can walk around in 20 minutes

-beside a mini golf course 


Rather that right beside my ex's house that swindled me for half my life savings",None,None,nzev,Does anyone else think chargers at petrol stations are stupid,0.67,https://www.reddit.com/r/nzev/comments/187cffd/does_anyone_else_think_chargers_at_petrol/
BRINGtheCANNOLI,None,None,1682962640,None,None,134v1zn,None,None,None,None,t3_134v1zn,52,None,/r/nzev/comments/134v1zn/government_shakes_up_clean_car_discount_scheme/,None,43,None,None,None,nzev,Government shakes up Clean Car Discount scheme,0.92,https://www.stuff.co.nz/national/politics/131911195/government-shakes-up-clean-car-discount-scheme
nos3001,None,None,1707180962,None,None,1ajx0qv,None,TRUE,None,None,t3_1ajx0qv,86,None,/r/nzev/comments/1ajx0qv/as_an_ev_owner_whats_the_strangest_thing_youve/,None,45,"For me so far it's ""do you miss going to gas stations?""",None,None,nzev,"As an EV owner, what's the strangest thing you've been asked?",0.93,https://www.reddit.com/r/nzev/comments/1ajx0qv/as_an_ev_owner_whats_the_strangest_thing_youve/
calebleemcd,None,None,1674775951,None,None,10m609m,None,None,None,None,t3_10m609m,39,None,/r/nzev/comments/10m609m/we_need_more_chargers_5_car_queue_at_murchison/,None,45,None,None,None,nzev,We need more chargers! 5 car queue at Murchison!,1,https://i.imgur.com/Da01lpx.jpg
james_the_k,None,None,1654113125,None,None,v2ppg3,None,None,None,None,t3_v2ppg3,49,None,/r/nzev/comments/v2ppg3/when_facts_get_in_the_way_of_strongly_held/,None,44,None,None,None,nzev,When facts get in the way of strongly held opinions,0.96,https://i.redd.it/jxyxr7uxd2391.png
Drslytherin,None,None,1708546225,None,None,1awlzh4,None,TRUE,NZ EV News,None,t3_1awlzh4,43,None,/r/nzev/comments/1awlzh4/volkswagen_slashes_its_electric_vehicle_prices_in/,None,41,"https://www.stuff.co.nz/motoring/350188423/volkswagen-slashes-its-electric-vehicle-prices-nz-again     
  
  
Big price drops. Definitely makes it more competitive",None,None,nzev,Volkswagen slashes its electric vehicle prices in NZ (again),0.93,https://www.reddit.com/r/nzev/comments/1awlzh4/volkswagen_slashes_its_electric_vehicle_prices_in/
Weak_Possibility8334,None,None,1705619813,None,None,19a40dd,None,TRUE,None,None,t3_19a40dd,226,None,/r/nzev/comments/19a40dd/mg_ldv_great_wall_and_other_chinese_evs_and_ice/,None,43,"Just a reminder from a poor sucker who has to try and fix these abominations. Just don't buy one, they are beyond awful and really shouldn't be allowed to be sold here as they are clearly not fit for purpose.  


&#x200B;",None,None,nzev,"MG, LDV, Great Wall and other Chinese EV's (and ice vehicles for that matter).",0.63,https://www.reddit.com/r/nzev/comments/19a40dd/mg_ldv_great_wall_and_other_chinese_evs_and_ice/
forwardingdotcodotnz,None,None,1697010399,None,None,1758iob,None,TRUE,None,None,t3_1758iob,19,None,/r/nzev/comments/1758iob/importing_an_electric_vehicle_from_japan_to_new/,None,43,"Here is my experience importing an EV from Japan.

Basically a greenhat's experience from start to finish:

[https://www.forwarding.co.nz/importing-an-electric-vehicle-from-japan-to-new-zealand](https://www.forwarding.co.nz/importing-an-electric-vehicle-from-japan-to-new-zealand)

&#x200B;",None,None,nzev,Importing an Electric Vehicle from Japan to New Zealand (My Experience),0.93,https://www.reddit.com/r/nzev/comments/1758iob/importing_an_electric_vehicle_from_japan_to_new/
RobDickinson,None,None,1680576359,None,None,12b6yq9,None,None,None,None,t3_12b6yq9,67,None,/r/nzev/comments/12b6yq9/tesla_price_drop_model_3_from_65k_model_y_from_70k/,None,42,None,None,None,nzev,"Tesla price drop - Model 3 from $65k, Model Y from $70k",0.98,https://www.reddit.com/gallery/12b6yq9
KiwiEV,None,None,1705636843,None,None,19aa04v,None,None,None,None,t3_19aa04v,11,None,/r/nzev/comments/19aa04v/i_took_a_2024_polestar_2_long_range_for_a_blat_to/,None,43,None,None,None,nzev,I took a 2024 Polestar 2 Long Range for a blat to Wellington with one one quick charge. It went further than I expected.,1,https://youtu.be/EgKgN2Rv7kg
RobDickinson,None,None,1682913447,None,None,134byru,None,None,None,None,t3_134byru,35,None,/r/nzev/comments/134byru/april_ev_sales_23_of_new_car_sales_machee_shows/,None,41,None,None,None,nzev,"April EV sales - 23% of new car sales - Mache-E shows up , BYD leads",0.92,https://www.reddit.com/gallery/134byru
doineedaname42069,None,None,1701823729,None,None,18brisf,None,None,None,None,t3_18brisf,49,None,/r/nzev/comments/18brisf/model_3_highland_test_drive/,None,38,"Tested the new Model 3.
Here's the differences I noticed from my 2022 Model 3

● Quieter
● More comfortable, suspension is great. The way it handles speed bumps is a massive improvement.  Doesn't jolt you. 
● Handling is even better, steering is sharper, sport handling seems lighter. 
● Blind spot light is bright enough but looks a little rubbish IMO. Would have been cool as a T
● Cooled seat were nice, wish it would be stronger on the back rather than bottom. My back needed more cooling than my nuts. 
● Because the cabin is quieter it seems like the air conditioning system is louder now or more noticeable even on low.
● Door thud is solid and sounds more European. 
● Using the screen to put it into drive and reverse was great and didn't have me missing the gear selector. The indicators are a bit weird.

I really like the rear, looks great and the fact it has two power struts is better.
Not the biggest fan of the front. Maybe it'll grow on me.

The way it is now, quieter and more comfortable and refined is the way I always imagined and hoped my M3 was going to be like from the start. 

Would I upgrade? Probably not just yet.",None,None,nzev,Model 3 Highland - Test Drive,0.85,https://www.reddit.com/gallery/18brisf
KiwiEV,None,None,1699087221,None,None,17nhcee,None,None,None,None,t3_17nhcee,30,None,/r/nzev/comments/17nhcee/something_different_for_your_weekend_i_finally/,None,40,None,None,None,nzev,Something different for your weekend: I finally got a Nissan Leaf electric motor installed into my 1977 Austin Allegro. It required a bit of fabricating & welding but it fits in great.,1,https://www.youtube.com/watch?v=vi7-rrIGUa8
s_nz,None,None,1695260159,None,None,16o2v3h,None,None,None,None,t3_16o2v3h,47,None,/r/nzev/comments/16o2v3h/subaru_confirms_kiwi_pricing_for_firstever/,None,40,"Second rebate eligible AWD pure ev on the NZ market.

Arrives December. Rebate eligible for base trim.",None,None,nzev,Subaru confirms Kiwi pricing for first-ever electric vehicle,0.92,https://i.stuff.co.nz/motoring/132982147/subaru-confirms-kiwi-pricing-for-firstever-electric-vehicle
OutInTheBay,None,None,1679629127,None,None,1207wnh,None,None,None,None,t3_1207wnh,23,None,/r/nzev/comments/1207wnh/another_japanese_brand_commits_to_self_destruct/,None,42,None,None,None,nzev,Another Japanese brand commits to self destruct....,0.92,https://i.redd.it/hkroignqfnpa1.jpg
RobDickinson,None,None,1672532706,None,None,1007lhb,None,None,None,None,t3_1007lhb,32,None,/r/nzev/comments/1007lhb/nzs_2022_in_ev_sales_new_used/,None,40,None,None,None,nzev,NZ's 2022 in EV sales (new + used),0.94,https://www.reddit.com/gallery/1007lhb
WorldlyNotice,None,None,1709925980,None,None,1b9ws8v,None,None,None,None,t3_1b9ws8v,33,None,/r/nzev/comments/1b9ws8v/chargenet_installs_first_300kw_hyperchargers_in/,None,38,Good to see more hyperchargers rolling out. These are in Christchurch.,None,None,nzev,ChargeNet installs first 300kW hyperchargers in South Island,0.96,https://www.drivencarguide.co.nz/news/chargenet-installs-first-300kw-hyperchargers-in-south-island/
CartographerStrict59,None,None,1702424181,None,None,18h0vni,None,TRUE,None,None,t3_18h0vni,133,None,/r/nzev/comments/18h0vni/is_it_true_that_an_ev_under_15000_is_an_end_of/,None,40,"I just wrote to a dealer asking if they have any EVs under 15,000$ available and they said I would only find a bad car that would give me no end of trouble.

We have two cars (one hybrid, one petrol) and I wanted to get rid of the petrol one and buy a cheap EV for running around locally.",None,None,nzev,"Is it true that an EV under $15,000 is an end of life vehicle that will give no end of trouble?",0.81,https://www.reddit.com/r/nzev/comments/18h0vni/is_it_true_that_an_ev_under_15000_is_an_end_of/
xmmdrive,None,None,1697332576,None,None,178447q,None,TRUE,None,None,t3_178447q,135,None,/r/nzev/comments/178447q/whos_taking_bets_whether_national_will_follow/,None,36,"It would certainly un-muddy the waters around plugin-hybrids.  

If they do bring it in, how do you think it would work?  Would you buy kms in advance (like it is with diesel cars now), or be charged retrospectively after having your odo read at WOF time?",None,None,nzev,Who's taking bets whether National will follow through on their promise to extend RUCs to all road users including petrol cars?,0.85,https://www.reddit.com/r/nzev/comments/178447q/whos_taking_bets_whether_national_will_follow/
choochoo_choose_me,None,None,1697608643,None,None,17ajirh,None,None,None,None,t3_17ajirh,51,None,/r/nzev/comments/17ajirh/i_am_now_dualwielding_evs_hopefully_i_will_never/,None,37,None,None,None,nzev,I am now dual-wielding EVs. Hopefully I will never need to purchase another drop of dinosaur juice.,0.69,https://i.redd.it/6l5d97jkhwub1.jpg
KiwiEV,None,None,1695960074,None,None,16v1dya,None,None,None,None,t3_16v1dya,16,None,/r/nzev/comments/16v1dya/got_to_play_with_the_entrylevel_mg4_excite_51/,None,38,None,None,None,nzev,"Got to play with the entry-level MG4 Excite 51 this week. To save you a click, $40k NZD (after rebate), range: 350 km (realistic ~300), PSC: 48. It's not as gadget-rich as the Essence 64 model but it's still a very decent machine. If you have one on order, I reckon you'll be chuffed.",1,https://youtu.be/lEcR5EUKIQI
westy456,None,None,1689895375,None,None,1556r5h,None,TRUE,None,None,t3_1556r5h,47,None,/r/nzev/comments/1556r5h/recent_switch_to_ev_my_numbers/,None,37,"Just thought I’d run through my experience of my recent swap to an EV.  

I went from a 2018 $21k ICE Golf to a 2018 $19.5k Leaf 40G leaf. 77km on golf, 49km / 89% on leaf. 

Driving / practicality  
The ICE car handled better and has a nicer cabin but the instant torque of the leaf and effortless driving around town means that for 90% of our driving, I prefer the Leaf. Features wise, they were line ball – the Golf had a better screen and digital dash and more premium feel, the Leaf has 360 camera but a shit screen. Both have adaptive cruise, blind spot monitor, small army of airbags etc. Leaf has a much bigger boot which is a huge plus. Range and battery degradation the biggest downside for the Leaf but given its our second car, that doesn’t matter for us.   


Economics 

Golf running costs: 7% cost of capital (interest on mortgage as proxy) on $21k = $1.5k; Depreciation = $3k; Insurance $1k; petrol for 13,000 km $3k and service / rego $700. Total annual cost = $9.1k  

Leaf: Cost of capital: 0 as I got a 5 year interest free loan. Depreciation $3k, Insurance $1.2k, service and rego $300 (generous – I doubt it needs annual servicing). Electricity for 13,000 km $400 but I have 3 hours free each night which makes this pretty much free. Total annual cost: $4.5k.  

For the loan, it’s with Westpac. I had given them robust feedback that every bank apart from them offered an EV loan! Terms are 5 years, interest free, up to $50k, invoice from dealer required. 

So, by making the swap we save nearly $5k per annum.  For me an absolute no brainer. RUCS will trim potentially up to $1k of that.",None,None,nzev,Recent switch to EV. My numbers,0.92,https://www.reddit.com/r/nzev/comments/1556r5h/recent_switch_to_ev_my_numbers/
KiwiEV,None,None,1684473496,None,None,13lluu9,None,None,None,None,t3_13lluu9,14,None,/r/nzev/comments/13lluu9/got_to_drive_the_ora_good_cat_for_a_couple_of/,None,38,None,None,None,nzev,"Got to drive the Ora Good Cat for a couple of days and made a video about it (with many terrible cat puns). It's affordable, drives well, is spacious & well kitted out, but doesn't have seated heats or a towing rating, plus the menu is cumbersome. Good value overall, though.",0.98,https://www.youtube.com/watch?v=_pS-Ski8-y0
