author,author_flair_text,clicked,created_utc,distinguished,edited,id,is_original_content,is_self,link_flair_text,locked,name,num_comments,over_18,permalink,saved,score,selftext,spoiler,stickied,title,upvote_ratio,url
FieryAnomaly,None,None,1707055315.0,None,None,1aiojph,None,None,None,None,t3_1aiojph,178,None,/r/RealTesla/comments/1aiojph/former_tesla_director_larry_ellison_invited_elon/,None,1712,None,None,None,"Former Tesla director Larry Ellison invited Elon Musk to Hawaii to 'dry out' from drugs, report says",0.96,https://www.yahoo.com/autos/former-tesla-director-larry-ellison-050853670.html
hunterseeker1,None,None,1682330999.0,None,None,12xan43,None,None,RUMOR,None,t3_12xan43,254,None,/r/RealTesla/comments/12xan43/elon_musks_dad_says_his_sons_whole_career_was/,None,1701,"Errol went as far as to say that emerald money paid for his son's move to the US, where Elon would go on to attend the University of Pennsylvania's Wharton Business School on scholarship — with, apparently, emerald-generated cash in his pocket for living expenses. In other words, according to the senior Musk, it sounds a lot like Elon's entire road to wealth and fame beyond South Africa was paved with Zambian emeralds.",None,None,Elon Musk's Dad Says His Son's Whole Career Was Funded by That Emerald Mine,0.94,https://futurism.com/elon-musk-dad-emerald-mine
FieryAnomaly,None,None,1704976870.0,None,None,1940t37,None,None,None,None,t3_1940t37,348,None,/r/RealTesla/comments/1940t37/spacex_releases_cringeworthy_elon_musk_staff/,None,1694,None,None,None,SpaceX releases ‘cringeworthy’ Elon Musk staff meeting video at the center of Wall Street Journal drug allegations,0.95,https://finance.yahoo.com/news/spacex-releases-cringeworthy-elon-musk-153856708.html
HotIce05,None,None,1686143287.0,None,None,143cuir,None,None,None,None,t3_143cuir,174,None,/r/RealTesla/comments/143cuir/teslas_cybertruck_supply_chain_lead_quits_to_work/,None,1695,None,None,None,Tesla's Cybertruck Supply Chain Lead Quits to Work at Rival Rivian,0.95,https://gizmodo.com/tesla-cybertruck-mustapha-el-akkari-quits-for-rivian-1850509444
GonzoVeritas,None,None,1702210454.0,None,None,18f2c6i,None,None,TESLAGENTIAL,None,t3_18f2c6i,224,None,/r/RealTesla/comments/18f2c6i/elon_musk_is_cracking_under_the_pressure_of_the/,None,1641,None,None,None,Elon Musk is cracking under the pressure of the biggest gamble he's ever taken in his life.,0.94,https://www.businessinsider.com/elon-musk-problems-twitter-x-tesla-gamble-luck-run-out-2023-12
2thenoon,None,None,1691345035.0,None,None,15jw4zh,None,None,None,None,t3_15jw4zh,57,None,/r/RealTesla/comments/15jw4zh/let_elon_know_about_this/,None,1639,None,None,None,Let Elon know about this!,0.99,https://i.redd.it/33mnroy35jgb1.jpg
HanzJWermhat,None,None,1619527614.0,None,None,mzno3b,None,None,None,None,t3_mzno3b,218,None,/r/RealTesla/comments/mzno3b/the_day_of_reckoning_for_autopilot_is_coming/,None,1613,None,None,None,The day of reckoning for Autopilot is coming.,0.98,https://i.redd.it/lzyvt9vfppv61.jpg
HotIce05,None,None,1695059495.0,None,None,16m2994,None,None,None,None,t3_16m2994,137,None,/r/RealTesla/comments/16m2994/elon_musk_once_reportedly_hung_up_on_a_tesla/,None,1604,None,None,None,Elon Musk once reportedly hung up on a Tesla worker inside a burning factory and said 'don't bother me',0.94,https://www.autoblog.com/2023/09/18/elon-musk-once-reportedly-hung-up-on-a-tesla-worker-inside-a-burning-factory-and-said-don-t-bother-me/?ncid=edlinkusauto00000016&fbclid=IwAR3ixq5QnttCknlExJZSGyHnIClgfPs8BmqEfwgNeyaxu1VzF4tpxTQHm8Y
PenthouseREIT,None,None,1706315399.0,None,None,1abxn5g,None,None,None,None,t3_1abxn5g,382,None,/r/RealTesla/comments/1abxn5g/tesla_investors_see_theres_no_floor_after_losing/,None,1586,None,None,None,Tesla Investors See 'There’s No Floor' After Losing $200 Billion,0.96,https://finance.yahoo.com/news/tesla-investors-see-no-floor-174750457.html?guccounter=1&guce_referrer=aHR0cHM6Ly9uZXdzLmdvb2dsZS5jb20v&guce_referrer_sig=AQAAAJzkRnNrvwfFs4d5OIFoqZ4t2qdRfIZtQbDJlwbchpZiWuxyoEEI3on9f477_CDtxmaaHKqBUgKBeLGi6OvAwyElu2_NmPmMNXq4GLXk2O8A-QdrDR8-oNATMaFaglAozlrVIh5saFAvNc_WwHPNcHphigyzPT4r_nuumMgtokaI
GonzoVeritas,None,None,1667667981.0,None,None,ymzubw,None,None,R8 Locked,True,t3_ymzubw,150,None,/r/RealTesla/comments/ymzubw/whats_the_opposite_of_smart/,None,1583,None,None,None,What's the opposite of smart?,0.95,https://i.imgur.com/xOfKfC3.jpg
praguer56,None,None,1690383764.0,None,None,15a88em,None,None,None,None,t3_15a88em,176,None,/r/RealTesla/comments/15a88em/teslas_15k_full_selfdriving_option_is_only_worth/,None,1579,None,None,None,"Tesla’s $15K Full Self-Driving Option Is Only Worth $3,900 on a Trade-In",0.96,https://www.thedrive.com/news/teslas-15k-full-self-driving-option-is-only-worth-3900-on-a-trade-in
thejman78,None,None,1710447603.0,None,None,1beuxw4,None,None,None,None,t3_1beuxw4,261,None,/r/RealTesla/comments/1beuxw4/tesla_ceo_elon_musk_is_hurting_demand_every_day/,None,1562,None,None,None,Tesla CEO Elon Musk is hurting demand every day: Investor,0.94,https://finance.yahoo.com/video/tesla-ceo-elon-musk-hurting-165507347.html
TheBlackUnicorn,None,None,1685430017.0,None,None,13vj1dc,None,True,OWNER EXPERIENCE,None,t3_13vj1dc,335,None,/r/RealTesla/comments/13vj1dc/i_want_to_personally_thank_elon_musk/,None,1549,"My Model S was in service last week to get the AC filters changed out, remarkably a $460 job, and while it was there they removed my Autopilot radar because, I guess, Elon believes that humans don't need radar so cars shouldn't either (a lot of people said they were doing this because of supply chain issues, but I kind of don't buy that since new Teslas are now coming with radar, I wonder if my car's radar module will go into a ""new"" Tesla).

Thanks to Elon I finally pulled the trigger and bought a used Toyota Tacoma, a truck that, get this, HAS FUCKING RADAR in its adaptive cruise control. Meaning it is in fact BETTER than a Tesla.

Thanks Elon, you finally pushed me off your wild ride. I'll be selling my S and never looking back!",None,None,I want to personally thank Elon Musk,0.9,https://www.reddit.com/r/RealTesla/comments/13vj1dc/i_want_to_personally_thank_elon_musk/
Zorkmid123,None,None,1689933017.0,None,None,155jccy,None,None,None,None,t3_155jccy,194,None,/r/RealTesla/comments/155jccy/elon_musk_reportedly_used_millions_of_dollars_in/,None,1535,None,None,None,Elon Musk Reportedly Used Millions of Dollars in Tesla Funds To Secretly Build Himself A Literal Glass House — After Famously Saying He 'Will Own No House',0.94,https://finance.yahoo.com/news/elon-musk-reportedly-used-millions-210409442.html
justin_quinnn,None,None,1704644661.0,None,None,190vszk,None,None,None,None,t3_190vszk,394,None,/r/RealTesla/comments/190vszk/elon_musk_claims_not_even_trace_amounts_of_drugs/,None,1498,None,None,None,"Elon Musk Claims “Not Even Trace Amounts” Of Drugs In His System After Report Detailed Drug Concerns From Tesla, SpaceX Execs",0.94,https://www.forbes.com/sites/zacharyfolk/2024/01/07/elon-musk-claims-not-even-trace-amounts-of-drugs-in-his-system-after-report-detailed-drug-concerns-from-tesla-spacex-execs/
sue_me_please,None,None,1696306025.0,None,None,16yi38f,None,None,TESLAGENTIAL,None,t3_16yi38f,163,None,/r/RealTesla/comments/16yi38f/elon_musk_associates_say_his_strange_behavior_may/,None,1505,None,None,None,Elon Musk Associates Say His Strange Behavior May Be Related to Ketamine Habit,0.96,https://futurism.com/neoscope/elon-musk-ketamine
bob3219,None,None,1671024163.0,None,None,zlqtkm,None,None,TWITTER,None,t3_zlqtkm,327,None,/r/RealTesla/comments/zlqtkm/twitter_has_suspended_elonjet/,None,1468,None,None,None,Twitter has suspended @ElonJet,0.94,https://i.redd.it/kvd2qz2y6v5a1.png
AgileHippo78,None,None,1693708593.0,None,None,168l9o0,None,True,None,None,t3_168l9o0,475,None,/r/RealTesla/comments/168l9o0/elon_took_my_cheeks_so_deep/,None,1468,"…without lube. Shoved all 3.7 inches in at once. 

I bought a Model S in June. Not just any Model S, the one with the FSD computer and Lifetime Transferrable Supercharging. Or so I thought. I have an email from the Tesla dealership that the original owner purchased it at saying it does have the free transferrable lifetime charging. But it doesn’t. And they don’t care. I flew 3000 miles to buy that car after 3 months of looking for one. 

And now he dropped $30k off the new Model S. My anus is bleeding. I’m livid.",None,None,Elon took my cheeks so deep…,0.9,https://www.reddit.com/r/RealTesla/comments/168l9o0/elon_took_my_cheeks_so_deep/
HotIce05,None,None,1689433641.0,None,None,150ednz,None,None,None,None,t3_150ednz,373,None,/r/RealTesla/comments/150ednz/within_spec/,None,1463,"This is from one of the that was caught driving around. Everything looks just dandy, doesn’t it?",None,None,Within Spec,0.91,https://i.redd.it/909dazfl95cb1.jpg
Devilinside104,None,None,1697736917.0,None,None,17bopkn,None,None,None,None,t3_17bopkn,208,None,/r/RealTesla/comments/17bopkn/tesla_tsla_tumbles_after_disastrous_elon_musk/,None,1428,None,None,None,Tesla (TSLA) tumbles after disastrous Elon Musk conference call,0.97,https://electrek.co/2023/10/19/tesla-tsla-tumbles-disastrous-elon-musk-conference-call/
dingmah,None,None,1643403399.0,None,None,sf0ia1,None,None,None,None,t3_sf0ia1,590,None,/r/RealTesla/comments/sf0ia1/cybertruck_is_not_a_full_size_truck_joe_rogan/,None,1409,None,None,None,"Cybertruck is not a full size truck. Joe Rogan stands about 5'7"" tall and is as tall as the roof peak.",0.94,https://i.redd.it/swoej5djshe81.jpg
Zorkmid123,None,None,1691335049.0,None,None,15js4ao,None,None,TWITTER,None,t3_15js4ao,146,None,/r/RealTesla/comments/15js4ao/elon_musks_fund_your_legal_bill_tweet_is_a_brand/,None,1406,None,None,None,Elon Musk’s ‘fund your legal bill’ tweet is a brand new level of bullshit,0.94,https://www.theverge.com/22345505/elon-musk-twitter-x-employer-legal-bill-bs
TiltedWit,None,None,1699650188.0,None,None,17sdqni,None,None,None,None,t3_17sdqni,249,None,/r/RealTesla/comments/17sdqni/if_you_bought_a_tesla_one_year_ago_it_has_lost_as/,None,1397,None,None,None,"If You Bought A Tesla One Year Ago It Has Lost As Much As $40,000 In Value",0.94,https://jalopnik.com/if-you-bought-a-tesla-one-year-ago-it-has-lost-as-much-1851011677
kmraceratx,None,None,1701733344.0,None,None,18axxy3,None,None,None,None,t3_18axxy3,200,None,/r/RealTesla/comments/18axxy3/elon_is_a_lying_sack_of_shit/,None,1390,https://insideevs.com/news/699260/tesla-cybertruck-porsche-race/,None,None,Elon is a lying sack of shit.,0.96,https://i.redd.it/p07f5dkx6d4c1.jpeg
Bnrmn88,None,None,1670618328.0,None,None,zh81xp,None,None,OWNER EXPERIENCE,None,t3_zh81xp,547,None,/r/RealTesla/comments/zh81xp/a_pitbull_ate_my_tesla/,None,1391,None,None,None,A pitbull ate my Tesla,0.94,https://v.redd.it/mqo5ee306z4a1
Zorkmid123,None,None,1704291271.0,None,None,18xkczq,None,None,None,None,t3_18xkczq,452,None,/r/RealTesla/comments/18xkczq/elon_musk_repeatedly_vetoing_a_25000_tesla_comes/,None,1378,None,None,None,"Elon Musk Repeatedly Vetoing a $25,000 Tesla Comes Back to Bite",0.93,https://www.bloomberg.com/news/newsletters/2024-01-03/elon-musk-repeatedly-vetoing-a-25-000-tesla-comes-back-to-bite
KillarneyRoad,None,None,1703690746.0,None,None,18s363n,None,None,None,None,t3_18s363n,85,None,/r/RealTesla/comments/18s363n/looks_like_my_neighbor_got_one_of_the_new_ones/,None,1377,It actually looks better built than I expected,None,None,Looks like my neighbor got one of the new ones,0.96,https://i.redd.it/dk5wakmavu8c1.jpeg
Pimpin-is-easy,None,None,1668719719.0,None,None,yy1tyc,None,None,TESLAGENTIAL,None,t3_yy1tyc,236,None,/r/RealTesla/comments/yy1tyc/someone_has_to_say_it_elon_musk_has_lied_for_27/,None,1383,None,None,None,"Someone has to say it: Elon Musk has lied for 27 years about his credentials. He does not have a BS in Physics, or any technical field. Did not get into a PhD program. Dropped out in 1995 & was illegal. Later, investors quietly arranged a diploma - but not in science.",0.94,https://twitter.com/capitolhunters/status/1593307541932474368
chrisdh79,None,None,1709048354.0,None,None,1b1etp1,None,None,None,None,t3_1b1etp1,167,None,/r/RealTesla/comments/1b1etp1/tesla_has_been_polluting_water_in_germany_for_a/,None,1361,None,None,None,"Tesla has been polluting water in Germany for a long time, which is why its plant may be closed.",0.96,https://gadgettendency.com/tesla-has-been-polluting-water-in-germany-for-a-long-time-which-is-why-its-plant-may-be-closed/
bloomberg,None,None,1698762878.0,None,None,17kmh0b,None,None,None,None,t3_17kmh0b,200,None,/r/RealTesla/comments/17kmh0b/tesla_erases_145_billion_in_valuation_in_less/,None,1365,None,None,None,Tesla Erases $145 Billion in Valuation in Less Than Two Weeks,0.97,https://www.bloomberg.com/news/articles/2023-10-31/tesla-tsla-erases-145-billion-in-valuation-as-demand-woes-intensify
justin_quinnn,None,None,1704478724.0,None,None,18zdk47,None,None,None,None,t3_18zdk47,313,None,/r/RealTesla/comments/18zdk47/the_cybertruck_achieved_less_than_80_of_teslas/,None,1360,None,None,None,The Cybertruck achieved less than 80% of Tesla's advertised range in a YouTuber's highway test during Texas winter,0.95,https://www.businessinsider.com/tesla-cybertruck-range-test-real-world-youtube-less-than-advertised-2024-1?r=MX&IR=T
tank_panzer,None,None,1638687332.0,None,None,r99wfh,None,None,SHITPOST,None,t3_r99wfh,103,None,/r/RealTesla/comments/r99wfh/my_car_is_currently_orbiting_mars_well_no_its/,None,1351,None,None,None,"My car is currently orbiting Mars | Well, no. It's orbiting the Sun, and occasionally passes the orbit of Mars. Not the same thing.",0.98,https://i.redd.it/z15s0so69o381.jpg
ShaMana999,None,None,1701522843.0,None,None,1893hb2,None,None,SHITPOST,None,t3_1893hb2,664,None,/r/RealTesla/comments/1893hb2/this_is_proper_scary/,None,1350,None,None,None,This is proper scary,0.94,https://i.redd.it/rscks200tv3c1.png
I-Pacer,None,None,1690012827.0,None,None,156dwym,None,None,None,None,t3_156dwym,267,None,/r/RealTesla/comments/156dwym/build_quality_as_good_as_ever_i_see/,None,1347,Look at that shut line on the rear door! You could drive a bus through the bottom part.,None,None,Build Quality As Good As Ever I See,0.93,https://i.redd.it/ghfien9t3hdb1.jpg
buffalonpcola43,None,None,1692606759.0,None,None,15x1kjq,None,None,None,None,t3_15x1kjq,294,None,/r/RealTesla/comments/15x1kjq/two_months_in_and_two_major_front/,None,1339,"I have had my Model Y for two months now after I bought it brand new. Within the first 2,000 miles it has had two major issues. The first issue occurred when the front electric steering failed and I couldn’t move the front wheels without extreme effort. I brought it in and the Tesla service center replaced the  steering rack. After this repair it felt back to normal until last night when I went to drive my car and the ability to steer is completely gone. I tried to drive it a short distance but when one wheel is faced straight the other is turned out 45 degrees making it basically in-drivable. I then tried to reverse to park the car again and now both wheels are turned out 45 degrees as seen in picture. I’m not sure if this issue is related to the previous repair but they seem like they could be related. It is beyond frustrating because the whole reason I got a new Y is because my 2015 model S battery needed replacement. I figured hey that was an older car so I bet a new one won’t give me issues, but I was sadly mistaken. I hear mostly good things from other owners so not sure why it seems like all my cars have been pieces of crap.",None,None,Two months in and two major front steering/alignment problems,0.94,https://i.redd.it/0eho7dowcfjb1.jpg
Gobias_Industries,COTW,None,1708000492.0,None,None,1arefya,None,None,None,None,t3_1arefya,345,None,/r/RealTesla/comments/1arefya/cybertruck_owners_say_their_stainless_steel/,None,1306,None,None,None,Cybertruck Owners Say Their Stainless Steel Trucks Are Rusting,0.96,https://gizmodo.com/cybertruck-owners-say-their-stainless-steel-trucks-are-1851257880
Superpe0n,None,None,1611945356.0,None,None,l808vi,None,None,None,None,t3_l808vi,41,None,/r/RealTesla/comments/l808vi/ha_ha_apply_cold_water_to_affected_area/,None,1304,None,None,None,ha ha Apply cold water to affected area,0.98,https://i.redd.it/qq8q6tcjh6e61.jpg
chrisdh79,None,None,1702655752.0,None,None,18j395u,None,None,TWITTER,None,t3_18j395u,199,None,/r/RealTesla/comments/18j395u/elon_musk_told_bankers_they_wouldnt_lose_any/,None,1285,None,None,None,Elon Musk told bankers they wouldn’t lose any money on Twitter purchase | Lenders unlikely to get even 60 cents on the dollar for the bonds and loans.,0.96,https://arstechnica.com/tech-policy/2023/12/elon-musk-told-bankers-they-wouldnt-lose-any-money-on-twitter-purchase/
coastaltrav,None,None,1689795198.0,None,None,1544jue,None,None,OWNER EXPERIENCE,None,t3_1544jue,273,None,/r/RealTesla/comments/1544jue/the_quality_is_impeccable/,None,1285,None,None,None,The quality is impeccable…! 🤣,0.95,https://i.redd.it/h0en3jctmycb1.jpg
MONARCHTRADER,None,None,1690457431.0,None,None,15azerl,None,True,None,None,t3_15azerl,224,None,/r/RealTesla/comments/15azerl/tesla_created_secret_team_to_suppress_thousands/,None,1258,"Tesla years ago began exaggerating its vehicles’ potential driving distance – by rigging their range-estimating software. The company decided about a decade ago, for marketing purposes, to write algorithms for its range meter that would show drivers “rosy” projections for the distance it could travel on a full battery, according to a person familiar with an early design of the software for its in-dash readouts.

https://www.reuters.com/investigates/special-report/tesla-batteries-range/",None,None,"Tesla created secret team to suppress thousands of driving range complaints - When the battery fell below 50% of its maximum charge, the algorithm would show drivers more realistic projections for their remaining driving range.",0.95,https://www.reddit.com/r/RealTesla/comments/15azerl/tesla_created_secret_team_to_suppress_thousands/
Finnegan_Faux,None,None,1707352738.0,None,None,1alin8m,None,None,SHITPOST,None,t3_1alin8m,71,None,/r/RealTesla/comments/1alin8m/apple_vision_pro_is_changing_the_way_americans/,None,1254,None,None,None,Apple Vision Pro Is Changing the Way Americans Die in a Tesla,0.95,https://hard-drive.net/hd/technology/apple-vision-pro-is-changing-the-way-americans-die-in-a-tesla/
[deleted],None,None,1641471371.0,None,None,rxd8j6,None,None,CROSSPOST,None,t3_rxd8j6,366,None,/r/RealTesla/comments/rxd8j6/lol_elon_musks_boring_company_has_traffic_jams_i/,None,1243,None,None,None,Lol. Elon Musk's Boring company has traffic jams. I was told it was impossible.,0.96,https://v.redd.it/avprno6052a81
mikeology85,None,None,1703371368.0,None,None,18ph0sr,None,None,None,None,t3_18ph0sr,698,None,/r/RealTesla/comments/18ph0sr/just_saw_this_guy_in_my_apartment_garage_right_now/,None,1231,None,None,None,Just saw this guy in my apartment garage right now 😬,0.88,https://www.reddit.com/gallery/18ph0sr
ice__nine,None,None,1649381335.0,None,None,tys47k,None,None,None,None,t3_tys47k,164,None,/r/RealTesla/comments/tys47k/cybertruck_panel_gaps_within_spec/,None,1231,None,None,None,CyberTruck panel gaps - within spec,0.96,https://i.redd.it/o48sr2pyj7s81.png
Finnegan_Faux,None,None,1709607706.0,None,None,1b6ulzu,None,None,None,None,t3_1b6ulzu,217,None,/r/RealTesla/comments/1b6ulzu/jeff_bezos_replaces_elon_musk_as_worlds_richest/,None,1228,None,None,None,Jeff Bezos Replaces Elon Musk as World’s Richest Man,0.95,https://www.thedailybeast.com/jeff-bezos-replaces-elon-musk-as-worlds-richest-man?ref=home
ExoGeniVI,None,None,1700713544.0,None,None,181stj7,None,None,SHITPOST,None,t3_181stj7,145,None,/r/RealTesla/comments/181stj7/just_leaving_this_here/,None,1230,None,None,None,Just leaving this here...,0.95,https://i.redd.it/ejvo68ejy02c1.jpg
Swifty_e,None,None,1706972730.0,None,None,1ahy3gp,None,None,CROSSPOST,None,t3_1ahy3gp,382,None,/r/RealTesla/comments/1ahy3gp/cybertruck_broke_at_king_of_hammers/,None,1217,None,None,None,Cybertruck broke at King of Hammers,0.96,https://i.redd.it/i1du1pstfdgc1.jpeg
