author,author_flair_text,clicked,created_utc,distinguished,edited,id,is_original_content,is_self,link_flair_text,locked,name,num_comments,over_18,permalink,saved,score,selftext,spoiler,stickied,title,upvote_ratio,url
bmita,None,None,1693598092.0,None,None,167h9d8,None,None,None,None,t3_167h9d8,3071,None,/r/RealTesla/comments/167h9d8/cybertruck_prototype_vs_production/,None,16290,None,None,None,Cybertruck prototype vs production,0.93,https://i.redd.it/qcb62ply7plb1.png
vinaylovestotravel,None,None,1710162655.0,None,None,1bc2tnr,None,None,TESLAGENTIAL,None,t3_1bc2tnr,2434,None,/r/RealTesla/comments/1bc2tnr/us_billionaire_drowns_in_tesla_after_rescuers/,None,14861,None,None,None,US Billionaire Drowns in Tesla After Rescuers Struggle With Car's Strengthened Glass,0.94,https://www.ibtimes.co.uk/us-billionaire-drowns-tesla-after-rescuers-struggle-cars-strengthened-glass-1723876
HotIce05,None,None,1685400833.0,None,None,13v971j,None,None,None,None,t3_13v971j,1562,None,/r/RealTesla/comments/13v971j/tesla_is_now_the_second_most_unpopular_car_brand/,None,10956,https://theharrispoll.com/partners/media/axios-harrispoll-100/,None,None,Tesla is now the second most unpopular car brand in the US.,0.88,https://i.redd.it/jrwxa7mz5w2b1.jpg
Esc00,None,None,1694275945.0,None,None,16e9lxs,None,None,None,None,t3_16e9lxs,929,None,/r/RealTesla/comments/16e9lxs/rcybertruck_got_very_upset_with_me/,None,7074,None,None,None,r/cybertruck Got very upset with me,0.84,https://i.redd.it/5c4kqltz79nb1.png
One-Bit5717,None,None,1694201656.0,None,None,16djuzf,None,None,SHITPOST,None,t3_16djuzf,630,None,/r/RealTesla/comments/16djuzf/my_reserved_cybertruck_now_free_for_the_taking/,None,5723,None,None,None,My reserved cybertruck now free for the taking,0.87,https://i.redd.it/0fwebxqc33nb1.jpg
gman1023,None,None,1690572929.0,None,None,15c6xk9,None,None,HELP NEEDED,None,t3_15c6xk9,693,None,/r/RealTesla/comments/15c6xk9/disapproval_of_elon_musk_is_top_reason_tesla/,None,5039,None,None,None,"Disapproval of Elon Musk is top reason Tesla owners are selling, survey says",0.95,https://electrek.co/2023/07/27/disapproval-elon-musk-top-reason-tesla-owners-selling-survey/
Zorkmid123,None,None,1709912278.0,None,None,1b9qyn3,None,None,None,None,t3_1b9qyn3,693,None,/r/RealTesla/comments/1b9qyn3/tesla_starts_shipping_3000_cybertruck_tent_looks/,None,4562,None,None,None,"Tesla starts shipping $3,000 Cybertruck tent, looks nothing like what was unveiled",0.96,https://electrek.co/2024/03/08/tesla-shipping-cybertruck-tent/
hmelon212,None,None,1692329345.0,None,1692421817.0,15u8wuv,None,True,OWNER EXPERIENCE,None,t3_15u8wuv,731,None,/r/RealTesla/comments/15u8wuv/tesla_repossessed_my_car_due_to_an_extreme/,None,4083,"I have posted this to four other Tesla related subreddits only to have them removed so hopefully this one sticks..

I have had a horrible experience with Tesla and their team in the past couple of days. My family purchased our new car a couple months ago and was enjoying it up until a few days ago when I tried to get the car into gear and it demanded that I input the password. Having not set up a password previously, I contacted Tesla about the issue. 

While I was waiting to speak with a representative, I noticed that my car was no longer linked to my account on the app, nor could I log into my Tesla account. After waiting on hold for two hours, I was finally able to get through to a representative who informed me that I needed to contact Tesla Financial about this issue. I called the number provided immediately but they did not pick up as they were outside of working hours.

“Not a problem.” I thought. I’d call back again tomorrow and sort this out. I left my car in the parking lot at work overnight and had a family member pick me up and drop me off the next morning. While I’m working the next day, my boss informs me that there is a tow truck outside to tow my car. Confused, I went out to the parking lot and was told by the towing company that Tesla is repossessing my vehicle. 

This is where my confusion grew. We had paid for the vehicle IN FULL at the time we picked it up from the dealership, but the towing company is just doing what tesla told them to do. so they took my car.

Shortly afterward, my father received a phone call from Tesla Financial and he asked them what was going on. They told him that Tesla had been trying to reach out to us multiple times through phone and email about a debt they have been attempting to collect on the car. 

My father had been out of the country for the past couple months so any phone calls would not have reached him. He did not receive a single voicemail about this issue either. He looked through his emails and noticed that he did in fact receive only two emails on July 27 and July 28, stating that we had not yet paid for the car and that the full cost of the vehicle is still at large. These emails went ignored as he believed them to be a phishing attempt because we had already PAID IN FULL at the dealership. He also believed that Tesla could not have made such a huge mistake like this.

My father explained this over the phone but the representative did not budge. This Tesla representative was rude and unprofessional for the entire phone call—going so far as to yell at my father over the phone.

A different Tesla representative sent us an email that seemed to be a copy paste of what they had sent my father back in July and that this car is now being considered for repossession. I shot an email back explaining AGAIN that this car had been paid for in full already and that we have been very dissatisfied by how Tesla had been handling this situation.

Up until this point, we were under the impression that Tesla was repossessing our vehicle without any warning because the two emails they sent to us regarding this seemed to be a phishing scam. Again they left no voicemails about this either. 

The Tesla representative then emailed back this statement:

“I am having the team fully post the funds of the cashier's check. I am redrafting the documents and title/lien to your name instead of [BANK]. I have attached documents. Once funds post I can then restore access to the vehicle and release title/lien to your name.”

Basically saying that they had the check this whole time but due to some internal oversight had not cashed it. And they came after us, accused us of not paying, and repossessed our vehicle. Not only that, they incorrectly had the title of our car under the bank’s name rather than our own.

The next day, we received another email stating that the car is now back under our name and it can be picked up from the tow yard. 

No apology. No restitution. 

My father emailed them back saying he was glad the issue was resolved but was disappointed that there was no restitution offered, not even an apology. 

They then emailed back the equivalent of saying “well we did try to contact you about this.” 

I shot back an email stating that we are frustrated because it seems like this was an internal accounting issue that we should not have been contacted about or been involved in, in the first place. 

Now we find ourselves carless for four days and will have to go out of our way to pick up a car that was wrongly repossessed. 

And still Tesla offers no apology, restitution, and no guarantee that they are taking steps to prevent anything like this from happening in the future.

EDIT: the car was paid for with a combination of card and CASHIER’S check. Cashiers check means the amount of money is withdrawn from the bank when it’s ISSUED not cashed. so no, we did not notice extra money sitting in our account because it had already been withdrawn.

UPDATE: we got the car back today and there is no damage to it. we have been talking about getting an attorney or at least taking this to small claims court but in the end the decision comes down to what my dad wants to do as he owns the car. 

will probably not be updating again because i’m tired of thinking about this but we’ll see. i’m really upset with tesla and would return the car if i could.",None,None,Tesla repossessed my car due to an extreme oversight on their end,0.97,https://www.reddit.com/r/RealTesla/comments/15u8wuv/tesla_repossessed_my_car_due_to_an_extreme/
reddit_359,None,None,1708199988.0,None,None,1atasez,None,None,None,None,t3_1atasez,383,None,/r/RealTesla/comments/1atasez/we_know_stainless/,None,3998,None,None,None,We know stainless.,0.96,https://www.reddit.com/gallery/1atasez
2001ThrowawayM,None,None,1690877314.0,None,None,15f61tq,None,None,TWITTER,None,t3_15f61tq,648,None,/r/RealTesla/comments/15f61tq/tesla_owners_thinking_they_invented_car_meets/,None,3957,None,None,None,Tesla owners thinking they invented car meets...,0.92,https://i.redd.it/8vhr9podigfb1.jpg
chrisdh79,None,None,1697996897.0,None,None,17dywuz,None,None,None,None,t3_17dywuz,299,None,/r/RealTesla/comments/17dywuz/elon_musk_acted_like_a_little_baby_and_was_almost/,None,3485,None,None,None,"Elon Musk acted like a 'little baby' and was 'almost in tears' on Tesla's 'terrible' earnings call, analyst says",0.95,https://www.businessinsider.com/elon-musk-acted-little-baby-tesla-terrible-call-kevin-paffrath-2023-10
horrificmedium,None,None,1686392611.0,None,None,145wnxk,None,None,None,None,t3_145wnxk,443,None,/r/RealTesla/comments/145wnxk/sorry_what_was_that_about_hepa_filters_elon/,None,3173,None,None,None,"Sorry - what was that about HEPA filters, Elon?",0.94,https://i.redd.it/xepk3jx1365b1.jpg
dont_get_musked,None,None,1706792439.0,None,None,1agag4l,None,None,None,None,t3_1agag4l,183,None,/r/RealTesla/comments/1agag4l/hundreds_of_business_execs_just_ranked_elon_musk/,None,3044,None,None,None,Hundreds of business execs just ranked Elon Musk America's most overrated CEO,0.96,https://www.businessinsider.com/business-executives-ranked-elon-musk-america-most-overrated-ceo-2024-2
dingmah,None,None,1694378288.0,None,None,16fazq9,None,None,OWNER EXPERIENCE,None,t3_16fazq9,414,None,/r/RealTesla/comments/16fazq9/yoke_steering_wheel_after_8_months_of_use/,None,3015,None,None,None,Yoke steering wheel after 8 months of use,0.96,https://i.redd.it/hlhstd4kohnb1.jpg
jason12745,COTW,None,1694891354.0,None,None,16kfdds,None,None,None,None,t3_16kfdds,377,None,/r/RealTesla/comments/16kfdds/elon_musk_stormed_into_the_tesla_office_furious/,None,3015,None,None,None,Elon Musk Stormed Into the Tesla Office Furious That Autopilot Tried to Kill Him,0.95,https://futurism.com/the-byte/elon-musk-furious-autopilot-tried-kill-him
[deleted],None,None,1704595682.0,None,None,190hnyi,None,None,None,None,t3_190hnyi,581,None,/r/RealTesla/comments/190hnyi/elon_musk_has_used_illegal_drugs_worrying_leaders/,None,2982,None,None,None,"Elon Musk Has Used Illegal Drugs, Worrying Leaders at Tesla and SpaceX - Some executives and board members fear the billionaire’s use of drugs—including LSD, cocaine, ecstasy, mushrooms and ketamine—could harm his companies",0.9,https://www.wsj.com/business/elon-musk-illegal-drugs-e826a9e1
jason12745,COTW,None,1693706791.0,None,None,168ko1y,None,None,None,None,t3_168ko1y,585,None,/r/RealTesla/comments/168ko1y/tesla_owners_are_angry_about_buying_their/,None,2910,None,None,None,Tesla owners are angry about buying their vehicles right before the latest big price cuts—and are letting Elon Musk know: ‘I feel completely duped’,0.95,https://fortune.com/2023/09/02/tesla-owners-angry-at-elon-musk-after-new-price-cuts/
Danjour,None,None,1691529938.0,None,None,15luxv2,None,None,SHITPOST,True,t3_15luxv2,160,None,/r/RealTesla/comments/15luxv2/average_tesla_driver/,None,2876,None,None,None,Average Tesla driver,0.86,https://i.redd.it/r8c6qycyeygb1.jpg
fossilnews,SPACE KAREN,None,1671392123.0,None,None,zp6bmz,None,None,None,None,t3_zp6bmz,286,None,/r/RealTesla/comments/zp6bmz/elon_and_jared_kushner_at_the_world_cup_final/,None,2792,None,None,None,Elon and Jared Kushner at the World Cup Final,0.92,https://i.redd.it/uw5k6rjdlp6a1.jpg
[deleted],None,None,1596879264.0,None,None,i5wfjf,None,None,SHITPOST,None,t3_i5wfjf,36,None,/r/RealTesla/comments/i5wfjf/mods_are_asleep_upvote_the_real_tesla/,None,2757,None,None,None,"Mods are asleep, upvote the real Tesla",0.99,https://i.redd.it/6vh8cu4e0rf51.jpg
PolybiusChampion,None,None,1693582967.0,None,None,167am8c,None,None,None,None,t3_167am8c,673,None,/r/RealTesla/comments/167am8c/tesla_discounts_model_s_by_30000_and_model_x_by/,None,2715,None,None,None,"Tesla discounts Model S by $30,000, and Model X by $41,000",0.94,https://www.autoblog.com/2023/09/01/tesla-discounts-model-s-by-30000-and-model-x-by-41000/
2thenoon,None,None,1693681571.0,None,None,168auwz,None,None,None,None,t3_168auwz,399,None,/r/RealTesla/comments/168auwz/based_on_a_true_story/,None,2710,None,None,None,Based on a true story.,0.97,https://i.redd.it/z2nsf6ks4wlb1.jpg
Zorkmid123,None,None,1705492521.0,None,None,198uv5b,None,None,None,None,t3_198uv5b,300,None,/r/RealTesla/comments/198uv5b/ross_gerber_says_elon_musk_should_buy_tesla_stock/,None,2678,None,None,None,Ross Gerber Says Elon Musk Should Buy Tesla Stock 'Like Rest Of Us' If He Wants 25% Voting Rights,0.97,https://www.benzinga.com/analyst-ratings/analyst-color/24/01/36656459/ross-gerber-says-elon-musk-should-buy-tesla-stock-like-rest-of-us-if-he-wants-25-vo
sue_me_please,None,None,1694098948.0,None,None,16ci4ft,None,None,TESLAGENTIAL,None,t3_16ci4ft,342,None,/r/RealTesla/comments/16ci4ft/musk_secretly_used_starlink_to_foil_ukrainian/,None,2625,None,None,None,Musk Secretly Used Starlink to Foil Ukrainian Drone Attack on Russian Ships: Report,0.95,https://www.thedailybeast.com/musk-secretly-used-starlink-to-foil-ukrainian-drone-attack-on-russian-ships-report
Finnegan_Faux,None,None,1695601292.0,None,None,16rde7x,None,None,CROSSPOST,None,t3_16rde7x,268,None,/r/RealTesla/comments/16rde7x/aoc_says_shes_looking_to_trade_in_her_tesla_for_a/,None,2602,None,None,None,AOC says she's looking to trade in her Tesla for a union-made EV after clash with Elon Musk,0.95,https://www.reddit.com/r/EnoughMuskSpam/comments/16r80a3/aoc_says_shes_looking_to_trade_in_her_tesla_for_a/
TheMightyBattleCat,None,None,1705364546.0,None,None,197oru9,None,None,None,None,t3_197oru9,296,None,/r/RealTesla/comments/197oru9/elon_musk_complains_about_his_smaller_stake_in/,None,2555,None,None,None,Elon Musk complains about his smaller stake in Tesla after wasting it on buying Twitter,0.96,https://electrek.co/2024/01/15/elon-musk-complains-smaller-stake-tesla-after-wasting-buying-twitter/
sikeig,None,None,1641560288.0,None,None,ry6tll,None,None,OWNER EXPERIENCE,None,t3_ry6tll,531,None,/r/RealTesla/comments/ry6tll/100k_car/,None,2556,None,None,None,$100k Car.,0.93,https://v.redd.it/k15g1oozj9a81
GadnukBreakerOfWrlds,None,None,1706651495.0,None,None,1af0hot,None,None,None,None,t3_1af0hot,708,None,/r/RealTesla/comments/1af0hot/elon_musks_55_billion_tesla_pay_package_voided_by/,None,2512,None,None,None,Elon Musk’s $55 Billion Tesla Pay Package Voided by Judge,0.94,https://www.bloomberg.com/news/articles/2024-01-30/elon-musk-s-55-billion-tesla-pay-package-voided-by-judge
lovely_sombrero,None,None,1685046801.0,None,None,13rsii1,None,None,None,None,t3_13rsii1,397,None,/r/RealTesla/comments/13rsii1/whistleblower_drops_100_gigabytes_of_tesla/,None,2516,None,None,None,Whistleblower Drops 100 Gigabytes Of Tesla Secrets To German News Site: Report,0.95,https://jalopnik.com/whistleblower-drops-100-gigabytes-of-tesla-secrets-to-g-1850476542?utm_medium=sharefromsite&utm_source=jalopnik_twitter
alphex,None,None,1693682413.0,None,None,168b77b,None,None,None,None,t3_168b77b,745,None,/r/RealTesla/comments/168b77b/dirty_cyber_trucks_out_for_delivery/,None,2471,"Taken on the I-5 this weekend.    

Stainless steel is a horrible choice for car exteriors because of how easy it is to stain.   You can take a permanent magic marker to it and cause thousands of dollars of damage.   The hand prints on these are obvious at 70mph.   It’s amazing they chose this material for a car finish.   Ignoring all the other wild things about this car.",None,None,Dirty cyber trucks out for delivery.,0.91,https://www.reddit.com/gallery/168b77b
throwaway64705413,None,None,1684953840.0,None,None,13qtxdb,None,None,None,None,t3_13qtxdb,1028,None,/r/RealTesla/comments/13qtxdb/so_my_tesla_model_y_just_crashed_into_a_curb_due/,None,2448,"Literally my first time using it. It tried to take a u-turn then didn’t slow or try to take the turn properly. The ran into the curb ruining the tires and rims. Need to get towed to the tesla service center where they are charging over $3,500 to replace the wheels & rims. So this is the first and last time using FSD. Curious if anyone else has had problems with curbs or U-turns",None,None,So my tesla model y just crashed into a curb due to FSD.,0.9,https://v.redd.it/jrpbjn9t8v1b1
dont_get_musked,None,None,1699288073.0,None,None,17p6lgt,None,None,None,None,t3_17p6lgt,485,None,/r/RealTesla/comments/17p6lgt/elon_musk_shot_himself_in_the_foot_when_he_said/,None,2378,None,None,None,"Elon Musk shot himself in the foot when he said LiDAR is useless; his cars can’t reliably see anything around them. Meanwhile, everyone is turning to LiDAR and he is too stubborn to admit he was wrong.",0.96,https://twitter.com/TaylorOgan/status/1721564515500949873
orangenbaer,None,None,1695654563.0,None,None,16rup69,None,None,None,None,t3_16rup69,655,None,/r/RealTesla/comments/16rup69/they_keep_showing_it_from_the_side/,None,2314,None,None,None,They keep showing it from the side,0.91,https://i.redd.it/txjtih3l3fqb1.jpg
Doyale_royale,None,None,1685145103.0,None,None,13ssdok,None,None,SHITPOST,None,t3_13ssdok,566,None,/r/RealTesla/comments/13ssdok/can_anyone_explain_how_these_a_pillars_are_legal/,None,2246,None,None,None,Can anyone explain how these A pillars are legal?,0.92,https://i.redd.it/h9urgokk1b2b1.jpg
TomasTTEngin,None,None,1695088411.0,None,None,16me508,None,None,None,None,t3_16me508,635,None,/r/RealTesla/comments/16me508/oem_engineer_talks_about_stripping_down_a_tesla/,None,2212,None,None,None,OEM engineer talks about stripping down a Tesla,0.95,https://i.redd.it/3ct1f6o1c4pb1.png
sue_me_please,None,None,1696722165.0,None,None,172kh99,None,None,TESLAGENTIAL,None,t3_172kh99,318,None,/r/RealTesla/comments/172kh99/elon_musk_wasnt_a_superstar_genius_student_as_a/,None,2165,None,None,None,"Elon Musk Wasn't A Superstar Genius Student As A Kid — The Principal Thought He Was Intellectually Disabled, Mom Says: 'Once He Started Going To School, He Became So Lonely And Sad'",0.94,https://finance.yahoo.com/news/elon-musk-wasnt-superstar-genius-150517809.html#amp_tf=From%20%251%24s&aoh=16967129109119&csi=0&referrer=https%3A%2F%2Fwww.google.com&ampshare=https%3A%2F%2Ffinance.yahoo.com%2Fnews%2Felon-musk-wasnt-superstar-genius-150517809.html
VictimOfGoodTiming,None,None,1692086573.0,None,None,15rm6od,None,None,None,None,t3_15rm6od,209,None,/r/RealTesla/comments/15rm6od/musk_is_appearing_to_lose_his_grip_on_reality_the/,None,2122,None,None,None,Musk is appearing to lose his grip on reality. The world’s richest man — a person with a security clearance and government contracts — is threatening to hunt down a rival CEO at his house and challenge him to a duel.,0.93,https://www.platformer.news/p/elon-musks-creep-show
decker,None,None,1695658390.0,None,None,16rwcwx,None,None,RUMOR,None,t3_16rwcwx,602,None,/r/RealTesla/comments/16rwcwx/cybertruck_bed_expectations_vs_reality/,None,2088,None,None,None,Cybertruck bed expectations vs reality,0.96,https://i.redd.it/vpnoek2vefqb1.jpg
kmraceratx,None,None,1693190704.0,None,None,163a1zl,None,None,SHITPOST,None,t3_163a1zl,716,None,/r/RealTesla/comments/163a1zl/one_of_the_richest_companies_in_the_world_folks/,None,2085,"amazing this is the best they can come up with… 

this company is run by an “engineer”. fucking embarrassing.",None,None,"one of the richest companies in the world, folks…",0.86,https://www.reddit.com/gallery/163a1zl
meatbag2010,None,None,1703851279.0,None,None,18tllt0,None,None,None,None,t3_18tllt0,765,None,/r/RealTesla/comments/18tllt0/another_pic_from_that_cybertruck_crash_posted/,None,2076,None,None,None,Another pic from that Cybertruck crash posted earlier - Credit to Whole Mars Catalogue on twit.,0.92,https://i.redd.it/vcs9622i489c1.jpeg
GadnukBreakerOfWrlds,None,None,1691742363.0,None,None,15o2z6c,None,None,TESLAGENTIAL,None,t3_15o2z6c,320,None,/r/RealTesla/comments/15o2z6c/terrified_elon_musk_suggests_debate_with/,None,2035,None,None,None,"Terrified Elon Musk Suggests ""Debate"" With Zuckerberg Instead of Cage Fight",0.94,https://futurism.com/the-byte/elon-musk-debate-zuckerberg-instead-fight
GonzoVeritas,None,None,1703642246.0,None,None,18roqnp,None,None,TWITTER,None,t3_18roqnp,90,None,/r/RealTesla/comments/18roqnp/elon_musks_x_will_go_to_court_after_failing_to/,None,2011,None,None,None,Elon Musk's X will go to court after failing to pay staff millions in annual bonuses.,0.99,https://www.businessinsider.com/elon-musk-x-faces-court-failed-pay-bonuses-lawsuit-judge-2023-12
giantyetifeet,None,None,1685147055.0,None,None,13st3wj,None,None,TWITTER,True,t3_13st3wj,129,None,/r/RealTesla/comments/13st3wj/elon_musk_is_for_free_speech_so_naturally_he/,None,1930,None,None,None,"""Elon Musk is for free speech, so naturally he would team up with Ron DeSantis who bans books and words in Florida.""",0.92,https://twitter.com/dpakman/status/1661694056039079936?s=20
ice__nine,None,None,1705184057.0,None,None,195zq5s,None,None,None,None,t3_195zq5s,331,None,/r/RealTesla/comments/195zq5s/brand_new_tesla_catches_fire_in_home_garage_burns/,None,1890,None,None,None,"""brand new"" Tesla catches fire in home garage, burns other Tesla too. Tesla insurance and warranty claims denied",0.96,https://twitter.com/anna_davis_png/status/1745340057358303399
TooLittleSunToday,None,None,1694040112.0,None,None,16bylr6,None,True,SHITPOST,None,t3_16bylr6,287,None,/r/RealTesla/comments/16bylr6/according_to_elon_musks_own_math_the_company/,None,1849,"""In effect, he's saying that the $31 billion he and his partners invested in equity is totally gone, and a big portion of the debt from provided by the cream of Wall Street sits far underwater""

[https://www.msn.com/en-us/money/companies/according-to-elon-musk-s-own-math-the-company-formerly-known-as-twitter-has-lost-90-of-its-value-and-could-be-worth-just-4-billion/ar-AA1glx1c](https://www.msn.com/en-us/money/companies/according-to-elon-musk-s-own-math-the-company-formerly-known-as-twitter-has-lost-90-of-its-value-and-could-be-worth-just-4-billion/ar-AA1glx1c)

Muskers excusing this by saying that Elon just talks nonsense and should not be believed are missing the point. Anyone who talks like this and has bank loans and investors should not be running a large corporation, especially a public one. 

&#x200B;",None,None,"""According to Elon Musk’s own math, the company formerly known as Twitter has lost 90% of its value and could be worth just $4 billion""",0.96,https://www.reddit.com/r/RealTesla/comments/16bylr6/according_to_elon_musks_own_math_the_company/
Bnrmn88,None,None,1656357076.0,None,None,vm3b5y,None,None,None,None,t3_vm3b5y,667,None,/r/RealTesla/comments/vm3b5y/is_this_acceptable_quality_for_a_155000_car/,None,1846,None,None,None,"Is this acceptable quality for a 155,000 Car?",0.91,https://v.redd.it/zc2akkzfq7891
jason12745,COTW,None,1704926471.0,None,None,193lipj,None,None,TESLAGENTIAL,True,t3_193lipj,228,None,/r/RealTesla/comments/193lipj/elon_musk_seems_to_endorse_tweet_saying_students/,None,1844,None,None,None,Elon Musk Seems to Endorse Tweet Saying Students at Black Colleges Have Low IQs,0.89,https://gizmodo.com/elon-musk-endorses-tweet-saying-students-at-black-colle-1851156533
SFWarriorsfan,None,None,1709859089.0,None,None,1b9ah98,None,None,OWNER EXPERIENCE,None,t3_1b9ah98,177,None,/r/RealTesla/comments/1b9ah98/jalopnik_tesla_cybertruck_embarrasses_itself_in/,None,1835,None,None,None,Jalopnik: Tesla Cybertruck Embarrasses Itself In Tug Of War With Silverado HD,0.97,https://jalopnik.com/tesla-cybertruck-embarrasses-itself-in-tug-of-war-with-1851317370
16431879196842,None,None,1694535314.0,None,None,16gvk5l,None,None,None,None,t3_16gvk5l,200,None,/r/RealTesla/comments/16gvk5l/sen_elizabeth_warren_demands_probes_of_elon_musk/,None,1835,None,None,None,"Sen. Elizabeth Warren demands probes of Elon Musk, SpaceX after Ukraine revelations",0.95,https://www.seattletimes.com/nation-world/nation-politics/sen-elizabeth-warren-demands-probes-of-elon-musk-spacex-after-ukraine-revelations/
Ursomonie,None,None,1688792242.0,None,None,14tu8d8,None,None,None,None,t3_14tu8d8,310,None,/r/RealTesla/comments/14tu8d8/amtrac_just_did_a_murder_on_threads/,None,1825,None,None,None,Amtrac just did a murder on Threads,0.95,https://i.redd.it/wh8jq4wdaoab1.jpg
Catashtrofe77,None,None,1693073487.0,None,None,162297a,None,None,None,None,t3_162297a,347,None,/r/RealTesla/comments/162297a/this_freaking_guywhy/,None,1817,None,None,None,This Freaking guy....Why?,0.97,https://i.redd.it/5rhimk7qwhkb1.jpg
1FrostySlime,None,None,1688359078.0,None,None,14p8zno,None,None,None,None,t3_14p8zno,914,None,/r/RealTesla/comments/14p8zno/teslas_trying_to_charge_me_4500_plus_tax_to_use/,None,1809,None,None,None,"Tesla's trying to charge me $4,500 (plus tax) to use the entire battery capacity of the battery in my car.",0.88,https://i.redd.it/lvljg4edio9b1.png
dont_get_musked,None,None,1702932499.0,None,None,18lj4m6,None,None,None,None,t3_18lj4m6,344,None,/r/RealTesla/comments/18lj4m6/tesla_has_the_highest_accident_rate_of_any_auto/,None,1741,None,None,None,Tesla Has The Highest Accident Rate Of Any Auto Brand,0.92,https://www.forbes.com/sites/stevebanker/2023/12/18/tesla-has-the-highest-accident-rate-of-any-auto-brand/?sh=3b3f7eb42894
