author,author_flair_text,clicked,created_utc,distinguished,edited,id,is_original_content,is_self,link_flair_text,locked,name,num_comments,over_18,permalink,saved,score,selftext,spoiler,stickied,title,upvote_ratio,url
comacow02,None,None,1686829594.0,None,None,14a0b8u,None,None,None,None,t3_14a0b8u,897,None,/r/TeslaModel3/comments/14a0b8u/to_those_of_you_that_abbreviate_model_3_to_m3/,None,6491,None,None,None,To those of you that abbreviate Model 3 to M3,0.81,https://i.redd.it/1rcjziff666b1.gif
MoodFalse7209,None,None,1686623168.0,None,None,14846e0,None,None,None,None,t3_14846e0,369,None,/r/TeslaModel3/comments/14846e0/sentry_mode_saves_the_day/,None,5962,None,None,None,Sentry mode saves the day,0.93,https://v.redd.it/c8xwiecl4p5b1
Necessary-Medium-509,None,None,1690297047.0,None,None,159autg,None,None,None,None,t3_159autg,2614,None,/r/TeslaModel3/comments/159autg/why_do_this/,None,5590,I mostly see it at this location in PA.,None,None,Why do this??,0.9,https://i.redd.it/db5dch4yk4eb1.jpg
MegaSiege3,None,None,1685155506.0,None,None,13svynk,None,None,None,None,t3_13svynk,794,None,/r/TeslaModel3/comments/13svynk/painful_to_watch/,None,5022,None,None,None,Painful to watch!,0.96,https://v.redd.it/ngdio7cdwb2b1
beerbaron105,None,None,1689789186.0,None,None,1541yl2,None,None,None,None,t3_1541yl2,954,None,/r/TeslaModel3/comments/1541yl2/i_dont_think_i_pressed_it_that_hard/,None,4962,Has anyone done this before? 2021 M3LR,None,None,I don't think I pressed it that hard...,0.96,https://i.redd.it/h0en3jctmycb1.jpg
StreamKimPetras,None,None,1632851828.0,None,None,pxbxng,None,None,None,None,t3_pxbxng,608,None,/r/TeslaModel3/comments/pxbxng/tesla_vandalism_in_la/,None,4530,None,None,None,Tesla Vandalism in LA,0.96,https://v.redd.it/ho030gs59aq71
Appropriate_Yogurt97,None,None,1684408131.0,None,None,13kvu83,None,None,None,None,t3_13kvu83,1117,None,/r/TeslaModel3/comments/13kvu83/first_dent/,None,4489,"She said that $50 will fix that.  
Thanks God I was inside the car.. BTW the parking lot was empty.. it was 9am and all the stores were closed. I don't understand why people need to part so close🤦‍♂️🤦‍♂️🤦‍♂️🤦‍♂️
",None,None,First Dent ,0.91,https://v.redd.it/vokhfkxmok0b1
rworne,None,None,1706814877.0,None,None,1agiz68,None,None,None,None,t3_1agiz68,358,None,/r/TeslaModel3/comments/1agiz68/not_your_typical_sentry_video/,None,4107,Chevy Bro did me a solid in a tight parking space. ,None,None,Not your typical Sentry video,0.96,https://v.redd.it/8cq75t4rw0gc1
ReaditPavan,None,None,1682623988.0,None,None,1313jmg,None,None,None,None,t3_1313jmg,582,None,/r/TeslaModel3/comments/1313jmg/tesla_saved_my_ass_by_capturing_the_hit_n_run/,None,3911,None,None,None,Tesla saved my ass by capturing the hit n run,0.96,https://v.redd.it/oq72ba90tiwa1
Change-Both,None,None,1687015917.0,None,None,14btysb,None,None,None,None,t3_14btysb,766,None,/r/TeslaModel3/comments/14btysb/33k_miles_and_now_i_need_a_new_battery/,None,3903,Was randomly driving around parked and an alert came up put it in service mode and this is what it told me 😪,None,None,33k miles and now I need a new battery 🙃,0.93,https://i.redd.it/64jbjhpgkl6b1.jpg
twin2pimp,None,None,1631961542.0,None,None,pqk4km,None,None,None,None,t3_pqk4km,774,None,/r/TeslaModel3/comments/pqk4km/had_the_car_for_11_days/,None,3723,None,None,None,Had the car for 11 days,0.97,https://v.redd.it/vo1yifdxp8o71
yellowcow1,None,None,1608245589.0,None,None,kf8c1v,None,None,None,None,t3_kf8c1v,689,None,/r/TeslaModel3/comments/kf8c1v/i_scratched_my_2daysold_tesla_everywhere_using/,None,3507,None,None,None,I scratched my 2-days-old tesla everywhere using the metal shovel. I am mad at myself for being this stupid. Just moved to the north and never encounter such big snow storm. Just seeing my neighbors were cleaning the snow using their shovel. I did the same but with the metal one. I AM TOO STUPID.,0.98,https://i.redd.it/2fgdp2gbut561.jpg
doesnotlikeketchup,None,None,1687361640.0,None,None,14fax82,None,None,None,None,t3_14fax82,276,None,/r/TeslaModel3/comments/14fax82/hit_and_run_by_an_amazon_delivery_truck_spoiler_i/,None,3188,Car was parked at a friends house. I was inside when we heard my alarm go off and phone was notified. I didn’t see where the truck went but I immediately saw the damage. A neighbor told me the truck went a certain direction so I chased him down and cornered him in the parking lot. He denied he hit me but I showed him the footage (he quickly shut up). Cops came :),None,None,Hit and Run by an Amazon Delivery Truck. Spoiler: I chased him down and caught him.,0.96,https://v.redd.it/hbahr89g4e7b1
icondor39,None,None,1681056194.0,None,None,12gnehd,None,None,None,None,t3_12gnehd,538,None,/r/TeslaModel3/comments/12gnehd/tesla_has_saved_my_family_yesterday_i_never/,None,3113,None,None,None,Tesla has saved my family yesterday. I never appreciate the collision avoidance system until this happened...,0.93,https://v.redd.it/orn75036tvsa1
shikadam,None,None,1689297609.0,None,None,14z2eu9,None,None,None,None,t3_14z2eu9,932,None,/r/TeslaModel3/comments/14z2eu9/tesla_vs_hail/,None,3107,Every panel and glass need replaced. 2022 any chance it's totalled,None,None,Tesla vs Hail,0.95,https://www.reddit.com/gallery/14z2eu9
CAVU1331,None,None,1685717812.0,None,None,13yf090,None,None,None,None,t3_13yf090,405,None,/r/TeslaModel3/comments/13yf090/autopilot_tried_driving_under/,None,3093,None,None,None,Autopilot tried driving under!,0.92,https://v.redd.it/hlccw5bicm3b1
Uppal2665,None,None,1686460061.0,None,None,146l3ep,None,None,None,None,t3_146l3ep,755,None,/r/TeslaModel3/comments/146l3ep/unfortunately_got_a_kick_to_the_door_a_rock_to/,None,3012,None,None,None,"Unfortunately got a kick to the door, a rock to the quarter panel, and wheel.",0.94,https://v.redd.it/psvswq9lnb5b1
XNY,None,None,1688309705.0,None,None,14oqacs,None,True,None,None,t3_14oqacs,1163,None,/r/TeslaModel3/comments/14oqacs/so_long_tesla/,None,2995,"Just wanted to share some thoughts on my two years of owning a Model 3 SR+. This was my second EV after a little Chevy Bolt which I liked. My car was the Goldilocks of Model 3 LFP, it had the performance motor, USS, and matrix headlights from the earlier production run in 2021. I put about 20,000 from commuting and some road trips to the mountains. 

**Things I Liked**

* Not waiting for oil to warm up, or engines to start. You can just hop in and go and not worry about punching it. 
* The app works well to heat or cool down the car before hopping in
* Autopilot works decently now for highway use. The phantom breaking from a year or so ago is gone. 
* Storage is pretty good with the sub trunk, flat floor inside the cabin, frunk etc.
* Phone key is great being able to just walk up or walk away. 
* Regen and one petal driving is super easy to commute in. 

**Things I disliked**

* Build quality is just like how everyone says. Some of my panels were a bit gapped, which I don’t care about really, but the rear doors never closed well.
* The rear defroster never worked from day one, and required a week long service, where they replaced the rear glass with the wrong part, extending the repair further
* Buying process wasn't the best. I lost a $250 deposit due to some bad info from the local sales person, and also was refused supercharging referral miles I had expected to get. 
* Front glass is extremely thin. I had one windshield replaced and a second crack repair. The Safelite guy said he worked on Teslas constantly.
* I despise the all glass roof. It adds almost nothing in terms of openness for the front occupants, but lets in tons and tons of heat. It’s the worst of both worlds. 
* UI is response, sure, but being completely touch screen based is bad no matter how you shake it. 
* Lack of CarPlay. I want multiple mapping options and better music support that CarPlay offers. 
* Driving experience is meh. You can tell Tesla is a company focused on tech and automation, not a spirited driving experience. The main culprit is the traction control, which cuts in constantly to kill any sort of fun. It would cut power on a straight on ramp I take every morning due to a small bump. This is never a car I’d want to take down a twisty back road. 


Overall, I decided to sell it and get a fun to drive manual transmission before they’re gone for good. Manuals connect you to the car and offer a huge grin factor. It’s also great to have CarPlay back. I also figured we’ll all be driving EVs for the coming decades, it may be my last chance to row my own gears and have fun on a back road. 

My last point is about this Tesla Subreddit. I’m not quite sure why, but i found it to be one of the least helpful, and most toxic car sub I’ve used. Snarky comments, lack of community, frankly idiotic questions about damage or insurance etc. I just found it to be in stark contrast to other car subreddits where people were cordial and enthusiastic about others in the community. Maybe it will get better with time!",None,None,"So long, Tesla",0.82,https://www.reddit.com/r/TeslaModel3/comments/14oqacs/so_long_tesla/
airt_10,None,None,1688590956.0,None,None,14rnabo,None,None,None,None,t3_14rnabo,485,None,/r/TeslaModel3/comments/14rnabo/almost_got_killed_while_driving_in_ohio/,None,2955,None,None,None,Almost got killed while driving in Ohio ,0.96,https://v.redd.it/7djbhh4un7ab1
[deleted],None,None,1685568556.0,None,None,13wyoma,None,None,None,None,t3_13wyoma,413,None,/r/TeslaModel3/comments/13wyoma/i_love_this_camera_system/,None,2922,None,None,None,I love this camera system,0.94,https://v.redd.it/fnmy7l2zi83b1
TwoBlackCats42,None,None,1687898071.0,None,1687983050.0,14kooka,None,True,None,None,t3_14kooka,736,None,/r/TeslaModel3/comments/14kooka/yall_could_ruin_the_name/,None,2907,"I’ve been a huge car enthusiast my whole life. Get excited about most cars. Fast cars, weird cars, rare cars, JDM, muscle, euro, ultralux, the list goes on and on. 

There’s a million different places to celebrate and talk about your cars with people. I’m in a goofy subreddit for my Honda passport. The mom car for dads. I’m in a subreddit for my corvette. Even in a forum for landyacht appreciation. 

In all of these places there’s different ways to celebrate or commune. Wrangler community loves their ducks, hybrids show off their hyper miling and share tips, and a lot of these communities have this unspoken fun game they play where if you see your car out in the wild you park next to it. It’s like a fun “nice car man! I’ve got one too!”.

I love my Tesla Model 3. It’s so cool, powerful, unique, fun. I’ve been eyeing them since before I made anywhere near as much as I make these days. 

You guys however; the community, it’s owners/drivers. You guys are the pitbull owners of car groups. The parents with kids at a restaurant. 

I’ve never had a less welcoming and fun community surrounding a car. I’m in a subreddit FOR HONDA PASSPORTS for crying out loud. 

Every comment I’ve posted has been hit with sarcasm, harassment, passive aggression. My two posts have been beaten into the ground and shit on in the comments. One was asking for advice, the other was just an appreciation post since I saw another Tesla in the wild (we have none out where I live). 

In my lifetime of car collecting and car shows, you guys are truly the worst people I’ve ever met. 

I’m sorry it’s a blanket statement, it can’t be true for everybody. It’s true for my experience so far however. 

I love my Model 3, but some of y’all disgust me.

EDIT add; a small portion of these comments are a prime example 😅

EDIT 2; loving that the upvotes are outweighing the negative comments and downvotes. Glad I’m not alone.

EDIT 3; because my account is being doxxed I’m going to block now lol. Deleting comments of mine in this post to avoid the trolls lol.

EDIT 4; sorry about the pitbull owners and kids at a restaurant joke. Probably should’ve been clear lol. (Owned a pitbull for 12yrs and have a daughter myself.)
Turning off notifications for this post because it has a longer lifespan than my attention span. 

It’s good to know the good people outweigh the bad, they’re just not as loud as the bad are in this sub. 

Thanks for the support y’all. If it makes you feel less nihilistic/more positive about the Tesla community; my posts upvote to downvote ratio as of 1600EST was 86% of people agree, 14% disagree. 

There’s hope ❤️",None,None,Y’all could ruin the name,0.84,https://www.reddit.com/r/TeslaModel3/comments/14kooka/yall_could_ruin_the_name/
glm409,None,None,1649003102.0,None,None,tvd4ps,None,None,None,None,t3_tvd4ps,760,None,/r/TeslaModel3/comments/tvd4ps/at_least_one_tesla_got_one_of_the_7_charging/,None,2784,None,None,None,At least one Tesla got one of the 7 charging spots available!,0.94,https://i.redd.it/tegxbhd9bcr81.jpg
Herrowgayboi,None,None,1684526216.0,None,None,13m60ny,None,None,None,None,t3_13m60ny,279,None,/r/TeslaModel3/comments/13m60ny/was_expecting_a_dent_with_how_close_they_were/,None,2779,None,None,None,Was expecting a dent with how close they were... Left a note to thank them.,0.95,https://v.redd.it/bf0nadprfu0b1
countmeowwt,None,None,1688343759.0,None,None,14p3tbm,None,None,None,None,t3_14p3tbm,449,None,/r/TeslaModel3/comments/14p3tbm/after_realizing_her_kid_dinged_my_car_door_twice/,None,2776,She didn’t leave a note and drove away.,None,None,After realizing her kid dinged my car door twice,0.96,https://i.redd.it/t8tfhqzs8n9b1.jpg
Unanimouspot,None,None,1687801145.0,None,None,14jnu5h,None,None,None,None,t3_14jnu5h,1031,None,/r/TeslaModel3/comments/14jnu5h/model_3_auto_insurance/,None,2748,"
So currently I have auto insurance through Tesla and paying about $163, it could be cheaper but I like to drive at night and that really dinged my driving score. I thought I'd shop around so I asked for a quote from Liberty mutual and here is what I got.
This is for one car by the way, 2023 model 3. I seriously thought this was a joke at first.",None,None,Model 3 auto insurance,0.91,https://i.redd.it/ltg03sjcfe8b1.jpg
LancerEvoXI,None,None,1684808024.0,None,None,13pazg2,None,None,None,None,t3_13pazg2,612,None,/r/TeslaModel3/comments/13pazg2/what_type_of_audi_is_this/,None,2680,None,None,None,What type of Audi is this?,0.93,https://i.redd.it/8dcoafh97j1b1.jpg
MrWongYu,None,None,1686240184.0,None,None,144d7b7,None,None,None,None,t3_144d7b7,190,None,/r/TeslaModel3/comments/144d7b7/getting_ready_to_head_into_the_gym_and_a_very/,None,2478,None,None,None,Getting ready to head into the gym and a very nice chap just stopped to ask me if I was having car troubles. 🤣,0.91,https://i.redd.it/qx2r455tht4b1.jpg
Myzopia,None,None,1687264204.0,None,None,14e9umo,None,None,None,None,t3_14e9umo,140,None,/r/TeslaModel3/comments/14e9umo/loving_the_prereversed_into_angle_of_the_signage/,None,2464,None,None,None,Loving the ‘pre-reversed into’ angle of the signage,0.96,https://i.redd.it/jll05oiq267b1.jpg
yodoyou25,None,None,1687734281.0,None,None,14j09eq,None,None,None,None,t3_14j09eq,273,None,/r/TeslaModel3/comments/14j09eq/day_1_of_our_25_month_road_trip_across_america_to/,None,2416,None,None,None,Day 1 of our 2.5 month Road Trip across America to visit 31 National Parks in our RWD begins tomorrow! Wish us luck 🤙,0.91,https://www.reddit.com/gallery/14j09eq
QuantumGalaxy,None,None,1684103764.0,None,None,13hpmbr,None,None,None,None,t3_13hpmbr,513,None,/r/TeslaModel3/comments/13hpmbr/3_years_first_accident/,None,2331,None,None,None,"3 years, first accident :'(",0.92,https://v.redd.it/gvbcfavljvza1
robbndahood,None,None,1687329161.0,None,None,14ezq70,None,None,None,None,t3_14ezq70,512,None,/r/TeslaModel3/comments/14ezq70/just_a_cool_dude_putting_his_trash_and_coins_in/,None,2316,None,None,None,Just a cool dude putting his trash and coins in the right place.,0.97,https://v.redd.it/fzz2k4lufb7b1
silverkripto,None,None,1697652908.0,None,None,17axdqd,None,None,None,None,t3_17axdqd,320,None,/r/TeslaModel3/comments/17axdqd/dangerous_issue_when_wind_surfing_on_pas_side/,None,2171,"M3 will aggressively swerve left if the front passenger sticks their hand out the window.  The car registers the hand as a person and will try and ""avoid"" them. First time this happened was on a main road traveling about 45mph and the car went into on coming traffic which needless to say was terrifying. We tested this again with the latest update and the issue still exist.",None,None,Dangerous issue when wind surfing on pas side with FSD enabled M3,0.94,https://v.redd.it/a4mut4xh50vb1
bra1ne,None,None,1684260114.0,None,None,13jceuv,None,None,None,None,t3_13jceuv,146,None,/r/TeslaModel3/comments/13jceuv/messing_around_with_midjourney/,None,2151,None,None,None,Messing around with Midjourney.,0.94,https://i.redd.it/b1kmkdj1y90b1.png
Kegbob,None,None,1635419164.0,None,None,qhkj9p,None,None,None,None,t3_qhkj9p,112,None,/r/TeslaModel3/comments/qhkj9p/had_a_stranger_ask_about_the_car_so_i_gave_him_a/,None,2131,None,None,None,Had a stranger ask about the car so I gave him a ride. This is how he walked away.,0.99,https://i.redd.it/5wxjfpu4a6w71.gif
ImUrHuckle63rry,None,None,1686050940.0,None,None,142cymy,None,None,None,None,t3_142cymy,592,None,/r/TeslaModel3/comments/142cymy/one_of_a_handful_of_reason_why_i_cant_use_fsd_on/,None,2092,"Only a 15 minute drive to work, and between this, stopping/slowing at flashing yellows, changing lanes into exit only lanes, only to switch back 2 seconds later and coming up 30 feet short to stops signs... Just frustrating.",None,None,One of a handful of reason why I can't use FSD on the daily,0.96,https://v.redd.it/paxc4bl0vd4b1
trojan511,None,None,1686028113.0,None,None,1424hm4,None,None,None,None,t3_1424hm4,377,None,/r/TeslaModel3/comments/1424hm4/tow_truck_driver_drops_my_model_3/,None,2069,None,None,None,Tow Truck Driver Drops My Model 3 ,0.97,https://v.redd.it/b3h738n7zb4b1
mblend27,None,None,1687463357.0,None,None,14gd0r3,None,None,None,None,t3_14gd0r3,482,None,/r/TeslaModel3/comments/14gd0r3/tesla_service_wanted_75_to_inspect_brakes/,None,2057,"Tesla service tried to disable my dashcam during inspection, broke the swivel mechanism, but it recorded them doing nothing to my car and continuing to charge me for the brake inspection saying it’s fine and giving me a brake width.  BAD TESLA",None,None,Tesla Service wanted $75 to inspect brakes. Refunded me because I had proof they didn’t even lift the car (dashcam),0.96,https://www.reddit.com/gallery/14gd0r3
jedo89,None,None,1686426060.0,None,None,14693r2,None,None,None,None,t3_14693r2,605,None,/r/TeslaModel3/comments/14693r2/bro_really_thought_these_were_the_best_rims_for/,None,2018,None,None,None,Bro really thought these were the best rims for his Model 3?,0.88,https://i.redd.it/aqh2tlygu85b1.jpg
petdetectiveace,None,None,1686256270.0,None,None,144k6ye,None,None,None,None,t3_144k6ye,285,None,/r/TeslaModel3/comments/144k6ye/mobile_charger_was_stolen_out_of_my_secured/,None,1981,None,None,None,"Mobile charger was stolen out of my “secured” garage, $250 for a replacement and $50 for a lock…I think I’ve come up with a solution…",0.97,https://www.reddit.com/gallery/144k6ye
[deleted],None,None,1629211190.0,None,None,p65461,None,None,None,None,t3_p65461,319,None,/r/TeslaModel3/comments/p65461/tesla_buyers_right_now/,None,1982,None,None,None,Tesla buyers right now,0.98,https://i.redd.it/t7og1zxrjxh71.jpg
LynxLegitimate7875,None,None,1653445664.0,None,None,ux7aif,None,None,None,None,t3_ux7aif,121,None,/r/TeslaModel3/comments/ux7aif/seeing_all_the_ding_posts_from_careless_people/,None,1958,None,None,None,"Seeing all the ding posts from careless people with plenty of room, here’s a guy getting out with a foot between our cars carefully.",0.98,https://v.redd.it/eiezu37b9j191
Somethingdangerzone7,None,None,1683989387.0,None,None,13gjj24,None,None,None,None,t3_13gjj24,476,None,/r/TeslaModel3/comments/13gjj24/someone_decided_to_take_their_anger_out_on_me/,None,1943,None,None,None,Someone decided to take their anger out on me,0.94,https://v.redd.it/d8jzlhj0lnza1
joeyc85,None,None,1623682822.0,None,None,nzoqjn,None,None,None,None,t3_nzoqjn,116,None,/r/TeslaModel3/comments/nzoqjn/hard_to_believe_10_years_ago_i_didnt_have_1_to_my/,None,1923,None,None,None,"Hard to believe, 10 years ago I didn’t have $1 to my name. I’ve since adopted two boys as a single male and bought a house a few months ago and now I officially own my first new car ever, a 2021 model 3 SR+ 😍😍",0.98,https://i.redd.it/s0k1rco4x8571.jpg
Ajshan,None,None,1684550180.0,None,None,13mfjyx,None,None,None,None,t3_13mfjyx,512,None,/r/TeslaModel3/comments/13mfjyx/drunk_guy_throws_beer_at_my_car_and_kicks_off/,None,1916,Luckily I saw him later that night and got him arrested. ,None,None,Drunk guy throws beer at my car and kicks off both of my side mirrors.,0.97,https://v.redd.it/1u3ro21kwx0b1
Balleronbudget5,None,None,1688930859.0,None,None,14v7bcn,None,None,None,None,t3_14v7bcn,257,None,/r/TeslaModel3/comments/14v7bcn/hit_and_run_in_front_of_me/,None,1817,Was waiting patiently at the light when the guys in front of me got hit almost head on by some High kid.  Who decided he was not gonna stick around.  Got his license plate for the guy from my camera but it didn’t matter.  The guy’s license plate got stuck into the front of the car. 🫣😬🤣 Check out Videos and pictures.  ,None,None,Hit and Run In front of me,0.97,https://v.redd.it/l2vfomvhqzab1
hjras,None,None,1670871850.0,None,None,zk8326,None,None,None,None,t3_zk8326,549,None,/r/TeslaModel3/comments/zk8326/a_necessary_bumper_sticker_for_some_of_us_these/,None,1814,None,None,None,A necessary bumper sticker for some of us these days...,0.84,https://i.redd.it/2gvvm65v3k5a1.jpg
byteboss91,None,None,1686773254.0,None,None,149hpp5,None,None,None,None,t3_149hpp5,282,None,/r/TeslaModel3/comments/149hpp5/gotta_love_free_charging_at_work_we_have_80_ev/,None,1811,"Most of the cars are Teslas. We also have some IONIQ5, Kia EV 6, VW ID6 and different Plug-in Hybrids charging. On a busy day, you can barely find a spot before lunch time. After lunch time, it’s usually less busy. More worksplaces should do this.",None,None,Gotta Love Free Charging at Work. We have 80 EV Chargers.,0.91,https://www.reddit.com/gallery/149hpp5
M3MacbookAir,None,None,1689874534.0,None,None,154xkpx,None,None,None,None,t3_154xkpx,395,None,/r/TeslaModel3/comments/154xkpx/whats_stopping_me_from_buying_this_with_fsd_for/,None,1810,None,None,None,"What’s stopping me from buying this with FSD for $3,000, buying the cheapest Model 3, and transferring FSD over in Q3?",0.94,https://i.redd.it/52rgu3glo5db1.jpg
SignificantWarning5,None,None,1685892755.0,None,None,140gj6p,None,None,None,None,t3_140gj6p,386,None,/r/TeslaModel3/comments/140gj6p/that_gap_though/,None,1808,None,None,None,That gap though,0.93,https://i.redd.it/31aas4zps04b1.jpg
jab719,None,None,1685277490.0,None,None,13tzh15,None,None,None,None,t3_13tzh15,651,None,/r/TeslaModel3/comments/13tzh15/happy_road_tripping_this_mdw_hope_you_dont_run/,None,1799,None,None,None,Happy road tripping this MDW. Hope you don’t run into 💩’s like this.,0.91,https://i.redd.it/j1m94xt7zl2b1.jpg
grac43,None,None,1684857555.0,None,None,13psl3x,None,None,None,None,t3_13psl3x,275,None,/r/TeslaModel3/comments/13psl3x/someone_posted_a_type_r_i_present_to_you_a_mazda/,None,1783,None,None,None,Someone posted a Type R. I present to you a Mazda,0.97,https://i.redd.it/6mzdp21jan1b1.jpg
Jeermm,None,None,1689969280.0,None,None,155yap3,None,None,None,None,t3_155yap3,614,None,/r/TeslaModel3/comments/155yap3/just_bought_a_brand_new_model_3_awd_didnt_even/,None,1770,None,None,None,Just bought a brand new Model 3 AWD… Didn’t even get to drive it off the lot before this,0.95,https://www.reddit.com/gallery/155yap3
[deleted],None,None,1686404693.0,None,None,1460o0w,None,None,None,None,t3_1460o0w,531,None,/r/TeslaModel3/comments/1460o0w/my_insurance_score_went_down_after_this/,None,1762,None,None,None,My insurance score went down after this,0.9,https://v.redd.it/fvaota7z275b1
Double-Lake-3395,None,None,1686926284.0,None,None,14ayjzq,None,None,None,None,t3_14ayjzq,406,None,/r/TeslaModel3/comments/14ayjzq/first_day_with_my_new_tesla/,None,1756,I was going home with my first new tesla and someone crash into me 20mins later. How unlucky I am?,None,None,First day with my new tesla,0.92,https://i.redd.it/s9cs4box5e6b1.jpg
faiz0217,None,None,1701014676.0,None,None,184dx3y,None,None,None,None,t3_184dx3y,232,None,/r/TeslaModel3/comments/184dx3y/guy_was_stupid_enough_to_tell_the_cop_i_hit_him/,None,1753,None,None,None,"Guy was stupid enough to tell the cop i hit him, dashcam came in handy",0.97,https://v.redd.it/90uu9zqntp2c1
whatmodern,None,None,1682750452.0,None,None,132lgcn,None,None,None,None,t3_132lgcn,338,None,/r/TeslaModel3/comments/132lgcn/i_just_want_to_be_alone_and_eat_sometimes/,None,1743,None,None,None,I just want to be alone and eat sometimes,0.92,https://i.redd.it/w59i20d19twa1.jpg
Illustrious_Lie_7051,None,None,1687640327.0,None,None,14i3g3l,None,None,None,None,t3_14i3g3l,556,None,/r/TeslaModel3/comments/14i3g3l/black_interior_white_interior_change_my_mind/,None,1733,None,None,None,Black interior > white interior. Change my mind,0.82,https://i.redd.it/9k4xy0g5518b1.jpg
Billionaire_Spencer,None,None,1686201459.0,None,None,14405dp,None,None,None,None,t3_14405dp,225,None,/r/TeslaModel3/comments/14405dp/well_heres_something_we_dont_see_every_day/,None,1723,None,None,None,Well here’s something we don’t see every day 😂🤣,0.95,https://i.redd.it/5lfspypnaq4b1.jpg
