author,author_flair_text,clicked,created_utc,distinguished,edited,id,is_original_content,is_self,link_flair_text,locked,name,num_comments,over_18,permalink,saved,score,selftext,spoiler,stickied,title,upvote_ratio,url
Hello_510,None,None,1687484583.0,None,None,14glfrm,None,None,None,None,t3_14glfrm,466,None,/r/TeslaModel3/comments/14glfrm/new_m3_showing_a_phone_previously_connected/,None,1709,I just got home from picking up my M3 and wanted to connect my phone to my car and noticed that someone was already previously connected. Couldn’t be me cuz I just picked it up. I’m also not a destroyer of the pooswah.,None,None,New M3 showing a phone previously connected,0.87,https://i.redd.it/99shl0b1ao7b1.jpg
drizzy2690,None,None,1600555954.0,None,None,iw2h6i,None,None,None,None,t3_iw2h6i,104,None,/r/TeslaModel3/comments/iw2h6i/picked_up_my_baby_on_wednesday_and_idk_if_ill/,None,1692,None,None,None,Picked up my baby on Wednesday and idk if I’ll ever go back to driving a gas vehicle again lol.. #batmobile3.0 #teslamodel3,0.96,https://i.redd.it/yy37ecv2p6o51.jpg
just_killing_time23,None,None,1636600316.0,None,None,qrbga3,None,None,None,None,t3_qrbga3,418,None,/r/TeslaModel3/comments/qrbga3/downtown_chicago_car_keyed_help_us_find_him/,None,1680,None,None,None,"Downtown Chicago car keyed, help us find him.",0.98,https://v.redd.it/36l8tv9gvvy71
NodAlone,None,None,1684878462.0,None,None,13q1wq2,None,None,None,None,t3_13q1wq2,274,None,/r/TeslaModel3/comments/13q1wq2/just_got_my_model3_wrapped/,None,1661,"Wanted to share the results, couldn't be happier with them myself.",None,None,Just got my Model3 wrapped,0.91,https://i.redd.it/6sr56crp0p1b1.jpg
aorickmusic,None,None,1705366875.0,None,None,197pmqn,None,None,None,None,t3_197pmqn,560,None,/r/TeslaModel3/comments/197pmqn/went_into_the_store_while_charging_and_got/,None,1663,None,None,None,Went into the store while charging and got notified of this. ,0.96,https://v.redd.it/sjzg2et9bpcc1
Sweaty_Lemon_41935,None,None,1686021936.0,None,None,142230n,None,None,None,None,t3_142230n,126,None,/r/TeslaModel3/comments/142230n/tesla_mistakes_smokey_sun_for_yellow_lights/,None,1657,Driving up I-74 with the air filled with smoke from Canada’s wildfires and the sun has this weird prehistoric look to it. Tesla kept rendering it as yellow stoplights in the median.,None,None,Tesla Mistakes Smokey Sun for Yellow Lights,0.98,https://v.redd.it/8pwtoyutgb4b1
Comfortable-Phase-10,None,None,1687547666.0,None,1687640941.0,14h71ev,None,True,None,None,t3_14h71ev,681,None,/r/TeslaModel3/comments/14h71ev/this_sub_is_full_of_assholes/,None,1641,"Im always afraid to post anything here, like at all. There's always be assholes that have nothing better to do than to be annoying on purpose. Is this why Tesla owners have a bad rep? 

SMH! 

Edit: no way I can answer all y’all but just glad I’m not the only one. Also some of y’all’s responses are the assholes I’m talking about. Happy Friday either way

Edit 2: this is the perfect example of the types of asses you will find here. They are so mad for no reason. Just had to share. 

u/JibbyClibby

“Oh, you're hesitant to post here, aren't you? Maybe it's because this place is teeming with people like you who would rather whine about the 'keyboard warriors' than contribute anything of value. Is this why Tesla owners have such a rep? Too busy being fragile to drive?

Shaking my head at the irony!

Edit: Overwhelmed by the responses, are we? Probably the most attention you've gotten in a while. Some of the replies just mirror your own behavior, which is too bad. Anyway, have a 'joyous' Friday, or whatever.


/s hehe couldn't resist, we are sofa king funny”",None,None,This sub is full of assholes,0.84,https://www.reddit.com/r/TeslaModel3/comments/14h71ev/this_sub_is_full_of_assholes/
iliark,None,None,1689702137.0,None,None,15351xx,None,None,None,None,t3_15351xx,169,None,/r/TeslaModel3/comments/15351xx/my_3_was_vandalized_and_sentry_caught_nothing/,None,1611,None,None,None,My 3 was vandalized and sentry caught nothing :(,0.91,https://www.reddit.com/gallery/15351xx
snobrrdr,None,None,1686897228.0,None,None,14ap8gi,None,None,None,None,t3_14ap8gi,574,None,/r/TeslaModel3/comments/14ap8gi/look_how_much_i_saved_driving_a_tesla/,None,1604,One dollar.,None,None,Look how much $ I saved driving a Tesla!,0.93,https://i.redd.it/1m3u7hejrb6b1.jpg
Comfortable-Phase-10,None,None,1700675991.0,None,None,181fd6r,None,None,None,None,t3_181fd6r,410,None,/r/TeslaModel3/comments/181fd6r/be_careful_out_there_with_car_thieves/,None,1597,"So I just caught someone trying to get into my car at the gym. First time I’m glad Tesla uses unusual door handles. No clue what he was trying to do, or if he was just curious. 

Seen the guy at the gym before, will most likely report him to the staff. Not sure if there’s anything else to do. 

Yall stay safe and turn on pin to drive just in case. ",None,None,Be careful out there with car thieves ,0.9,https://v.redd.it/7ch1b2quux1c1
Runme69,None,None,1658071450.0,None,None,w19urd,None,None,None,None,t3_w19urd,572,None,/r/TeslaModel3/comments/w19urd/tesla_hate_is_real_check_out_this_drunk_freak/,None,1595,None,None,None,Tesla hate is real.. check out this drunk freak from NC break off the drivers side window of my week old Tesla and then reach in grab my arm bruising it and grabbed my phone and threw it to the ground. Thanks to sentry… he’s now been charged w assault vandalism over $1000 (felony),0.93,https://v.redd.it/giav4k0ot6c91
kycjesus,None,None,1613429834.0,None,None,lkpimv,None,None,None,None,t3_lkpimv,50,None,/r/TeslaModel3/comments/lkpimv/update_finally_test_drove_the_correct_australian/,None,1581,None,None,None,Update: finally test drove the correct Australian model.,0.94,https://i.redd.it/54f50siq1qh61.jpg
marry320320,None,None,1690505232.0,None,None,15birzu,None,None,None,None,t3_15birzu,637,None,/r/TeslaModel3/comments/15birzu/average_diesel_truck_owner/,None,1579,Barbie song is the cherry on top,None,None,Average Diesel Truck Owner,0.95,https://v.redd.it/xakakw4zrleb1
kappleget,None,None,1623041959.0,None,None,nu4dk9,None,None,None,None,t3_nu4dk9,186,None,/r/TeslaModel3/comments/nu4dk9/thank_you_tesla_autopilot_avoided_both_cars_and/,None,1541,None,None,None,Thank you Tesla! Autopilot avoided both cars and kept me on the road.,0.98,https://v.redd.it/kvs7t9ywyr371
Serpenio_,None,None,1592928683.0,None,None,hehgrp,None,None,None,None,t3_hehgrp,143,None,/r/TeslaModel3/comments/hehgrp/thoughts_on_such_an_option/,None,1547,None,None,None,Thoughts on such an option?,0.98,https://i.redd.it/j537bpo9po651.jpg
redditissocoolyoyo,None,None,1687113016.0,None,None,14crfuv,None,None,None,None,t3_14crfuv,502,None,/r/TeslaModel3/comments/14crfuv/what_do_you_guys_think_of_this_body_kit/,None,1539,Saw this kit on a performance model 3 what do US think? Kind of interesting,None,None,What do you guys think of this body kit?,0.86,https://i.redd.it/tx1g4vm6lt6b1.jpg
melgish,None,None,1623959332.0,None,None,o260u7,None,None,None,None,t3_o260u7,72,None,/r/TeslaModel3/comments/o260u7/drove_my_coworkers_to_lunch_one_day_a_couple_of/,None,1525,None,None,None,"Drove my coworkers to lunch one day. A couple of months later, this happened...",0.99,https://i.redd.it/i9js7h5crv571.jpg
PitVital,None,None,1682529939.0,None,None,12zr1ij,None,None,None,None,t3_12zr1ij,247,None,/r/TeslaModel3/comments/12zr1ij/glad_she_looked_around_before_using_my_car_as_a/,None,1520,None,None,None,"Glad she looked around before using my car as a trolley stopper, UK",0.94,https://v.redd.it/cs2suwoc1bwa1
56CubbyMN,None,None,1630341996.0,None,None,pelyjz,None,None,None,None,t3_pelyjz,123,None,/r/TeslaModel3/comments/pelyjz/look_who_i_met_at_a_supercharger/,None,1519,None,None,None,Look who I met at a Supercharger!,0.97,https://i.redd.it/3z3zcnk8yik71.jpg
Sankarihauta27,None,None,1690212161.0,None,None,158dps1,None,None,None,None,t3_158dps1,321,None,/r/TeslaModel3/comments/158dps1/almost_made_it_5_years/,None,1520,None,None,None,Almost made it 5 years,0.97,https://v.redd.it/9ld7vcpbkxdb1
mandrew-98,None,None,1686679963.0,None,None,148lruz,None,None,None,None,t3_148lruz,465,None,/r/TeslaModel3/comments/148lruz/yay_i_can_charge_at_the_park_never_mind_im_good/,None,1510,"Was excited to be able to see all these chargers at a small park until I went to plug in and saw the price of 83cents per kWh. 

What a waste of infrastructure lol",None,None,Yay I can charge at the park…. Never mind I’m good,0.94,https://www.reddit.com/gallery/148lruz
1st_principles,None,None,1682668334.0,None,None,131l3al,None,None,None,None,t3_131l3al,282,None,/r/TeslaModel3/comments/131l3al/my_birthday_today_56_amazed_i_made_it_this_far/,None,1505,Those who went through the depth of the 2008 global financial crisis will understand. I am thankful for every single day. PTL. 🙏🏼,None,None,"My birthday today, 56. Amazed I made it this far. Mind blown I have this in my driveway.",0.94,https://i.redd.it/nr1odk0vgmwa1.jpg
ser_raddington,None,None,1686340329.0,None,None,145eymn,None,None,None,None,t3_145eymn,268,None,/r/TeslaModel3/comments/145eymn/is_it_time_to_ask_for_an_electric_charger_at_work/,None,1491,None,None,None,Is it time to ask for an electric charger at work?,0.9,https://i.redd.it/0zzqvblfr15b1.jpg
DoomshrooM8,None,None,1703582068.0,None,None,18r485j,None,None,None,None,t3_18r485j,725,None,/r/TeslaModel3/comments/18r485j/hydroplaned/,None,1490,"I hydroplaned real bad a few days ago - wheels locked up, car turned but kept going up the freeway perpendicularly, tires blew out, sparks flew, missed a deep ditch by a few dozen feet, snapped into the hill on the shoulder, did a 360 and stopped mostly back in the shoulder… the most jarring experience of my adult life, the whole time it felt like the car was just about to flip over and I’d become a statistic. 

Just wanted to share my little Xmas miracle to say slow down in the rain, making it in one piece is all that matters.

Count your blessings where you can 🙏🏼

Happy Holidays everyone 🎁",None,None,Hydroplaned =(,0.92,https://v.redd.it/n5f4rdryvl8c1
[deleted],None,None,1686074048.0,None,None,142nwuc,None,None,None,None,t3_142nwuc,563,None,/r/TeslaModel3/comments/142nwuc/rip_to_anyone_who_bought_a_tesla_during_the_peak/,None,1486,None,None,None,RIP to anyone who bought a Tesla during the peak. Holy cow!,0.9,https://i.redd.it/zr123eirrf4b1.png
gurjitsk,None,None,1682268753.0,None,None,12whwes,None,None,None,None,t3_12whwes,307,None,/r/TeslaModel3/comments/12whwes/when_your_girlfriend_takes_the_car_night_before/,None,1477,None,None,None,When your girlfriend takes the car night before and doesn’t charge it…,0.91,https://i.redd.it/aqvrz8apgpva1.jpg
TheWoozyy,None,None,1632213337.0,None,None,pseood,None,None,None,None,t3_pseood,90,None,/r/TeslaModel3/comments/pseood/i_had_a_nice_little_laugh_watching_this_sentry/,None,1465,None,None,None,I had a nice little laugh watching this sentry clip.,0.99,https://v.redd.it/bvqbc1hmito71
joohoo55,None,None,1657594794.0,None,None,vx0q1a,None,None,None,None,t3_vx0q1a,168,None,/r/TeslaModel3/comments/vx0q1a/tesla_charger_holder_diy/,None,1441,None,None,None,Tesla charger holder DIY,0.96,https://www.reddit.com/gallery/vx0q1a
redditguy422,None,None,1684688831.0,None,None,13o0c66,None,None,None,None,t3_13o0c66,441,None,/r/TeslaModel3/comments/13o0c66/night_driving_is_a_premium_scam/,None,1440,The other day I drove 12 miles at 3:30 am to pick up somebody at the airport. I went from 98 to 95 driver score for that. Does that seem right to anyone? I could see if I drive regularly but I don't.,None,None,Night driving is a premium scam.,0.92,https://i.redd.it/zmiwkkfuc91b1.jpg
frac_noob,None,None,1679932794.0,None,None,123rcf0,None,None,None,None,t3_123rcf0,528,None,/r/TeslaModel3/comments/123rcf0/tesla_park_asssist_no_uss_model_it_said_i_had/,None,1428,None,None,None,Tesla Park Asssist - no USS model. It said I had 50cm (20inches) remaining ☠️,0.96,https://i.imgur.com/zasOrHS.jpg
adequateapples,None,None,1684847791.0,None,None,13po8zr,None,None,None,None,t3_13po8zr,168,None,/r/TeslaModel3/comments/13po8zr/saw_someone_post_an_audi_a5_here_i_present_to_you/,None,1429,None,None,None,Saw someone post an Audi A5 here. I present to you a Type R,0.97,https://i.redd.it/gb8j5l1hhm1b1.jpg
AccidentalCEO82,None,None,1614461275.0,None,None,ltxqws,None,None,None,None,t3_ltxqws,147,None,/r/TeslaModel3/comments/ltxqws/just_got_my_car_back_wrapped_in_matte_java/,None,1416,None,None,None,Just got my car back. Wrapped in Matte Java Metallic. Love it.,0.98,https://i.redd.it/jfnrjaen83k61.jpg
Brandbrandford336,None,None,1685666603.0,None,None,13xyhl4,None,None,None,None,t3_13xyhl4,359,None,/r/TeslaModel3/comments/13xyhl4/almost_made_it_to_a_yearthank_you_sentry/,None,1422,"Love how they waited for the car passing then just kept going to hit my car…

Wish there was a way to speed this process up. Cops and insurance are taking their time to get me information. I am happy though with how well sentry works.",None,None,Almost made it to a year…thank you Sentry!!,0.98,https://v.redd.it/4av1gkj84i3b1
Fun-Growth-923,None,None,1681188059.0,None,None,12i8l3j,None,None,None,None,t3_12i8l3j,277,None,/r/TeslaModel3/comments/12i8l3j/survived_but_pretty_beaten_up/,None,1417,Full b pillar intrusion on my friends 3 today.,None,None,Survived but pretty beaten up,0.97,https://i.redd.it/qjmtbrs878ta1.jpg
stevty,None,None,1692054165.0,None,None,15ra84y,None,None,None,None,t3_15ra84y,543,None,/r/TeslaModel3/comments/15ra84y/does_anyone_know_where_these_plates_are_from/,None,1404,None,None,None,Does anyone know where these plates are from?,0.93,https://v.redd.it/7gyjox3ep5ib1
iharshap,None,None,1650050190.0,None,None,u4fipj,None,None,None,None,t3_u4fipj,168,None,/r/TeslaModel3/comments/u4fipj/got_my_model_3_back_from_the_wrap_house/,None,1410,None,None,None,Got my model 3 back from the wrap house!,0.97,https://www.reddit.com/gallery/u4fipj
Middle-Note-9160,None,None,1707579458.0,None,None,1anizi7,None,None,None,None,t3_1anizi7,162,None,/r/TeslaModel3/comments/1anizi7/caught_a_collision_center_doing_96_in_a_55_in_my/,None,1396,Definitely won’t forget to set the speed limiter next time…i can’t believe i got a screenshot lol.,None,None,Caught a collision center doing 96 in a 55 in my car,0.97,https://i.redd.it/v95egpbf2shc1.jpeg
CashNasty5036,None,None,1688797829.0,None,None,14tw1t5,None,None,None,None,t3_14tw1t5,924,None,/r/TeslaModel3/comments/14tw1t5/my_car_got_broken_into/,None,1391,"Idek what to do at this point. I filled a service request let’s see how it goes. 
",None,None,My car got broken into,0.94,https://v.redd.it/zwusmjszqoab1
fearminion,None,None,1683498605.0,None,None,13b55ax,None,None,None,None,t3_13b55ax,296,None,/r/TeslaModel3/comments/13b55ax/model_3_highland_taillights/,None,1390,None,None,None,Model 3 Highland Taillights,0.85,https://i.imgur.com/Wp5bAe3.jpg
Aware-Ad-8046,None,None,1691969197.0,None,None,15qdqvi,None,None,None,None,t3_15qdqvi,397,None,/r/TeslaModel3/comments/15qdqvi/didnt_think_one_of_us_could_ding_my_door_3_times/,None,1386,"First time posting. Model 3 driver hit my door 3 times. It looks as if he is completely aware of what he is doing without feeling slight remorse. It happened minutes after I parked and left. 

Could I get some advice on what to do next and help with identifying his license plate? I am in CA and have tesla insurance. Ding is not too big but it hurts my heart how he did it knowingly 3x!!! Totally psyco vibes too. 
",None,None,Didn't think one of us could ding my door 3 times and not feel remorseful. Does this count as hit and run? Help with license plate! ,0.9,https://v.redd.it/wkbx1o7soyhb1
therealdieseld,None,None,1683819373.0,None,None,13equsz,None,None,None,None,t3_13equsz,434,None,/r/TeslaModel3/comments/13equsz/i_forgot_to_get_my_emissions_inspected_in_nj/,None,1370,None,None,None,I forgot to get my emissions inspected in NJ.. sorry guys,0.94,https://i.redd.it/kttiwcvhj9za1.jpg
zschiffman1,None,None,1665077440.0,None,None,xxb1q0,None,None,None,None,t3_xxb1q0,133,None,/r/TeslaModel3/comments/xxb1q0/tesla_owner_registration/,None,1357,Too true.,None,None,Tesla Owner Registration…,0.96,https://v.redd.it/5165at2l08s91
